slug,title,category,type,cuisine,viewCount,ingredients_tr,steps_tr,tipNote_current,servingSuggestion_current
tereyagli-tavuklu-pirinc-tava-hindistan-usulu,Tereyağlı Tavuklu Pirinç Tava,tavuk-yemekleri,YEMEK,in,0,Tavuk göğsü 500 gr | Pirinç 1.5 su bardağı | Tereyağı 2 yemek kaşığı | Su 3 su bardağı,1. Tavuğu 6 dakika soteleyin. || 2. Pirinç ve suyu ekleyin. || 3. Tereyağı ile 10 dakika pişirin.,Tereyağını son 4 dakikada eklemek pirinçte parlak bir doku bırakır.,Sıcak servis edin.
tereyagli-yesil-mercimekli-ic-pilav-osmaniye-usulu,Tereyağlı Yeşil Mercimekli İç Pilav,makarna-pilav,YEMEK,tr,0,Pirinç 1.5 su bardağı | Haşlanmış yeşil mercimek 1 su bardağı | Tereyağı 1.5 yemek kaşığı | Su 2.5 su bardağı,1. Pirinci yıkayın. || 2. Tereyağında kısa süre çevirin. || 3. Mercimekle birlikte 14 dakika pişirin.,Mercimeği önceden diri haşlamak pilavda tane formunu korur.,Sıcak servis edin.
thai-milk-tea-granita-tay-usulu,Thai Milk Tea Granita,icecekler,ICECEK,th,0,Demlenmiş siyah çay 2 su bardağı | Süt 1 su bardağı | Şeker 3 yemek kaşığı | Buz 0.5 su bardağı,1. Çayı şekerle karıştırın. || 2. Süt ekleyip sığ kaba alın. || 3. Karışımı dondurup arada kazıyın.,Karışımı birkaç kez çatalla kazımak daha ince kristal verir.,Soğuk içecek için 1 saat önceden bardakları buzdolabında bekletin; sıcak camda aroma zayıflar.
thit-kho,Thit Kho,et-yemekleri,YEMEK,vn,0,Dana döş 800 gr | Haşlanmış yumurta 5 adet | Soya sosu 4 yemek kaşığı | Şeker 2 yemek kaşığı,1. Şekeri tencerede amber renk alana kadar eritin. || 2. Eti ve soya sosunu ekleyip 50 dakika pişirin. || 3. Yumurtaları ekleyip 20 dakika daha pişirin.,"Kuşbaşıyı yüksek ateşte kısa sürede mühürleyin, sonra ateşi kısın; su bırakmaz, tat daha konsantre olur.",Yanına sıcak ekmek ve bir kase turşu iliştirip geleneksel tabağa dönüştürün.
tinto-de-verano-punch-ispanya-usulu,Tinto de Verano Punch,kokteyller,KOKTEYL,es,0,Kırmızı şarap 2 su bardağı | Soda 1 su bardağı | Portakal dilimi 4 adet | Buz 1 su bardağı,1. Sürahiye buz koyun. || 2. Şarap ve sodayı ekleyin. || 3. Portakalla birlikte servis edin.,Narenciyeyi ince kesmek kadehte daha temiz bir aromatik yayılım verir.,"Şeffaf sürahide sunmak içeceğin rengini öne çıkarır, bardakları yanına ayrı dizin."
tinto-limon-slush-ispanya-usulu,İspanya Tinto Limon Slush,icecekler,ICECEK,es,0,Kırmızı şarap 1 su bardağı | Limonata 1 su bardağı | Buz 1 su bardağı,1. Şarap ve limonatayı karıştırın. || 2. Karışımı dondurucuya alın. || 3. Bir kez çatalla kazıyıp servis edin.,Karışımı dondururken bir kez çatalla kazımak slush dokusunu inceltir.,Soğuk içecek için 1 saat önceden bardakları buzdolabında bekletin; sıcak camda aroma zayıflar.
tirit,Tirit,et-yemekleri,YEMEK,tr,0,Dana eti 700 gr | Bayat ekmek 1 adet | Yoğurt 2 su bardağı | Tereyağı 50 gr | Pul biber 1 tatlı kaşığı,"1. Eti 90 dakika haşlayıp didikleyin. || 2. Ekmeği küp doğrayıp servis tabağına alın. || 3. Ekmeği sıcak et suyuyla ıslatın. || 4. Et, yoğurt ve tereyağlı biberle servis edin.",Ekmeği servis öncesi et suyuyla ıslatın; beklerse hamurlaşır.,Üzerine tereyağlı pul biber gezdirin.
tiritli-tavuk-kapama-samsun-usulu,Samsun Tiritli Tavuk Kapama,tavuk-yemekleri,YEMEK,tr,0,Tavuk kalça 700 gr | Pide ekmeği 2 adet | Kuru soğan 1 adet | Karabiber 0.5 çay kaşığı | Tuz 1 çay kaşığı,1. Tavuğu soğan ve tuzla birlikte 25 dakika haşlayın. || 2. Pideyi parçalayıp bir servis tabağına yayın. || 3. Pideyi suyuyla ıslatıp üstüne didiklenmiş tavuğu koyarak servis edin.,Pideleri servis öncesi 2-3 kepçeden fazla ıslatmamak tabanın tamamen dağılmasını önler.,Üzerine karabiber serperek sıcak servis edin.
tkemali,Tkemali,soslar-dippler,SOS,ru,0,Ekşi erik 600 gr | Sarımsak 3 diş | Kişniş 0.5 demet | Pul biber 1 çay kaşığı,1. Erikleri 20 dakika az suyla pişirin. || 2. Çekirdekleri ayırıp eriği püre yapın. || 3. Sarımsak ve baharatla 5 dakika kaynatın.,Erikleri kabukları çatlayana kadar pişirin; çekirdekler kolay ayrılır.,"Izgara et, patates veya kızarmış sebze yanında soğuk servis edin."
toast-skagen,Toast Skagen,aperatifler,APERATIF,se,0,Karides 250 gr | Mayonez 3 yemek kaşığı | Dereotu 0.25 demet | Ekmek dilimi 4 adet,1. Karidesi mayonez ve dereotuyla karıştırın. || 2. Ekmek dilimlerini tavada 2 dakika kızartın. || 3. Karides karışımını ekmeklerin üstüne paylaştırın.,Karidesleri fazla karıştırmayın; iri parçalar ekmeğin üstünde daha iyi durur.,Limon kabuğu rendesi ve dereotuyla servis edin.
toast-skagen-patates-kase-isvec-usulu,Toast Skagen Patates Kâsesi,aperatifler,APERATIF,se,0,Patates 4 adet | Karides 200 gr | Mayonez 2 yemek kaşığı | Ekşi krema 2 yemek kaşığı | Dereotu 0.25 demet,1. Patatesleri haşlayıp ortalarını açın. || 2. Karidesli karışımı hazırlayın. || 3. Patatesleri doldurup servis edin.,Patatesi sıcak değil ılık kullanmak karidesli karışımın akmasını azaltır.,Ahşap tepside 3-4 meze bir arada sunmak için yanına acılı ezme ve kısırla eşleştirin.
tod-mun-pla,Tod Mun Pla,aperatifler,APERATIF,th,0,Beyaz balık fileto 500 gr | Kırmızı köri ezmesi 1.5 yemek kaşığı | Yumurta 1 adet | Taze fasulye 100 gr,"1. Balık, köri ezmesi ve yumurtayı macun kıvamına getirin. || 2. İnce fasulyeyi karıştırıp küçük köfteler yapın. || 3. Köfteleri yağda 10-12 dakika kızartın.",Balığı derisi aşağıda tavaya koyup 3 dakika kıpırdatmadan bırakın; deri ayrılmadan çıtır tabaka oluşur.,Tatlı acı biber sosu ile servis edin.
tofu-lotus-salad-vietnam-usulu,Vietnam Tofu Lotus Salata,salatalar,SALATA,vn,0,Tofu 250 gr | Lotus kökü 150 gr | Lime suyu 2 yemek kaşığı | Havuç 1 adet | Kişniş 0.25 demet,1. Tofuyu küp doğrayıp 6 dakika tavada kızartın. || 2. Lotus kökünü ince dilimleyip kısa haşlayın. || 3. Tüm malzemeyi lime suyuyla karıştırıp servis edin.,Tofuyu iyi kurulamak tavada daha güzel renk almasını sağlar.,"Soğuk servis için 10 dakika buzdolabında dinlendirin, yanına lavaş ekmek koyun."
tofulu-kabak-noodle,Tofulu Kabak Noodle,sebze-yemekleri,YEMEK,us,0,Kabak 3 adet | Tofu 250 gr | Soya sosu 2 yemek kaşığı | Susam 1 tatlı kaşığı,1. Kabağı ince şeritler halinde hazırlayın. || 2. Tofuyu tavada 6 dakika renk alana kadar pişirin. || 3. Kabağı ve soya sosunu ekleyip 3 dakika çevirin ve susamla servis edin.,Kabağı tavada kısa tutmak su salmasını azaltır.,Üzerine susam serperek sıcak servis edin.
tokaj-sarap-spritz-macaristan-usulu,Tokaj Şarap Spritz,kokteyller,KOKTEYL,hu,0,Beyaz şarap 1 su bardağı | Soda 1 su bardağı | Üzüm 6 adet | Buz 1 su bardağı,1. Bardağı buzla doldurun. || 2. Şarap ve sodayı ekleyin. || 3. Üzümlerle servis edin.,Şarabı iyi soğutmak kokteylde berrak bir asidite bırakır.,Üzerine bir dilim taze zencefil ve küçük bir yaprak fesleğen ekleyip aromayı canlandırın.
tokat-bati,Bat,salatalar,SALATA,tr,0,İnce bulgur 1 su bardağı | Domates salçası 1 yemek kaşığı | Ceviz 0.5 su bardağı | Taze soğan 4 adet | Maydanoz 0.5 demet | Asma yaprağı 12 adet | Limon suyu 3 yemek kaşığı,"1. Bulguru az sıcak suyla 10 dakika şişirin. || 2. Salça, ceviz, taze soğan, maydanoz ve limon suyunu bulgura karıştırın. || 3. Karışımı hafif sulu kıvamda bırakıp asma yapraklarıyla servis edin.",İnce bulguru suyla bir anda boğmayın; ekledikçe kıvamını daha kontrollü kurarsınız.,Asma yapraklarıyla birlikte serin servis edin.
tokat-cemeni,Tokat Çemeni,kahvaltiliklar,KAHVALTI,tr,0,Domates salçası 3 yemek kaşığı | Ceviz 0.75 su bardağı | Sarımsak 2 diş | Kimyon 0.5 çay kaşığı | Zeytinyağı 2 yemek kaşığı | Köy ekmeği 6 dilim,"1. Cevizi rondoda iri kalacak şekilde çekin. || 2. Salça, sarımsak, kimyon ve zeytinyağını cevizle karıştırın. || 3. Tokat çemenini 10 dakika dinlendirip köy ekmeğiyle servis edin.",Cevizi fazla çekmeden bırakmak çemenin ekmek üstünde daha canlı doku vermesini sağlar.,Yanına kızarmış köy ekmeği ile serin servis edin.
tokat-kebabi,Tokat Kebabı,et-yemekleri,YEMEK,tr,0,Kuzu eti 700 gr | Patlıcan 3 adet | Patates 3 adet | Domates 4 adet | Tırnak pide 2 adet,1. Et ve sebzeleri şişlere sırayla dizin. || 2. 200°C fırında 55 dakika pişirin. || 3. Tırnak pide üzerinde servis edin.,Sebzeleri etle aynı büyüklükte kesin; şişte aynı anda pişer.,Tırnak pide üzerinde servis edin.
tokat-yapragi-dolmasi,Tokat Yaprağı Dolması,sebze-yemekleri,YEMEK,tr,0,Asma yaprağı 60 adet | Pirinç 1.5 su bardağı | Dana kıyma 250 gr | Limon suyu 3 yemek kaşığı,1. Yaprakları 3 dakika sıcak suda bekletin. || 2. Pirinç ve kıymayla iç hazırlayın. || 3. Dolmaları 55 dakika kısık ateşte pişirin.,"Yağlı parçalar için eklenti yağa gerek yok, kendi yağıyla kızarır ve karamelize olur.","Yanına cacık ve közlenmiş biber, üstüne tereyağında kavrulmuş fıstıkla tabakta verin."
tom-kha-gai,Tom Kha Gai,corbalar,CORBA,th,0,Tavuk göğsü 450 gr | Kokos içeceği 400 ml | Galangal 30 gr | Limon otu 2 dal | Lime suyu 2 yemek kaşığı | Tuz 1 çay kaşığı,"1. Kokos içeceği, 400 ml su, galangal ve limon otunu 8 dakika kaynatın. || 2. İnce doğranmış tavuğu ekleyip 10 dakika pişirin. || 3. Lime suyu ve tuzla dengeleyip sıcak servis edin.","Galangalı servis öncesi çıkarın; aroması kalır, lifli dokusu kaseye geçmez.",Lime dilimi ve kişnişle sunun.
tomato-egg-stir-fry-cin-ev-usulu,Tomato Egg Stir-Fry,kahvaltiliklar,KAHVALTI,cn,0,Domates 3 adet | Yumurta 4 adet | Taze soğan 2 dal | Sıvı yağ 2 yemek kaşığı | Tuz 0.5 çay kaşığı,1. Yumurtayı çırpıp tavada kısa pişirin. || 2. Domatesi aynı tavada 4 dakika çevirin. || 3. Yumurtayı geri ekleyip servis edin.,Yumurtayı fazla kurutmadan geri eklemek yemeği daha yumuşak tutar.,"Sahan tabakta, yanına taze kıyılmış nane ve bir kase zeytinyağlı yoğurtla verin."
tomato-rasam-hint-usulu,Tomato Rasam,corbalar,CORBA,in,0,Domates 4 adet | Sarımsak 2 diş | Karabiber 0.5 çay kaşığı | Kimyon 0.5 çay kaşığı | Su 4 su bardağı,1. Baharatları kısa süre yağda açın. || 2. Domates ve suyu ekleyin. || 3. Çorbayı 12 dakika kaynatıp servis edin.,Baharatları kısa süre yağda açmak rasamın aromasını daha derin hale getirir.,"Çorbayı ince uzun kaselere alıp yanına turşu tabağı koyun, küçük bir kase pul biber ayrı dursun."
tonkatsu,Tonkatsu,et-yemekleri,YEMEK,jp,0,Dana kontrfile 600 gr | Un 80 gr | Yumurta 2 adet | Panko 150 gr | Tonkatsu sosu 4 yemek kaşığı,"1. Etleri inceltip un, yumurta ve pankoya bulayın. || 2. 170°C yağda 10-12 dakika kızartın. || 3. Dilimleyip sosla servis edin.","Unu soğuk sıvıda çırparak ekleyin, kaynayan tencereye direkt atmaktan kaçının.",Taze dilimlenmiş ekmek ve yanında mevsim yeşillikleriyle derin tabakta verin.
tonkatsu-sos,Tonkatsu Sos,soslar-dippler,SOS,jp,0,Ketçap 5 yemek kaşığı | Worcestershire sos 3 yemek kaşığı | Soya sosu 1 yemek kaşığı | Şeker 1 tatlı kaşığı,"1. Ketçap, Worcestershire sos ve soya sosunu karıştırın. || 2. Şekeri ekleyip eriyene kadar çırpın. || 3. Sosu 10 dakika dinlendirin.",Ketçap ve Worcestershire oranını bozmayın; fazla ketçap sosu domatesli yapar.,"Tavuk katsu, patates kroket veya lahana salatası yanında servis edin."
torrijas,Torrijas,tatlilar,TATLI,es,0,Bayat ekmek 8 dilim | Süt 2 su bardağı | Yumurta 2 adet | Şeker 4 yemek kaşığı | Tarçın 1 tatlı kaşığı,1. Sütü ılıtıp ekmek dilimlerini kısa süre içine batırın. || 2. Ekmekleri çırpılmış yumurtaya bulayıp tavada iki yüzünü kızartın. || 3. Şeker ve tarçın karışımına bulayıp servis edin.,Ekmeği süt karışımında fazla bekletmeyin; tavaya alınırken dağılmamalı.,Üzerine tarçınlı şeker serpip ılık servis edin.
tortilla-de-camarones-ispanya-usulu,Tortilla de Camarones,aperatifler,APERATIF,es,0,Küçük karides 200 gr | Un 0.75 su bardağı | Su 0.75 su bardağı | Tuz 0.5 çay kaşığı | Sıvı yağ 1 su bardağı,"1. Un, su ve tuzu çırpın. || 2. Karidesi hamura ekleyin. || 3. Kaşıkla döküp 4 dakika kızartın.",Hamuru ince tutmak çıtırlığı artırır.,"Tabakta küçük kaselerde veya ayrı bölümlerde sunun; yanına limon dilimi, taze ekmek ve bir kase zeytin yerleştirin."
tortilla-espanola,Tortilla Espanola,kahvaltiliklar,KAHVALTI,es,0,Patates 4 adet | Yumurta 6 adet | Soğan 1 adet | Zeytinyağı 0.5 su bardağı | Tuz 1 çay kaşığı,1. Patates ve soğanı yağda 15 dakika yumuşatın. || 2. Yumurtaları çırpıp patatesle karıştırın. || 3. Tavada 6 dakika pişirip çevirin. || 4. Diğer yüzünü 4 dakika pişirin.,Tavayı kapakla ters çevirin; kalın omlet kırılmadan döner.,Ilık veya oda sıcaklığında dilimleyin.
tortilla-kahvalti-sandvici-ispanya-usulu,Tortilla Kahvaltı Sandvici,kahvaltiliklar,KAHVALTI,es,0,Patates 2 adet | Yumurta 3 adet | Köy ekmeği 4 dilim | Kaşar peyniri 60 gr | Zeytinyağı 1 yemek kaşığı,1. Patatesi 6 dakika tavada çevirin. || 2. Yumurta ile omleti hazırlayın. || 3. Ekmeğin arasına alıp servis edin.,Patatesi ince doğramak omletin ortasında hamluk kalmasını önler.,Tahta tepsiye yerleştirip bir sürahi portakal suyu ve karmaşık tane ekmek dilimleri ekleyin.
tortillali-ispanak-tava-ispanya-usulu,Tortillalı Ispanak Tava,kahvaltiliklar,KAHVALTI,es,0,Yumurta 4 adet | Ispanak 150 gr | Patates 2 adet | Zeytinyağı 1 yemek kaşığı,1. Patatesi 6 dakika pişirin. || 2. Ispanağı ekleyin. || 3. Yumurtayla 6 dakika pişirin.,Patatesi ince dilimlemek tavada daha hızlı yumuşamasını sağlar.,Ilık servis edin.
tosca-kaka,Tosca Kaka,tatlilar,TATLI,se,0,Un 220 gr | Toz şeker 180 gr | Yumurta 2 adet | Tereyağı 120 gr | File badem 100 gr,1. Kek hamurunu hazırlayıp kalıba dökün. || 2. Keki 180°C fırında 22 dakika pişirin. || 3. Bademli üst karışımı ekleyip 8 dakika daha pişirin.,Bademli üst katı fırının son 8 dakikasında eklemek yanmadan karamelize olmasını sağlar.,Dilimleyip kahve ile ılık servis edin.
tostones,Tostones,atistirmaliklar,ATISTIRMALIK,cu,0,Yeşil plantain 3 adet | Sıvı yağ 500 ml | Tuz 1 çay kaşığı | Limon 1 adet,1. Plantainleri kalın dilimleyin. || 2. Dilimleri 5 dakika kızartıp ezin. || 3. Ezilmiş dilimleri 5-7 dakika daha kızartın.,Pişmeye başlamadan önce tüm malzemeleri doğrayıp tezgahta dizmek tat dengesini bozmadan akışı korur.,Taze dilimlenmiş ekmek ve yanında mevsim yeşillikleriyle derin tabakta verin.
tostones-con-mojo,Tostones con Mojo,atistirmaliklar,ATISTIRMALIK,cu,0,Yeşil muz 3 adet | Ayçiçek yağı 250 ml | Sarımsak 2 diş | Lime suyu 2 yemek kaşığı,1. Muzları kalın dilimleyip 4 dakika kızartın. || 2. Dilimleri çıkarıp bastırarak yassılaştırın. || 3. Tekrar kızartıp sarımsaklı lime sosuyla servis edin.,İlk kızartmadan sonra muzları düz tabanla bastırın; çatlamadan genişlerler.,Mojo sosu ayrı kasede verip üstüne iri tuz serpin.
tostones-rellenos,Tostones Rellenos,aperatifler,APERATIF,cu,0,Yeşil muz 3 adet | Karides 200 gr | Sarımsak 2 diş | Kişniş 0.25 demet | Ayçiçek yağı 2 su bardağı,1. Muzları dilimleyip 4 dakika kızartın. || 2. Dilimleri bastırıp küçük kaseler haline getirin ve yeniden kızartın. || 3. Karidesi sarımsakla soteleyip kaselere doldurun ve kişnişle servis edin.,Muz dilimlerini ilk kızartmada sadece yumuşatın; ikinci turda şekil korunur.,Üzerine kişniş yaprakları koyarak sıcak servis edin.
tostones-yumurta-tabagi-kuba-usulu,Tostones Yumurta Tabağı,kahvaltiliklar,KAHVALTI,cu,0,Yeşil muz 2 adet | Yumurta 2 adet | Avokado 1 adet | Ayçiçek yağı 3 yemek kaşığı,1. Muzları dilimleyip kızartın. || 2. Tostonesları ezip tekrar kızartın. || 3. Yumurta ile servis edin.,Muz dilimlerini iki aşamada kızartmak tostones dokusunu belirginleştirir.,Tahta tepsiye yerleştirip bir sürahi portakal suyu ve karmaşık tane ekmek dilimleri ekleyin.
tottori-curry,Tottori Curry,makarna-pilav,YEMEK,jp,0,Tavuk but 500 gr | Patates 2 adet | Havuç 2 adet | Japon köri bloğu 100 gr,1. Tavuk ve sebzeleri 10 dakika kavurun. || 2. Su ekleyip 20 dakika pişirin. || 3. Köri bloğunu ekleyip 5 dakika karıştırın.,"Kemikli parçaları kemik yüzü üste gelecek şekilde yerleştirin, sular aşağı iner ve eti nemli tutar.",Tabakta pembesi tabaka halinde dilimleyip üstüne pişme suyundan iki kaşık dökün.
toum,Toum,soslar-dippler,SOS,me,0,Sarımsak 80 gr | Ayçiçek yağı 300 ml | Limon suyu 3 yemek kaşığı | Tuz 1 çay kaşığı,1. Sarımsak ve tuzu mutfak robotunda püre yapın. || 2. Yağı çok yavaş ekleyerek robotu çalıştırın. || 3. Limon suyunu ekleyip 1 dakika daha çekin.,Yağı ip gibi yavaş ekleyin; hızlı dökülürse emülsiyon kırılır.,"Tavuk şiş, patates kızartması veya lavaş yanında küçük porsiyonla servis edin."
toyga-asi-corbasi-yozgat-usulu,Toyga Aşı Çorbası,corbalar,CORBA,tr,0,Yoğurt 1.5 su bardağı | Dövme 0.75 su bardağı | Haşlanmış nohut 1 su bardağı | Yumurta 1 adet | Nane 0.5 çay kaşığı,1. Dövmeyi yumuşayana kadar pişirin. || 2. Yoğurtlu terbiyeyi hazırlayın. || 3. Nohutla birleştirip 8 dakika daha pişirin.,Yoğurdu kesmemek için terbiye kısmını yavaş ısıt.,"Küçük bir kase yoğurt, yanında maydanoz yaprakları ve bir limon dilimiyle sunun."
toyga-corbasi-anadolu-usulu,Anadolu Usulü Toyga Çorbası,corbalar,CORBA,tr,0,Yoğurt 400 gr | Dövme buğday 1 su bardağı | Haşlanmış nohut 1 su bardağı | Yumurta 1 adet | Nane 1 tatlı kaşığı | Tereyağı 30 gr,1. Dövmeyi yumuşayana kadar 25 dakika pişirin. || 2. Yoğurt ve yumurtayı çırpıp nohutla birlikte tencereye ekleyin. || 3. Çorbayı 8 dakika daha pişirip naneli tereyağıyla tamamlayın.,Yoğurtlu terbiyeyi tencereye azar azar alıştırın; kesilmeden pürüzsüz kalır.,Üzerine nane ve tereyağı gezdirerek sıcak servis edin.
trabzon-kayganasi,Trabzon Kayganası,kahvaltiliklar,KAHVALTI,tr,0,Yumurta 3 adet | Un 4 yemek kaşığı | Süt 0.5 su bardağı | Tereyağı 1 tatlı kaşığı,"1. Yumurta, un ve sütü çırpın. || 2. Tavayı yağlayıp harcı ince dökün. || 3. İki yüzünü toplam 6 dakika pişirin.",Hamuru çok koyu bırakmayın; kaygana ince yayıldığında doğru doku çıkar.,Yanına beyaz peynir ve çay koyarak servis edin.
trabzon-misir-corbasi,Trabzon Mısır Çorbası,corbalar,CORBA,tr,0,Haşlanmış mısır 2 su bardağı | Haşlanmış kuru fasulye 1 su bardağı | Soğan 1 adet | Tereyağı 25 gr | Tuz 0.5 çay kaşığı,1. Soğanı tereyağında 5 dakika çevirin. || 2. Kuru fasulye ve 1 litre sıcak su ekleyip 20 dakika kaynatın. || 3. Mısır ve tuzu ekleyip çorbayı 8 dakika daha pişirin.,Haşlanmış mısırı son aşamada ekleyin; taneler canlı kalır.,Üzerine tereyağı gezdirerek sıcak servis edin.
trabzon-vakfikebir-ekmegi,Trabzon Vakfıkebir Ekmeği,hamur-isleri,KAHVALTI,tr,0,Un 1 kg | Ekşi maya 200 gr | Su 650 ml | Tuz 20 gr,"1. Un, su, maya ve tuzla hamur yoğurun. || 2. Hamuru 60 dakika dinlendirip şekil verin. || 3. 230°C fırında 55 dakika pişirin.",Kalın kabuk için fırına ilk 10 dakikada buhar verin.,"Tereyağı, bal veya mıhlama yanında dilimleyerek servis edin."
treacle-tart,Treacle Tart,tatlilar,TATLI,gb,0,Tart hamuru 1 adet | Altın şurup 300 gr | Ekmek kırıntısı 150 gr | Limon kabuğu 1 tatlı kaşığı | Krema 1 kase,"1. Tart tabanını 10 dakika kör pişirin. || 2. Şurup, kırıntı ve limon kabuğunu karıştırıp tabana dökün. || 3. Tartı 25 dakika daha pişirin ve servis edin.",Tabanı çatalla delmek kör pişirme sırasında kabarmayı azaltır.,Bir kaşık krema ile ılık servis edin.
trilece,Trileçe,tatlilar,TATLI,tr,0,Yumurta 5 adet | Un 1.5 su bardağı | Şeker 1 su bardağı | Süt 3 su bardağı | Krema 200 ml | Süt tozu 3 yemek kaşığı | Karamel sos 1 su bardağı,"1. Yumurta ve şekeri çırpıp unla karıştırın, 170°C fırında 25-30 dakika pişirin. || 2. Süt, krema ve süt tozunu çırpıp delinen kekin üzerine dökün. || 3. Karamel sosu yayın ve tatlıyı 3 saat soğutun.",Keki kürdanla delip sütlü karışımı yavaşça dökün; her kat eşit ıslanır.,Karamel sos tamamen soğuyunca dilimleyin.
tropik-smoothie,Tropik Smoothie,smoothie-shake,ICECEK,tr,0,Ananas 200 gr | Mango 150 gr | Kokos suyu 250 ml | Lime suyu 1 yemek kaşığı,"1. Ananas, mango, kokos suyu ve lime suyunu blendera alın. || 2. 45 saniye karıştırın. || 3. Soğuk bardaklara paylaştırın.",Donmuş meyve kullanın; buz eklemeden yoğun ve soğuk kalır.,Uzun bardakta lime kabuğu rendesiyle servis edin.
tteokbokki,Tteokbokki,atistirmaliklar,ATISTIRMALIK,kr,0,Pirinç keki 500 gr | Gochujang 3 yemek kaşığı | Soya sosu 1 yemek kaşığı | Şeker 1 yemek kaşığı | Susam 1 çay kaşığı,"1. Tencerede 500 ml su, gochujang, soya sosu ve şekeri çırpın. || 2. Pirinç keklerini ekleyip orta ateşte 15 dakika, sos koyulaşana kadar pişirin. || 3. Susam serpip sıcak servis edin.",Sos kaşığın arkasını kaplayacak yoğunluğa geldiğinde pirinç kekleri doğru kıvamdadır.,Susam ve ince doğranmış yeşil soğanla sıcak servis edin.
tulumba-tatlisi,Tulumba Tatlısı,tatlilar,TATLI,tr,0,Un 2 su bardağı | Su 2 su bardağı | Yumurta 3 adet | Sıvı yağ 3 su bardağı | Şeker 3 su bardağı | Su 2.5 su bardağı | Limon suyu 1 tatlı kaşığı,"1. Şerbeti 15 dakika kaynatıp soğutun. || 2. Su ve unu pişirip hamuru soğutun, yumurtaları tek tek yedirin. || 3. Hamuru yağa sıkıp kızartın ve soğuk şerbete alın.",Hamuru yağa soğukken sıkıp yağı yavaş ısıtın; tulumbalar içten pişer.,Şerbetini çektikten sonra servis edin.
tulumlu-domates-pidesi-tekirdag-usulu,Tekirdağ Tulumlu Domates Pidesi,hamur-isleri,APERATIF,tr,0,Un 2 su bardağı | Domates 2 adet | Tulum peyniri 120 gr | Zeytinyağı 1 yemek kaşığı | Su 0.75 su bardağı,1. Hamuru yoğurup 10 dakika dinlendirin. || 2. Domates ve peyniri hamurun üstüne yayın. || 3. 220°C fırında 12 dakika pişirin.,Domatesin çekirdek kısmını azaltmak pidenin tabanını ıslatmamasına yardım eder.,"Tabakta küçük kaselerde veya ayrı bölümlerde sunun; yanına limon dilimi, taze ekmek ve bir kase zeytin yerleştirin."
tulumlu-lor-kavurmasi-erzurum-usulu,Erzurum Tulumlu Lor Kavurması,kahvaltiliklar,KAHVALTI,tr,0,Lor peyniri 200 gr | Tulum peyniri 80 gr | Tereyağı 15 gr | Karabiber 0.25 çay kaşığı,1. Tereyağını tavada eritin. || 2. Peynirleri ekleyip 3 dakika çevirin. || 3. Karabiber ekleyip sıcak servis edin.,Peyniri çok yüksek ateşte tutmamak yağının ayrışmasını önler.,Tahta tepsiye yerleştirip bir sürahi portakal suyu ve karmaşık tane ekmek dilimleri ekleyin.
tulumlu-patates-gozleme-van-usulu,Tulumlu Patates Gözleme,hamur-isleri,KAHVALTI,tr,0,Un 2 su bardağı | Patates 3 adet | Tulum peyniri 120 gr | Su 0.75 su bardağı,1. Hamuru yoğurun. || 2. İç harçla kapatın. || 3. Gözlemeyi tavada 8 dakika pişirin.,İç harcı ezilmiş ve kuru tutmak gözlemenin kolay açılmasını sağlar.,"Sahan tabakta, yanına taze kıyılmış nane ve bir kase zeytinyağlı yoğurtla verin."
tunnbrod-rulo-isvec-usulu,Tunnbröd Rulo,kahvaltiliklar,KAHVALTI,se,0,Tunnbröd 4 adet | Krem peynir 150 gr | Füme somon 150 gr | Dereotu 0.25 demet,1. Ekmeğe krem peynir sürün. || 2. Somon ve dereotunu yerleştirin. || 3. Rulo yapıp dilimleyin.,Ekmeği çok sıkı sarmamak kesmeyi kolaylaştırır.,"Kişi başı küçük tava, yanında taze maydanoz ve dilimlenmiş tereyağıyla geleneksel kahvaltı kurgula."
turo-rudi-parfe-macar-usulu,Túró Rudi Parfe,tatlilar,TATLI,hu,0,Lor peyniri 250 gr | Süzme yoğurt 0.5 su bardağı | Bitter çikolata 80 gr | Çilek 1 su bardağı,1. Lor ve yoğurdu pürüzsüz olana kadar karıştırın. || 2. Bardaklara meyve ve çikolatayla katmanlayın. || 3. Parfeyi kısa süre soğutup servis edin.,Parfeyi kısa süre soğutmak kaşıkta daha düzgün durmasını sağlar.,Yanına kuru incir dilimi ve bir kaşık yoğurtla kontrastlı tadım tabağı oluşturun.
turos-barack-kup-macar-usulu,Macar Túrós Barack Kup,tatlilar,TATLI,hu,0,Lor peyniri 250 gr | Kayısı 4 adet | Bal 1 yemek kaşığı | Limon kabuğu rendesi 0.5 çay kaşığı,1. Lor peyniri ve limon kabuğunu karıştırın. || 2. Kayısıyı küçük doğrayıp balla harmanlayın. || 3. Kuplara kat kat doldurup soğuk servis edin.,Kayısıyı çok ezmemek kup içinde farklı dokular bırakır.,"Altına bir kaşık vişne reçeli, yanına soğuk süt bardağı koyarak çocuklu sofralara hazırlayın."
turos-batyu,Túrós Batyu,hamur-isleri,KAHVALTI,hu,0,Milföy hamuru 8 adet | Lor peyniri 250 gr | Toz şeker 3 yemek kaşığı | Yumurta 1 adet,"1. Lor, şeker ve yumurtayı karıştırın. || 2. İçi hamura koyup bohça gibi kapatın. || 3. Çörekleri 190°C fırında 20 dakika pişirin.",İçi çok sulu bırakmamak çöreğin ortasının fırında açılmasını engeller.,Pudra şekeri serperek ılık servis edin.
turos-csusza-macar-usulu,Túrós Csusza,makarna-pilav,YEMEK,hu,0,Erişte 300 gr | Lor peyniri 200 gr | Ekşi krema 1 su bardağı | Tereyağı 20 gr,1. Erişteyi haşlayıp suyunun birazını ayırın. || 2. Tereyağı ve ekşi kremayı tavada ısıtın. || 3. Erişteyi ve lor peynirini sosa katıp karıştırarak servis edin.,Makarnanın suyundan birkaç kaşık ayırmak peyniri daha kremamsı yaymaya yardımcı olur.,Üzerine ekstra karabiber serperek sıcak servis edin.
