slug,title,type,category,cuisine,stepCount,score,issues,ingredients_tr,current_steps_tr
kefirli-pancar-kase-rus-usulu,Rus Kefirli Pancar Kâse,CORBA,corbalar,ru,3,3,few-steps,Pancar 3 adet | Kefir 2 su bardağı | Dereotu 0.25 demet | Salatalık 1 adet,1. Pancarı 18 dakika haşlayıp küp doğrayın. || 2. Salatalık ve dereotunu doğrayın. || 3. Tüm malzemeyi kefirle karıştırıp soğuk servis edin.
gul-sirkeli-tavuk-isparta-usulu,Isparta Gül Sirkeli Tavuk,YEMEK,tavuk-yemekleri,tr,3,3,few-steps,Tavuk kalça 600 gr | Kuru soğan 1 adet | Gül sirkesi 2 yemek kaşığı | Zeytinyağı 2 yemek kaşığı | Pirinç pilavı 2 su bardağı,"1. Tavuğu yağda 6 dakika mühürleyin. || 2. Soğanı ekleyip 5 dakika daha pişirin. || 3. Sirkeyi katıp 10 dakika kısık ateşte pişirin, pilavla servis edin."
yumurtali-eriste-kavurmasi-kirsehir-usulu,Kırşehir Yumurtalı Erişte Kavurması,YEMEK,makarna-pilav,tr,3,3,few-steps,Erişte 250 gr | Yumurta 2 adet | Tereyağı 25 gr | Karabiber 0.25 çay kaşığı,1. Erişteyi 8 dakika haşlayıp süzün. || 2. Tereyağında erişteyi 2 dakika çevirin. || 3. Yumurtayı ekleyip 2 dakika daha karıştırarak pişirin.
bal-kremali-un-helvasi-bingol-usulu,Bingöl Bal Kremalı Un Helvası,TATLI,tatlilar,tr,3,3,few-steps,Un 1 su bardağı | Tereyağı 70 gr | Bal 3 yemek kaşığı | Krema 0.5 su bardağı,1. Unu tereyağında 8 dakika kavurun. || 2. Kremayı ekleyip karışımı toparlayın. || 3. Balı katıp helvayı sıcak servis edin.
adacayli-lor-dip-balikesir-usulu,Balıkesir Adaçaylı Lor Dip,SOS,soslar-dippler,tr,4,3,few-steps,Lor peyniri 200 gr | Adaçayı 1 tatlı kaşığı | Zeytinyağı 2 yemek kaşığı | Ekmek 4 dilim,1. Adaçayını çok ince kıyın. || 2. Zeytinyağını hafif ısıtıp adaçayını 30 saniye çevirin. || 3. Lor peynirini adaçaylı yağla karıştırıp pürüzlü dip kıvamı verin. || 4. Ekmek dilimlerini kızartıp dip ile birlikte servis edin.
uborkali-patates-kofte-macar-usulu,Macar Uborkalı Patates Köfte,YEMEK,sebze-yemekleri,hu,3,3,few-steps,Patates 5 adet | Un 3 yemek kaşığı | Yumurta 1 adet | Salatalık 1 adet | Karabiber 0.5 çay kaşığı,1. Patatesleri haşlayıp ezin. || 2. Un ve yumurtayla harç yapıp köfte şekli verin. || 3. Köfteleri tavada kızartıp salatalıkla servis edin.
hardaliyeli-uzum-sorbesi-kirklareli-usulu,Kırklareli Hardaliyeli Üzüm Sorbesi,TATLI,tatlilar,tr,3,3,few-steps,Üzüm suyu 3 su bardağı | Hardaliye 1 su bardağı | Toz şeker 2 yemek kaşığı | Limon suyu 1 yemek kaşığı,1. Tüm malzemeyi 3 dakika ısıtıp şekeri eritin. || 2. Karışımı sığ kaba alıp dondurun. || 3. İki kez çatalla kazıyıp tekrar dondurarak servis edin.
turo-rudi-parfe-macar-usulu,Túró Rudi Parfe,TATLI,tatlilar,hu,3,3,few-steps,Lor peyniri 250 gr | Süzme yoğurt 0.5 su bardağı | Bitter çikolata 80 gr | Çilek 1 su bardağı,1. Lor ve yoğurdu pürüzsüz olana kadar karıştırın. || 2. Bardaklara meyve ve çikolatayla katmanlayın. || 3. Parfeyi kısa süre soğutup servis edin.
welsh-rarebit-bake-ingiliz-usulu,Welsh Rarebit Bake,KAHVALTI,hamur-isleri,gb,3,3,few-steps,Köy ekmeği 4 dilim | Cheddar peyniri 180 gr | Hardal 1 tatlı kaşığı | Süt 0.25 su bardağı,"1. Peynir, hardal ve sütü karıştırın. || 2. Karışımı ekmeklerin üstüne yayın. || 3. 180°C fırında 12 dakika pişirin."
kasik-boregi-yozgat-usulu,Yozgat Kaşık Böreği,KAHVALTI,hamur-isleri,tr,3,3,few-steps,Un 1.5 su bardağı | Yumurta 2 adet | Yoğurt 1 su bardağı | Beyaz peynir 120 gr,"1. Un, yumurta ve yoğurdu çırpın. || 2. Peyniri ekleyip harcı karıştırın. || 3. Hamuru tavada kaşık kaşık pişirerek servis edin."
mantarli-simit-dolmasi-balikesir-usulu,Balıkesir Mantarlı Simit Dolması,APERATIF,hamur-isleri,tr,3,3,few-steps,Simit 2 adet | Mantar 250 gr | Kaşar peyniri 80 gr | Süt 0.5 su bardağı | Karabiber 0.5 çay kaşığı,1. Mantarları tavada 6 dakika soteleyin. || 2. Simitleri sütle hafifçe nemlendirip içlerini doldurun. || 3. Üzerine kaşar serpip 190°C fırında 12 dakika pişirin.
kabak-cekirdekli-corek-aksaray-usulu,Aksaray Kabak Çekirdekli Çörek,KAHVALTI,hamur-isleri,tr,3,3,few-steps,Un 3.5 su bardağı | Süt 1 su bardağı | Instant maya 1 tatlı kaşığı | Kabak çekirdeği 0.75 su bardağı,1. Hamuru yoğurup 15 dakika dinlendirin. || 2. Hamura şekil verip çekirdekleri üstüne bastırın. || 3. Çöreği 190°C fırında 22 dakika pişirin.
susamli-armut-tatlisi-bursa-usulu,Bursa Susamlı Armut Tatlısı,TATLI,tatlilar,tr,3,3,few-steps,Armut 4 adet | Su 2 su bardağı | Toz şeker 0.5 su bardağı | Susam 2 yemek kaşığı | Limon suyu 1 yemek kaşığı,1. Armutları soyup ikiye bölün. || 2. Şekerli limonlu suda 15 dakika pişirin. || 3. Kavrulmuş susam serperek servis edin.
naneli-yogurtlu-patlican-corbasi-burdur-usulu,Burdur Naneli Yoğurtlu Patlıcan Çorbası,CORBA,corbalar,tr,3,3,few-steps,Patlıcan 2 adet | Yoğurt 1.5 su bardağı | Su 3 su bardağı | Nane 1 çay kaşığı | Sarımsak 1 diş,"1. Patlıcanları közleyip ince doğrayın. || 2. Yoğurt ve suyu ılıştırıp tencereye alın. || 3. Patlıcan, sarımsak ve naneyi ekleyip kısa süre ısıtarak servis edin."
mantarli-grechnevaya-kasha-rus-usulu,Mantarlı Grechnevaya Kasha,YEMEK,makarna-pilav,ru,5,3,no-time,Karabuğday 1.5 su bardağı | Mantar 250 gr | Kuru soğan 1 adet | Ayçiçek yağı 2 yemek kaşığı,1. Karabuğdayı kısa süre kavurup kenara alın. || 2. Soğan ve mantarı yağda yüksek ateşte soteleyin. || 3. Karabuğdayı ve suyu ekleyip kaynamaya bırakın. || 4. Yemeği 15 dakika pişirip 10 dakika demlendirin. || 5. Karışımı karıştırıp sıcak halde servis edin.
erikli-tavuk-salata-kocaeli-usulu,Kocaeli Erikli Tavuk Salata,SALATA,salatalar,tr,3,3,few-steps,Haşlanmış tavuk göğsü 250 gr | Kırmızı erik 3 adet | Kıvırcık 0.5 adet | Zeytinyağı 1 yemek kaşığı | Limon suyu 1 tatlı kaşığı,"1. Tavuğu didikleyin, eriği ince dilimleyin. || 2. Yeşillikleri doğrayıp tüm malzemeyi karıştırın. || 3. Sosu gezdirip salatayı servis edin."
lorlu-kabak-cicegi-tostu-izmir-usulu,İzmir Lorlu Kabak Çiçeği Tostu,KAHVALTI,kahvaltiliklar,tr,3,3,few-steps,Sandviç ekmeği 4 dilim | Kabak çiçeği 6 adet | Lor peyniri 120 gr | Zeytinyağı 1 tatlı kaşığı,1. Kabak çiçeklerini iri doğrayıp lorla karıştırın. || 2. Harçla ekmekleri doldurup dışına az yağ sürün. || 3. Tostu tavada iki yüzünü toplam 6 dakika pişirin.
tandir-otlu-gozleme-sirnak-usulu,Şırnak Tandır Otlu Gözleme,KAHVALTI,hamur-isleri,tr,3,3,few-steps,Un 3 su bardağı | Su 1.25 su bardağı | Karışık ot 300 gr | Zeytinyağı 1 yemek kaşığı,1. Un ve suyla hamur yoğurup 10 dakika dinlendirin. || 2. Otları yağla karıştırıp açtığınız hamura yayın. || 3. Gözlemeyi tavada iki yüzünü toplam 8 dakika pişirin.
tulumlu-lor-kavurmasi-erzurum-usulu,Erzurum Tulumlu Lor Kavurması,KAHVALTI,kahvaltiliklar,tr,3,3,few-steps,Lor peyniri 200 gr | Tulum peyniri 80 gr | Tereyağı 15 gr | Karabiber 0.25 çay kaşığı,1. Tereyağını tavada eritin. || 2. Peynirleri ekleyip 3 dakika çevirin. || 3. Karabiber ekleyip sıcak servis edin.
tahinli-kuru-elma-lokmasi-nevsehir-usulu,Nevşehir Tahinli Kuru Elma Lokması,ATISTIRMALIK,atistirmaliklar,tr,3,3,few-steps,Kuru elma 150 gr | Tahin 3 yemek kaşığı | Tarçın 0.25 çay kaşığı | Susam 1 yemek kaşığı,1. Kuru elmayı 5 dakika ılık suda bekletin. || 2. Elmayı tahin ve tarçınla karıştırıp yuvarlayın. || 3. Lokmaları susama bulayıp servis edin.
koper-soslu-fasulye-polonya-usulu,Polonya Koper Soslu Fasulye,YEMEK,sebze-yemekleri,pl,3,3,few-steps,Taze fasulye 400 gr | Krema 0.5 su bardağı | Dereotu 0.25 demet | Tereyağı 15 gr,1. Fasulyeyi 10 dakika haşlayın. || 2. Krema ve tereyağını kısa süre ısıtın. || 3. Dereotunu ekleyip fasulyeyle buluşturarak servis edin.
zahterli-nohutlu-krep-hatay-usulu,Hatay Zahterli Nohutlu Krep,KAHVALTI,kahvaltiliklar,tr,3,3,few-steps,Un 1 su bardağı | Yumurta 2 adet | Haşlanmış nohut 1 su bardağı | Zahter 1 yemek kaşığı | Su 1 su bardağı,"1. Un, yumurta, su ve yarım zahteri çırparak krep hamuru hazırlayın. || 2. Nohudu kalan zahterle ezip iç harcı yapın. || 3. Krepleri pişirip harçla doldurarak servis edin."
kabakli-bulgur-dolmasi-diyarbakir-usulu,Diyarbakır Kabaklı Bulgur Dolması,YEMEK,sebze-yemekleri,tr,3,3,few-steps,Yuvarlak kabak 6 adet | İnce bulgur 1 su bardağı | Kuru soğan 1 adet | Domates rendesi 1 su bardağı | Zeytinyağı 2 yemek kaşığı,1. Kabakların içini dikkatlice oyun. || 2. Bulgurlu iç harcı hazırlayıp kabaklara doldurun. || 3. Dolmaları domatesli sosta 24 dakika pişirin.
nohutlu-kuru-bamya-yahnisi-konya-usulu,Konya Nohutlu Kuru Bamya Yahnisi,YEMEK,baklagil-yemekleri,tr,3,3,few-steps,Kuru bamya 150 gr | Haşlanmış nohut 1.5 su bardağı | Kuru soğan 1 adet | Domates salçası 1 tatlı kaşığı | Limon 1 adet | Zeytinyağı 2 yemek kaşığı | Tuz 1 çay kaşığı,"1. Kuru bamyayı limonlu suda 10 dakika haşlayıp süzün. || 2. Soğanı yağ ve salçayla 3 dakika çevirin. || 3. Bamya, nohut, su ve tuzu katıp 30 dakika pişirin."
fairy-bread-avustralya-usulu,Fairy Bread,ATISTIRMALIK,atistirmaliklar,au,4,3,few-steps,Sandviç ekmeği 4 dilim | Tereyağı 30 gr | Renkli şekerleme 3 yemek kaşığı,1. Sandviç ekmeklerinin kenarlarını isterseniz incecik kesin. || 2. Tereyağını ekmeklerin tüm yüzeyine eşit kalınlıkta sürün. || 3. Renkli şekerlemeyi tereyağlı yüzeye bastırarak kaplayın. || 4. Ekmekleri üçgen parçalara kesip hemen servis edin.
tahinli-portakal-cilbiri-antalya-usulu,Antalya Tahinli Portakal Çılbırı,KAHVALTI,kahvaltiliklar,tr,3,3,few-steps,Yumurta 4 adet | Tahin 2 yemek kaşığı | Portakal suyu 3 yemek kaşığı | Sarımsak 1 diş | Zeytinyağı 1 yemek kaşığı,"1. Tahin, portakal suyu ve sarımsağı karıştırın. || 2. Yumurtaları kaynar suda 3 dakika poşe edin. || 3. Sosu tabağa yayıp yumurtaları üzerine alarak servis edin."
kardamomlu-elma-coplari-isvec-usulu,İsveç Kardamomlu Elma Çöpleri,ATISTIRMALIK,tatlilar,se,3,3,few-steps,Elma 4 adet | Toz şeker 2 yemek kaşığı | Kakule 0.5 çay kaşığı | Limon suyu 1 tatlı kaşığı,"1. Elmaları kalın çubuklar halinde kesin. || 2. Şeker, kakule ve limon suyuyla harmanlayın. || 3. 190°C fırında 15 dakika pişirip servis edin."
nohutlu-bulgur-kapama-ankara-usulu,Ankara Nohutlu Bulgur Kapama,YEMEK,baklagil-yemekleri,tr,3,3,few-steps,Pilavlık bulgur 1.5 su bardağı | Haşlanmış nohut 1 su bardağı | Kuru soğan 1 adet | Salça 1 tatlı kaşığı,1. Soğanı salçayla birlikte 3 dakika çevirin. || 2. Bulguru ekleyip 1 dakika daha kavurun. || 3. Nohut ve 2.5 su bardağı sıcak su ekleyip 18 dakika pişirin.
tutlu-yarma-corbasi-erzincan-usulu,Erzincan Tutlu Yarma Çorbası,CORBA,corbalar,tr,3,3,few-steps,Yarma 1 su bardağı | Kuru dut 0.5 su bardağı | Su 1.25 lt | Tuz 0.5 çay kaşığı,1. Yarmayı yıkayıp tencereye alın. || 2. 1.25 litre suyla 20 dakika pişirin. || 3. Kuru dutu ekleyip 4 dakika daha kaynatın.
tallarin-verdes-peru-usulu,Tallarines Verdes,YEMEK,makarna-pilav,pe,3,3,few-steps,Spagetti 400 gr | Fesleğen 1 demet | Süt 0.75 su bardağı | Peynir 80 gr | Zeytinyağı 1 yemek kaşığı,"1. Makarnayı haşlayın. || 2. Fesleğen, süt, peynir ve yağı çekin. || 3. Sosu makarnayla karıştırıp servis edin."
hashasli-cevizli-irmik-tatlisi-usak-usulu,Uşak Haşhaşlı Cevizli İrmik Tatlısı,TATLI,tatlilar,tr,3,3,few-steps,İrmik 1 su bardağı | Tereyağı 60 gr | Ceviz 0.5 su bardağı | Haşhaş 2 yemek kaşığı | Toz şeker 0.75 su bardağı,1. Tereyağında irmiği 8 dakika kavurun. || 2. Şeker ve 1.5 su bardağı sıcak su ekleyip karıştırın. || 3. Ceviz ve haşhaşı katıp tatlıyı toparlayarak servis edin.
kuru-domatesli-guvec-beypazari-usulu,Beypazarı Kuru Domatesli Güveç,YEMEK,baklagil-yemekleri,tr,3,3,few-steps,Haşlanmış nohut 2 su bardağı | Kuru domates 8 adet | Kabak 2 adet | Soğan 1 adet | Su 1.5 su bardağı,1. Soğanı ve kabağı tencerede 5 dakika çevirin. || 2. Nohut ve kuru domatesi ekleyin. || 3. Suyu katıp yemeği 20 dakika pişirin.
dugulu-bulgur-pilavi-nevsehir-usulu,Düğüülü Bulgur Pilavı,YEMEK,makarna-pilav,tr,3,3,few-steps,Düğü bulgur 1.5 su bardağı | Soğan 1 adet | Domates 2 adet | Zeytinyağı 1 yemek kaşığı | Su 2 su bardağı,1. Soğanı zeytinyağında 3 dakika çevirin. || 2. Bulgur ve domatesi ekleyin. || 3. Suyu katıp pilavı 15 dakika pişirin.
eksili-kabak-siyirmasi-mugla-bag-evi-usulu,Muğla Ekşili Kabak Sıyırması,YEMEK,sebze-yemekleri,tr,3,3,few-steps,Kabak 4 adet | Sarımsak 2 diş | Limon suyu 1.5 yemek kaşığı | Zeytinyağı 1.5 yemek kaşığı | Dereotu 0.25 demet,1. Kabakları ince şeritler halinde doğrayın. || 2. Yağ ve sarımsakla 10 dakika pişirin. || 3. Limon suyu ve dereotunu ekleyip servis edin.
tarhanali-mercimek-corbasi-usak-usulu,Uşak Tarhanalı Mercimek Çorbası,CORBA,corbalar,tr,5,3,no-time,Kırmızı mercimek 1 su bardağı | Tarhana 3 yemek kaşığı | Su 5 su bardağı | Domates salçası 1 tatlı kaşığı | Tereyağı 15 gr,1. Mercimeği suyla birlikte yumuşayana kadar kaynatın. || 2. Tarhanayı az suyla açıp tencereye ekleyin. || 3. Domates salçasını da katıp çorbayı 15-20 dakika pişirin. || 4. Tereyağı ile tamamlayıp birkaç dakika daha ısıtın. || 5. Çorbayı sıcak olarak servis edin.
quinoa-lime-salatasi-peru-usulu,Peru Quinoa Lime Salatası,SALATA,salatalar,pe,3,3,few-steps,Quinoa 1 su bardağı | Misket limonu suyu 2 yemek kaşığı | Kişniş 0.25 demet | Salatalık 1 adet | Zeytinyağı 1 yemek kaşığı,1. Quinoayı 15 dakika haşlayıp soğutun. || 2. Salatalık ve kişnişi doğrayın. || 3. Tüm malzemeyi limon suyuyla karıştırıp servis edin.
soganlama-yozgat-usulu,Yozgat Soğanlama,KAHVALTI,kahvaltiliklar,tr,3,3,few-steps,Kuru soğan 4 adet | Yumurta 3 adet | Tereyağı 30 gr | Tuz 0.75 çay kaşığı | Karabiber 0.25 çay kaşığı,"1. Soğanları yarım ay doğrayın. || 2. Tereyağında soğanları 12 dakika kısık ateşte yumuşatın. || 3. Tuz, karabiber ve yumurtaları ekleyip 4 dakika daha pişirin."
zurek-polonya-usulu,Żurek,CORBA,corbalar,pl,3,3,few-steps,Çavdar unu 0.5 su bardağı | Yoğurt 0.5 su bardağı | Yumurta 2 adet | Sarımsak 2 diş | Su 4 su bardağı | Tuz 0.75 çay kaşığı,1. Çavdar unu ve yoğurdu 0.5 su bardağı suyla açın. || 2. Karışımı sarımsak ve kalan suyla 20 dakika pişirin. || 3. Haşlanmış yumurtayla servis edin.
kekikli-taze-badem-salatasi-antalya-usulu,Antalya Kekikli Taze Badem Salatası,SALATA,salatalar,tr,3,3,few-steps,Taze badem 1 su bardağı | Taze kekik 1 yemek kaşığı | Limon suyu 1 yemek kaşığı | Zeytinyağı 1 yemek kaşığı | Tuz 0.25 çay kaşığı,"1. Taze bademleri ince dilimleyin. || 2. Kekik, limon suyu, zeytinyağı ve tuzu çırpın. || 3. Bademleri sosla buluşturup servis edin."
unlu-tava-coregi-ankara-usulu,Ankara Unlu Tava Çöreği,KAHVALTI,hamur-isleri,tr,3,3,few-steps,Un 2 su bardağı | Yoğurt 0.5 su bardağı | Yumurta 1 adet | Tereyağı 25 gr | Tuz 0.5 çay kaşığı,"1. Un, yoğurt, yumurta ve tuzla hamur hazırlayın. || 2. Hamuru dört bezeye ayırıp ince açın. || 3. Tereyağlı tavada çörekleri 8 dakika pişirin."
kavutlu-muzlu-kup-igdir-usulu,Iğdır Kavutlu Muzlu Kup,TATLI,tatlilar,tr,3,3,few-steps,Kavut 0.5 su bardağı | Süt 1.5 su bardağı | Muz 2 adet | Bal 1 yemek kaşığı | Tarçın 0.5 çay kaşığı,1. Kavutu kuru tavada 2 dakika çevirin. || 2. Süt ve balı ekleyip kısa süre koyulaştırın. || 3. Muz dilimleriyle kaselere paylaştırıp servis edin.
coronation-chicken-ingiliz-usulu,İngiliz Coronation Chicken,SALATA,salatalar,gb,3,3,few-steps,Haşlanmış tavuk 300 gr | Yoğurt 1 su bardağı | Köri 1 tatlı kaşığı | Badem 0.25 su bardağı | Limon suyu 1 tatlı kaşığı,"1. Tavuğu didikleyin. || 2. Yoğurt, köri ve limon suyunu çırpın. || 3. Tavuk ve bademle karıştırıp soğuk servis edin."
kelecos-van-usulu,Van Kelecoş,YEMEK,baklagil-yemekleri,tr,3,3,few-steps,Yeşil mercimek 1 su bardağı | Lavaş 3 adet | Yoğurt 1.5 su bardağı | Sarımsak 2 diş | Tereyağı 20 gr | Kuru nane 1 tatlı kaşığı | Tuz 0.75 çay kaşığı,"1. Mercimeği 20 dakika haşlayın. || 2. Yoğurdu sarımsak ve tuzla çırpın, lavaşı iri parçalayın. || 3. Lavaş, mercimek ve yoğurdu kat kat yerleştirip tereyağlı nane ile servis edin."
susamli-kabak-cicegi-tava-adana-usulu,Adana Susamlı Kabak Çiçeği Tava,APERATIF,aperatifler,tr,3,3,few-steps,Kabak çiçeği 12 adet | Un 0.75 su bardağı | Yumurta 1 adet | Susam 2 yemek kaşığı | Su 0.5 su bardağı | Sıvı yağ 0.5 su bardağı | Tuz 0.5 çay kaşığı,"1. Kabak çiçeklerini temizleyin. || 2. Un, yumurta, su ve tuzla hamur yapıp çiçekleri bulayın. || 3. Üzerine susam serpip toplam 6 dakika kızartın."
shepherds-pie-ingiliz-usulu,İngiliz Shepherd's Pie,YEMEK,et-yemekleri,gb,5,3,no-time,Kuzu kıyma 500 gr | Patates 5 adet | Süt 0.5 su bardağı | Tereyağı 30 gr | Kuru soğan 1 adet | Tuz 1 çay kaşığı,"1. Patatesleri iri doğrayıp tuzlu suda yumuşayana kadar 15 dakika haşlayın. || 2. Süzdüğünüz patatesleri süt ve tereyağıyla ezip pürüzsüz bir püre hazırlayın. || 3. Ayrı tavada doğranmış soğanı kavurun, kuzu kıymayı ekleyip suyunu çektirerek kızartın. || 4. Kıymalı harcı fırın kabına yayın, üzerine patates püresini spatulayla kapatın. || 5. Önceden 200°C ısıtılmış fırında üstü kızarana kadar 25-30 dakika pişirin."
cigerli-bulgur-pilavi-edirne-usulu,Edirne Ciğerli Bulgur Pilavı,YEMEK,makarna-pilav,tr,3,3,few-steps,Kuzu ciğeri 300 gr | Pilavlık bulgur 1.5 su bardağı | Tereyağı 25 gr | Kuru soğan 1 adet | Su 2.5 su bardağı,1. Soğanı tereyağında 4 dakika kavurun. || 2. Ciğeri ekleyip 5 dakika soteleyin. || 3. Bulgur ve suyu ekleyip pilavı 15 dakika pişirin.
kasha-grechnevaya-rus-usulu,Kasha Grechnevaya,YEMEK,makarna-pilav,ru,5,3,no-time,Karabuğday 1 su bardağı | Su 2 su bardağı | Tereyağı 20 gr | Tuz 0.5 çay kaşığı,"1. Karabuğdayı kuru tencerede 2 dakika çevirerek hafif kavurun. || 2. Suyu ve tuzu ekleyip kaynatın, sonra kapağı kapatın. || 3. Kısık ateşte su tamamen çekilene kadar 14-16 dakika pişirin. || 4. Tereyağını pilava karıştırıp tencerenin kapağını yeniden kapatın. || 5. Kasha'yı 10 dakika dinlendirip tane tane servis edin."
kluski-slaskie-polonya-usulu,Kluski Śląskie,YEMEK,makarna-pilav,pl,3,3,few-steps,Haşlanmış patates 4 adet | Patates nişastası 0.75 su bardağı | Yumurta 1 adet | Tuz 0.5 çay kaşığı,"1. Patatesleri ezin, nişasta, yumurta ve tuzla yoğurun. || 2. Hamurdan küçük toplar yapıp ortasını başparmakla bastırın. || 3. Kaynar suda 4 dakika haşlayın."
vinegret-herringli-rus-usulu,Herringli Vinegret Salatası,SALATA,salatalar,ru,3,3,few-steps,Pancar 2 adet | Patates 2 adet | Ringa fileto 150 gr | Salatalık turşusu 2 adet | Zeytinyağı 1 yemek kaşığı,1. Pancar ve patatesi haşlayıp küp doğrayın. || 2. Ringayı ve turşuyu doğrayın. || 3. Hepsini yağla karıştırıp servis edin.
kalops-isvec-usulu,Kalops,YEMEK,et-yemekleri,se,3,3,few-steps,Dana kuşbaşı 700 gr | Kuru soğan 2 adet | Et suyu 2 su bardağı | Karabiber 0.5 çay kaşığı | Tuz 1 çay kaşığı,1. Eti ve soğanı tencereye alın. || 2. Baharatları ve et suyunu ekleyin. || 3. Yahniyi 50 dakika pişirin.
dillstuvad-potatis-isvec-usulu,Dillstuvad Potatis,YEMEK,sebze-yemekleri,se,5,3,no-time,Patates 5 adet | Krema 1 su bardağı | Dereotu 0.25 demet | Tuz 0.5 çay kaşığı,"1. Patatesleri iri küpler halinde doğrayıp tuzlu suda 12-15 dakika haşlayın. || 2. Patatesleri süzün, dağılmaması için kenarda bekletin. || 3. Kremayı küçük tencerede 2 dakika ısıtın, tuzu ekleyin. || 4. İnce kıyılmış dereotunu kremaya katıp patatesle birleştirin. || 5. Yemeği 2 dakika daha ısıtıp sıcak servis edin."
zeytinli-keskek-aydin-bahce-usulu,Aydın Zeytinli Keşkek,YEMEK,makarna-pilav,tr,3,3,few-steps,Dövme buğday 1 su bardağı | Yeşil zeytin 0.75 su bardağı | Zeytinyağı 2 yemek kaşığı | Su 4 su bardağı | Tuz 0.5 çay kaşığı,1. Buğdayı suyla tencereye alın. || 2. Karışımı 35 dakika pişirip ezmeye başlayın. || 3. Zeytin ve zeytinyağını ekleyip 3 dakika daha pişirin.
rassolnik-rus-usulu,Rassolnik,CORBA,corbalar,ru,3,3,few-steps,Arpa 0.5 su bardağı | Salatalık turşusu 3 adet | Kuru soğan 1 adet | Su 4 su bardağı | Tuz 0.75 çay kaşığı,1. Arpayı yıkayıp tencereye alın. || 2. Soğan ve suyu ekleyip 20 dakika kaynatın. || 3. Doğranmış turşuyu katıp 8 dakika daha pişirin.
bo-la-lot-vietnam-usulu,Bo La Lot,YEMEK,et-yemekleri,vn,3,3,few-steps,Dana kıyma 400 gr | Asma yaprağı 16 adet | Sarımsak 2 diş | Lime suyu 1 tatlı kaşığı | Tuz 0.5 çay kaşığı,"1. Kıymayı sarımsak, lime suyu ve tuzla yoğurun. || 2. Yapraklara sarıp rulo yapın. || 3. Tavada toplam 8 dakika pişirin."
grechka-mantar-kofte-rus-usulu,Greçka Mantar Köftesi,ATISTIRMALIK,atistirmaliklar,ru,5,3,no-time,Karabuğday 1 su bardağı | Mantar 250 gr | Kuru soğan 1 adet | Zeytinyağı 2 yemek kaşığı | Tuz 0.5 çay kaşığı,1. Karabuğdayı haşlayıp tamamen suyunu süzdürün. || 2. Mantarı ve soğanı soteleyip karabuğdayla birlikte ezin. || 3. Harca köfte şekli verip hafifçe bastırın. || 4. Köfteleri tavada her iki yüzü toplam 6-8 dakika pişirin. || 5. Köfteleri sıcak halde servis tabağına alın.
fasulyeli-misir-ekmegi-durumu-trabzon-yayla-usulu,Trabzon Fasulyeli Mısır Ekmeği Dürümü,KAHVALTI,hamur-isleri,tr,3,3,few-steps,Mısır ekmeği 4 dilim | Haşlanmış kuru fasulye 2 su bardağı | Tereyağı 20 gr | Karabiber 0.5 çay kaşığı,1. Fasulyeyi tereyağı ve karabiberle 5 dakika ısıtın. || 2. Mısır ekmeklerini tavada hafifçe ısıtın. || 3. Fasulyeyi ekmeklere paylaştırıp dürüm yaparak servis edin.
fasolada-yunan-usulu,Fasolada,CORBA,corbalar,gr,3,3,few-steps,Haşlanmış kuru fasulye 2 su bardağı | Domates püresi 1 su bardağı | Havuç 1 adet | Zeytinyağı 2 yemek kaşığı | Su 3 su bardağı,"1. Havuç ve zeytinyağını tencerede 4 dakika çevirin. || 2. Fasulye, domates ve suyu ekleyin. || 3. Çorbayı 25 dakika pişirip servis edin."
cevizli-tirit-samsun-ocak-usulu,Samsun Cevizli Tirit,YEMEK,et-yemekleri,tr,3,3,few-steps,Bayat ekmek 4 dilim | Et suyu 2 su bardağı | Yoğurt 1 su bardağı | Ceviz 0.5 su bardağı | Tereyağı 20 gr,"1. Ekmeği servis tabağına yerleştirin. || 2. Et suyunu ısıtıp ekmeğin üstüne gezdirin. || 3. Yoğurt, ceviz ve eritilmiş tereyağıyla tamamlayıp servis edin."
tavuklu-kalle-kirklareli-usulu,Tavuklu Kalle,YEMEK,tavuk-yemekleri,tr,3,3,few-steps,Tavuk göğsü 500 gr | Lahana turşusu 250 gr | Pirinç 0.5 su bardağı | Kuru soğan 1 adet | Tereyağı 25 gr | Turşu suyu 0.5 su bardağı | Su 2.5 su bardağı | Karabiber 0.5 çay kaşığı,"1. Soğanı tereyağında 4 dakika çevirip kuşbaşı doğranmış tavuğu ekleyin. || 2. Turşu, pirinç, turşu suyu ve suyu tencereye alıp yemeği 25 dakika pişirin. || 3. Karabiber ekleyip 5 dakika dinlendirerek servis edin."
hashasli-yogurtlu-makarna-denizli-usulu,Denizli Haşhaşlı Yoğurtlu Makarna,YEMEK,makarna-pilav,tr,3,3,few-steps,Erişte 300 gr | Yoğurt 1 su bardağı | Haşhaş ezmesi 3 yemek kaşığı | Tereyağı 20 gr,1. Erişteyi haşlayın. || 2. Yoğurt ve haşhaş ezmesini karıştırın. || 3. Erişteyi sos ve tereyağıyla buluşturup servis edin.
tortilla-de-camarones-ispanya-usulu,Tortilla de Camarones,APERATIF,aperatifler,es,3,3,few-steps,Küçük karides 200 gr | Un 0.75 su bardağı | Su 0.75 su bardağı | Tuz 0.5 çay kaşığı | Sıvı yağ 1 su bardağı,"1. Un, su ve tuzu çırpın. || 2. Karidesi hamura ekleyin. || 3. Kaşıkla döküp 4 dakika kızartın."
kestaneli-kereviz-yahnisi-bursa-usulu,Bursa Kestaneli Kereviz Yahnisi,YEMEK,sebze-yemekleri,tr,3,3,few-steps,Kereviz 2 adet | Kestane 200 gr | Soğan 1 adet | Zeytinyağı 2 yemek kaşığı | Su 1.5 su bardağı,1. Soğanı yağda 4 dakika çevirin. || 2. Kereviz ve kestaneyi ekleyip 5 dakika soteleyin. || 3. Suyu ekleyip yemeği 20 dakika pişirin.
misirli-pazili-tava-ekmegi-rize-usulu,Mısırlı Pazılı Tava Ekmeği,KAHVALTI,kahvaltiliklar,tr,3,3,few-steps,Mısır unu 1.5 su bardağı | Pazı 200 gr | Tereyağı 25 gr | Su 1.5 su bardağı | Tuz 0.5 çay kaşığı,1. Pazıyı ince doğrayın. || 2. Su ve mısır ununu karıştırıp pazıyı ekleyin. || 3. Karışımı tavada 10 dakika pişirin.
esquites-meksika-usulu,Esquites,ATISTIRMALIK,atistirmaliklar,mx,4,3,few-steps,Mısır 3 su bardağı | Tereyağı 15 gr | Lime suyu 1 yemek kaşığı | Pul biber 0.5 çay kaşığı | Peynir 2 yemek kaşığı,"1. Mısırı tereyağında hafif renk alana kadar 6-8 dakika çevirin. || 2. Lime suyunu ve pul biberi ekleyip 1 dakika daha karıştırın. || 3. Mısırı kaselere alın, peyniri üstüne serpin. || 4. Esquites'i sıcak atıştırmalık olarak servis edin."
harira-kuzey-afrika-usulu,Harira,CORBA,corbalar,ma,3,3,few-steps,Kırmızı mercimek 0.75 su bardağı | Haşlanmış nohut 1 su bardağı | Domates püresi 1 su bardağı | Un 1 yemek kaşığı | Kimyon 0.5 çay kaşığı,"1. Baharat ve domatesi tencerede açın. || 2. Mercimek, nohut ve suyu ekleyin. || 3. Çorbayı 25 dakika pişirip unla bağlayın."
