slug,title,type,category,cuisine,stepCount,score,issues,ingredients_tr,current_steps_tr
summer-pudding,Summer Pudding,TATLI,tatlilar,gb,4,3,few-steps,Sandviç ekmeği 10 dilim | Çilek 200 gr | Böğürtlen 150 gr | Ahududu 150 gr | Toz şeker 0.5 su bardağı | Krema 100 ml,1. Meyveleri şekerle 5 dakika kısık ateşte pişirin. || 2. Kalıbı ekmekle kaplayıp meyveli karışımı içine doldurun. || 3. Tatlıyı bastırarak buzdolabında 4 saat dinlendirin. || 4. Summer puddingi krema ile soğuk servis edin.
nar-eksili-sehriye-pilavi-mardin-usulu,Mardin Nar Ekşili Şehriye Pilavı,YEMEK,makarna-pilav,tr,5,3,no-time,Arpa şehriye 1.5 su bardağı | Kuru soğan 1 adet | Nar ekşisi 1 yemek kaşığı | Zeytinyağı 2 yemek kaşığı | Tuz 0.75 çay kaşığı,"1. Soğanı yağda 3 dakika çevirin. || 2. Arpa şehriyeyi ekleyip hafif renk alana kadar kavurun. || 3. Sıcak su, nar ekşisi ve tuzu katıp kapağı kapatın. || 4. Pilavı 10-12 dakika pişirin ve suyunu çektirin. || 5. Pilavı dinlendirip sıcak olarak servis edin."
pastirmali-arpa-pilavi-kayseri-usulu,Pastırmalı Arpa Pilavı,YEMEK,makarna-pilav,tr,5,3,no-time,Arpa şehriye 2 su bardağı | Pastırma 120 gr | Tereyağı 25 gr | Su 4 su bardağı,1. Tereyağını tencerede eritip arpa şehriyeyi renk alıncaya kadar kavurun. || 2. Kaynar suyu ekleyin ve kapağı kapalı olarak 10-12 dakika pişirin. || 3. Pastırmayı küçük parçalara ayırıp ayrı tavada 1 dakika çevirin. || 4. Pilav suyunu çekince pastırmayı karıştırın ve 2 dakika daha ocakta tutun. || 5. Tencereyi ocaktan alıp 5 dakika dinlendirdikten sonra servis edin.
hardaliyeli-tavuk-kapama-kirklareli-usulu,Kırklareli Hardaliyeli Tavuk Kapama,YEMEK,tavuk-yemekleri,tr,3,3,few-steps,Tavuk but 600 gr | Pirinç 1 su bardağı | Hardaliye 1 su bardağı | Su 1.5 su bardağı | Kuru soğan 1 adet,1. Soğan ve tavuğu tencerede 8 dakika çevirin. || 2. Pirinci ekleyip 2 dakika karıştırın. || 3. Hardaliye ve suyu ekleyip yemeği 20 dakika pişirin.
vasterbotten-payi,Västerbotten Payı,YEMEK,hamur-isleri,se,3,3,few-steps,Un 220 gr | Tereyağı 100 gr | Yumurta 3 adet | Krema 200 ml | Västerbotten peyniri 200 gr,"1. Un ve tereyağıyla pay tabanı hazırlayıp kalıba bastırın. || 2. Yumurta, krema ve rendelenmiş peyniri iç harç için çırpın. || 3. Harçlı payı 190°C fırında 28 dakika pişirin."
placki-ziemniaczane,Placki Ziemniaczane,ATISTIRMALIK,atistirmaliklar,pl,4,3,few-steps,Patates 4 adet | Un 2 yemek kaşığı | Yumurta 1 adet | Soğan 0.5 adet | Ayçiçek yağı 0.5 su bardağı | Ekşi krema 4 yemek kaşığı,1. Patates ve soğanı rendeleyip suyunu hafifçe sıkın. || 2. Un ve yumurtayı ekleyip karıştırın. || 3. Karışımı ayçiçek yağında iki yüzü kızarana kadar pişirin. || 4. Placki ziemniaczane'yi ekşi krema ile servis edin.
tatar-boregi-eskisehir-usulu,Tatar Böreği,YEMEK,hamur-isleri,tr,4,3,few-steps,Un 400 gr | Su 200 ml | Yoğurt 250 gr | Sarımsak 2 diş | Tereyağı 30 gr | Nane 1 tatlı kaşığı | Tuz 1 çay kaşığı,1. Un ve suyla hamur yoğurup ince açın. || 2. Hamuru küçük kareler kesip tuzlu suda haşlayın. || 3. Yoğurt ve sarımsağı karıştırıp hamurun üstüne dökün. || 4. Tereyağı ve naneyi kızdırıp Tatar böreğinin üstüne gezdirin.
mercimekli-hingel-kars-usulu,Kars Mercimekli Hıngel,YEMEK,hamur-isleri,tr,3,3,few-steps,Un 3.5 su bardağı | Su 1 su bardağı | Yeşil mercimek 1 su bardağı | Kuru soğan 1 adet | Yoğurt 1 su bardağı,"1. Hamuru yoğurup 15 dakika dinlendirin. || 2. Mercimek ve soğanla iç harcı hazırlayın. || 3. Hamuru kesip iç doldurun, hıngelleri haşlayın ve yoğurtla servis edin."
lalanga-trakya-usulu,Lalanga,KAHVALTI,kahvaltiliklar,tr,3,3,few-steps,Un 200 gr | Yoğurt 150 gr | Yumurta 2 adet | Tereyağı 20 gr | Tuz 0.5 çay kaşığı,"1. Un, yoğurt, yumurta ve tuzu pürüzsüz olana kadar çırpın. || 2. Hamuru 5 dakika dinlendirin. || 3. Tereyağlı tavada ince parçalar halinde toplam 8 dakika pişirin."
paluze-kilis-usulu,Paluze,TATLI,tatlilar,tr,4,3,few-steps,Üzüm pekmezi 1 su bardağı | Nişasta 4 yemek kaşığı | Su 3 su bardağı,1. Nişastayı 1 su bardağı suyla açın. || 2. Pekmez ve kalan suyu tencerede ısıtın. || 3. Nişastalı karışımı ekleyip paluzeyi koyulaşana kadar pişirin. || 4. Tatlıyı kaselere paylaştırıp soğutarak servis edin.
pierogi-ruskie,Pierogi Ruskie,YEMEK,hamur-isleri,pl,5,3,no-time,Un 350 gr | Su 180 ml | Patates 3 adet | Lor peyniri 200 gr | Soğan 1 adet | Tereyağı 25 gr,"1. Un ve suyla hamur yoğurup üzerini kapatın, 20 dakika dinlendirin. || 2. Patatesi haşlayıp lor peyniri ve sotelenmiş soğanla iç hazırlayın. || 3. Hamuru açıp içi koyarak yarım ay biçiminde kapatın. || 4. Pierogileri kaynar suda yüzeye çıkana kadar 4-5 dakika haşlayın. || 5. Pierogileri tereyağıyla sıcak halde servis edin."
misir-yarmali-balik-corbasi-sinop-usulu,Sinop Mısır Yarmalı Balık Çorbası,CORBA,corbalar,tr,3,3,few-steps,Beyaz etli balık fileto 350 gr | Mısır yarması 0.5 su bardağı | Kuru soğan 1 adet | Zeytinyağı 1 yemek kaşığı | Limon 1 adet,"1. Soğanı zeytinyağında 3 dakika çevirin. || 2. Mısır yarması ve 1 litre su ekleyip çorbayı 18 dakika pişirin. || 3. Balığı ekleyip 6 dakika daha pişirin, limonla servis edin."
terbiyeli-nohut-corbasi-antalya-usulu,Antalya Terbiyeli Nohut Çorbası,CORBA,corbalar,tr,3,3,few-steps,Haşlanmış nohut 2 su bardağı | Yumurta sarısı 1 adet | Limon suyu 2 yemek kaşığı | Un 1 yemek kaşığı | Nane 1 çay kaşığı,"1. Nohudu 1 litre suyla 10 dakika kaynatın. || 2. Yumurta sarısı, limon ve unu çırpın. || 3. Terbiyeyi tencereye ekleyip 3 dakika ısıtarak servis edin."
bramble,Bramble,KOKTEYL,kokteyller,us,3,3,few-steps,Cin 50 ml | Limon suyu 25 ml | Şeker şurubu 15 ml | Böğürtlen likörü 15 ml,"1. Cin, limon suyu ve şurubu buzla çalkalayın. || 2. Karışımı kırık buz dolu bardağa süzün. || 3. Böğürtlen likörünü üstten gezdirin."
chilaquiles,Chilaquiles,KAHVALTI,kahvaltiliklar,th,3,3,few-steps,Tortilla cipsi 250 gr | Salsa verde 300 ml | Yumurta 4 adet | Beyaz peynir 100 gr,1. Salsayı tavada ısıtın. || 2. Tortilla cipslerini salsaya ekleyip 3 dakika çevirin. || 3. Yumurta ve peynirle servis edin.
yuca-mojo-bites-kuba-usulu,Yuca Mojo Bites,ATISTIRMALIK,atistirmaliklar,cu,3,3,few-steps,Manyok 500 gr | Sarımsak 3 diş | Portakal suyu 0.5 su bardağı | Zeytinyağı 2 yemek kaşığı,1. Manyoku 15 dakika haşlayın. || 2. Sarımsak ve portakal suyuyla mojo hazırlayın. || 3. Manyoku tavada kısaca kızartıp mojoyla servis edin.
hardalli-kabak-mucveri-edirne-usulu,Edirne Hardallı Kabak Mücveri,ATISTIRMALIK,atistirmaliklar,tr,3,3,few-steps,Kabak 3 adet | Un 3 yemek kaşığı | Yumurta 2 adet | Dijon hardal 1 tatlı kaşığı | Dereotu 0.25 demet,"1. Kabağı rendeleyip suyunu sıkın. || 2. Un, yumurta, hardal ve dereotunu ekleyip karıştırın. || 3. Harçtan kaşıkla alıp tavada iki yüzünü 10 dakika kızartın."
uzumlu-tahinli-un-helvasi-konya-usulu,Üzümlü Tahinli Un Helvası,TATLI,tatlilar,tr,5,3,no-time,Un 1.5 su bardağı | Tahin 0.5 su bardağı | Kuru üzüm 0.5 su bardağı | Şeker 0.5 su bardağı | Su 0.75 su bardağı,"1. Şeker ve suyu küçük tencerede 3 dakika kaynatıp şerbet hazırlayın. || 2. Unu tavada kısık ateşte kokusu çıkıp renk alıncaya kadar kavurun. || 3. Tahin ve kuru üzümü ekleyip 1 dakika karıştırın. || 4. Şerbeti ekleyin, helva toparlanana kadar 4-5 dakika çevirin. || 5. Ocaktan alıp 5 dakika dinlendirerek servis edin."
kayisili-irmik-pilavi-macaristan-usulu,Kayısılı İrmik Pilavı,YEMEK,makarna-pilav,hu,5,3,no-time,İrmik 1.5 su bardağı | Kuru kayısı 0.75 su bardağı | Tereyağı 25 gr | Su 2 su bardağı,1. Kuru kayısıları küçük doğrayıp 5 dakika ılık suda bekletin. || 2. Tereyağında irmiği açık kehribar ton alıncaya kadar kavurun. || 3. Suyu ve süzülen kayısıları ekleyip hızlıca karıştırın. || 4. Kapağı kapalı şekilde 8-10 dakika pişirin. || 5. Pilavı ocaktan alıp 5 dakika dinlendirerek servis edin.
dereotlu-somon-acik-sandvic-isvec-usulu,Dereotlu Somon Açık Sandviç,KAHVALTI,kahvaltiliklar,se,5,3,no-time,Çavdar ekmeği 4 dilim | Somon füme 150 gr | Krem peynir 0.5 su bardağı | Dereotu 0.25 demet,1. Çavdar ekmeği dilimlerini hafifçe kızartın. || 2. Krem peyniri ekmeklerin üstüne ince tabaka halinde sürün. || 3. Somon fümeyi ekmeklere kıvırarak yerleştirin. || 4. Dereotunu ince kıyıp sandviçlerin üstüne serpin. || 5. Açık sandviçleri bekletmeden servis edin.
tursulu-kavrulmus-lahana-rize-usulu,Rize Turşulu Kavrulmuş Lahana,KAHVALTI,kahvaltiliklar,tr,3,3,few-steps,Beyaz lahana 500 gr | Fasulye turşusu 200 gr | Kuru soğan 1 adet | Zeytinyağı 2 yemek kaşığı,1. Lahanayı ince doğrayın ve soğanı piyazlık kesin. || 2. Soğanı yağda 4 dakika çevirip lahanayı ekleyin. || 3. Turşuyu katıp tavayı 8 dakika daha pişirerek servis edin.
peynirli-badem-corbasi-edirne-usulu,Edirne Peynirli Badem Çorbası,CORBA,corbalar,tr,3,3,few-steps,Süt 500 ml | Su 500 ml | Badem 0.5 su bardağı | Beyaz peynir 80 gr | Un 1 yemek kaşığı,"1. Bademi ince çekin. || 2. Süt, su, un ve bademi tencerede 12 dakika pişirin. || 3. Peyniri ekleyip bir taşım ısıtarak servis edin."
narenciyeli-levrek-sis-alanya-usulu,Narenciyeli Levrek Şiş,YEMEK,et-yemekleri,tr,5,3,no-time,Levrek fileto 600 gr | Portakal suyu 0.25 su bardağı | Limon suyu 2 yemek kaşığı | Zeytinyağı 1 yemek kaşığı,"1. Levrek filetolarını iri küpler halinde kesip portakal, limon ve zeytinyağıyla harmanlayın. || 2. Balığı buzdolabında 20 dakika marine edin. || 3. Levrek parçalarını şişlere nazikçe geçirip fazla marineyi süzdürün. || 4. Izgarayı ya da fırını 220°C eşdeğer yüksek ısıya getirin. || 5. Şişleri 8-10 dakika pişirip yarısında çevirin, kurumadan alın."
otlu-cirpma-yumurtasi-izmir-usulu,İzmir Otlu Çırpma Yumurtası,KAHVALTI,kahvaltiliklar,tr,3,3,few-steps,Yumurta 4 adet | Lor peyniri 80 gr | Dereotu 0.25 demet | Maydanoz 0.25 demet | Ekşi mayalı ekmek 2 dilim,1. Otları ince kıyın ve yumurtaları çırpın. || 2. Lor ve otları yumurtaya ekleyip tavaya alın. || 3. Karışımı 4 dakika karıştırarak pişirip ekmekle servis edin.
taratorlu-kabak-corbasi-mersin-usulu,Taratorlu Kabak Çorbası,CORBA,corbalar,tr,3,3,few-steps,Kabak 3 adet | Yoğurt 1 su bardağı | Ceviz 0.25 su bardağı | Sarımsak 1 diş | Su 4 su bardağı,1. Kabağı suda 10 dakika haşlayın. || 2. Taratoru hazırlayın. || 3. Çorbayı birleştirip 4 dakika ısıtın.
adana-yuksuk-corbasi,Adana Yüksük Çorbası,CORBA,corbalar,tr,5,3,no-time,Un 400 gr | Dana kıyma 250 gr | Haşlanmış nohut 1 su bardağı | Domates salçası 2 yemek kaşığı,1. Kıymalı küçük mantıları hazırlayıp unlanmış tepsiye dizin. || 2. Salçalı suyu kaynatıp nohutları tencereye ekleyin. || 3. Mantıları dikkatlice çorbaya bırakıp nazikçe karıştırın. || 4. Çorbayı 12-15 dakika pişirip mantıları yumuşatın. || 5. Çorbayı sıcak halde kaselere paylaştırın.
madimakli-yumurta-sivas-usulu,Sivas Madımaklı Yumurta,KAHVALTI,kahvaltiliklar,tr,3,3,few-steps,Madımak otu 250 gr | Yumurta 3 adet | Tereyağı 20 gr | Tuz 0.5 çay kaşığı | Tandır ekmeği 3 dilim,1. Madımağı ayıklayıp iri doğrayın. || 2. Tereyağında madımağı 4 dakika çevirin. || 3. Yumurtaları kırıp 4 dakika daha pişirin.
sumakli-nohutlu-salata-mardin-usulu,Mardin Sumaklı Nohutlu Salata,SALATA,salatalar,tr,3,3,few-steps,Haşlanmış nohut 2 su bardağı | Kuru soğan 1 adet | Sumak 1 tatlı kaşığı | Maydanoz 0.25 demet | Zeytinyağı 1 yemek kaşığı,"1. Soğanı ince doğrayıp sumakla ovun. || 2. Nohut, maydanoz ve yağı ekleyip karıştırın. || 3. Salatayı 5 dakika dinlendirip servis edin."
biang-biang-mian,Biang Biang Mian,YEMEK,makarna-pilav,cn,3,3,few-steps,Un 500 gr | Su 260 ml | Soya sosu 3 yemek kaşığı | Acı pul biber 2 yemek kaşığı,1. Un ve suyla elastik hamur yoğurun. || 2. Hamuru 45 dakika dinlendirip geniş noodle çekin. || 3. Noodleı haşlayıp sos ve kızgın yağla karıştırın.
ahududulu-eton-kup-ingiltere-usulu,Ahududulu Eton Kup,TATLI,tatlilar,gb,5,3,no-time,Beze 120 gr | Krema 1 su bardağı | Ahududu 1.5 su bardağı | Pudra şekeri 1 yemek kaşığı,"1. Kremayı pudra şekeriyle birlikte yumuşak kıvam alana kadar çırpın. || 2. Bezenin yarısını iri kırıntılar halinde ufalayın. || 3. Kup bardaklara krema, ahududu ve beze kırıntılarını kat kat yerleştirin. || 4. Kalan ahududuları üst yüzeye paylaştırın. || 5. Kupu bekletmeden servis edin."
arabasi-corbasi-yozgat-usulu,Arabaşı Çorbası,CORBA,corbalar,tr,3,3,few-steps,Tavuk but 600 gr | Un 2 yemek kaşığı | Domates salçası 1 yemek kaşığı | Pul biber 1 tatlı kaşığı | Tuz 1 çay kaşığı | Un 1 su bardağı | Su 3 su bardağı,"1. Hamur için un ve suyu koyulaşana kadar pişirip tepsiye yayıp soğutun. || 2. Tavuğu haşlayın, lifleyin ve salça, un, pul biber ve tuzla çorbayı hazırlayın. || 3. Hamuru küp kesin ve çorbayı yanında servis edin."
limon-myrtle-avokado-toast-avustralya-usulu,Limon Myrtle Avokado Toast,KAHVALTI,kahvaltiliklar,au,5,3,no-time,Ekşi mayalı ekmek 4 dilim | Avokado 2 adet | Limon suyu 1 yemek kaşığı | Limon myrtle 0.25 çay kaşığı,"1. Ekşi mayalı ekmekleri kızartıp servis tabağına alın. || 2. Avokadoları çatalla ezin, limon suyu ve limon myrtle ile karıştırın. || 3. Hazırladığınız ezmeyi sıcak ekmeklerin üstüne kalınca yayın. || 4. Yüzeyi spatulayla hafif dalgalı bırakarak dokulu görünüm verin. || 5. Toast'ı bekletmeden servis edin."
zeytinli-enginar-guveci-yalova-usulu,Yalova Zeytinli Enginar Güveci,YEMEK,sebze-yemekleri,tr,5,3,no-time,Enginar 4 adet | Yeşil zeytin 1 su bardağı | Limon suyu 2 yemek kaşığı | Zeytinyağı 3 yemek kaşığı,1. Enginarları limonlu suda kısa süre bekletip kararmasını önleyin. || 2. Enginar ve zeytini yağla harmanlayıp güvece alın. || 3. Önceden 180°C ısıtılmış fırında 25-30 dakika pişirin. || 4. Yemeği 5 dakika dinlendirip ılık ya da sıcak servis edin. || 5. Zeytinli enginarı güveçten dikkatlice paylaştırın.
kabak-mucver-lokmalari,Kabak Mücver Lokmaları,ATISTIRMALIK,atistirmaliklar,tr,3,3,few-steps,Kabak 3 adet | Un 4 yemek kaşığı | Yumurta 2 adet | Beyaz peynir 80 gr,1. Kabağı rendeleyip avuç içinde iki kez sıkarak suyunu alın. || 2. Diğer malzemelerle karıştırıp küçük parçalar halinde tepsiye koyun. || 3. 200°C fırında 20 dakika pişirin.
pestilli-cevizli-sarma-elazig-usulu,Elazığ Pestilli Cevizli Sarma,TATLI,tatlilar,tr,3,3,few-steps,Pestil 6 adet | Ceviz 0.75 su bardağı | Tarçın 0.25 çay kaşığı,1. Cevizi iri çekip tarçınla karıştırın. || 2. Pestilin üstüne içi serpin. || 3. Rulo yapıp dilimleyerek servis edin.
domatesli-misir-coregi-sakarya-usulu,Sakarya Domatesli Mısır Çöreği,APERATIF,hamur-isleri,tr,3,3,few-steps,Mısır unu 1 su bardağı | Un 1 su bardağı | Domates 2 adet | Yumurta 2 adet | Zeytinyağı 3 yemek kaşığı,"1. Domatesleri küçük küpler halinde doğrayın. || 2. Unlar, yumurta ve zeytinyağıyla harcı karıştırın. || 3. 180°C fırında 30 dakika pişirip dilimleyin."
adacayli-elma-cayi,Adaçaylı Elma Çayı,ICECEK,kahve-sicak-icecekler,tr,3,3,no-time,Kuru elma 4 dilim | Adaçayı 1 tatlı kaşığı | Elma 1 adet | Su 500 ml,1. Suyu kaynatın. || 2. Kuru elma ve adaçayını 6 dakika demleyin. || 3. İçeceği süzüp elma dilimleriyle servis edin.
findikli-keskek-toplari-ordu-usulu,Ordu Fındıklı Keşkek Topları,ATISTIRMALIK,atistirmaliklar,tr,3,3,few-steps,Aşurelik buğday 1 su bardağı | Fındık 0.5 su bardağı | Tereyağı 20 gr | Tuz 0.5 çay kaşığı,"1. Buğdayı 20 dakika haşlayıp süzün. || 2. Fındık, tereyağı ve tuzla yoğurun. || 3. Harcı ceviz büyüklüğünde toplar yapıp servis edin."
kayseri-yag-mantisi,Kayseri Yağ Mantısı,YEMEK,hamur-isleri,tr,3,3,few-steps,Un 500 gr | Su 220 ml | Dana kıyma 250 gr | Soğan 1 adet | Yoğurt 300 gr | Sarımsak 2 diş | Tereyağı 40 gr | Domates salçası 1 yemek kaşığı,1. Un ve suyla hamur yoğurup 20 dakika dinlendirin. || 2. Kıyma ve soğanla iç hazırlayıp mantıları kapatın. || 3. Mantıları 12 dakika haşlayın ve sarımsaklı yoğurt ile salçalı yağla servis edin.
koruklu-peynir-ezmesi-tekirdag-usulu,Tekirdağ Koruklu Peynir Ezmesi,SOS,soslar-dippler,tr,3,3,few-steps,Beyaz peynir 200 gr | Koruk suyu 2 yemek kaşığı | Zeytinyağı 1 yemek kaşığı | Kekik 0.5 çay kaşığı,"1. Peyniri çatal yardımıyla ezin. || 2. Koruk suyu, zeytinyağı ve kekiği ekleyip karıştırın. || 3. Ezmenin kıvamını düzeltip soğuk servis edin."
brokoli-corbasi,Brokoli Çorbası,CORBA,corbalar,tr,3,3,few-steps,Brokoli 500 gr | Patates 1 adet | Soğan 1 adet | Süt 1 su bardağı | Zeytinyağı 2 yemek kaşığı | Sebze suyu 4 su bardağı | Tuz 1 çay kaşığı,"1. Soğanı zeytinyağında 4 dakika kavurun. || 2. Brokoli, patates ve sebze suyunu ekleyip 18-20 dakika pişirin. || 3. Sütü ekleyip blenderdan geçirin ve 3 dakika daha ısıtın."
wattleseed-custard-kup-avustralya-usulu,Avustralya Wattleseed Custard Kup,TATLI,tatlilar,au,3,3,few-steps,Süt 2 su bardağı | Yumurta sarısı 3 adet | Toz şeker 0.5 su bardağı | Wattleseed 1 tatlı kaşığı | Mısır nişastası 1 yemek kaşığı,"1. Sütü wattleseed ile ısıtın. || 2. Yumurta sarısı, şeker ve nişastayı çırpın. || 3. Karışımları birleştirip koyulaştırarak kupa alın ve soğutun."
cafe-au-lait,Café au Lait,ICECEK,kahve-sicak-icecekler,fr,3,3,no-time,Filtre kahve 150 ml | Süt 150 ml | Şeker 1 tatlı kaşığı,"1. Filtre kahveyi demleyip fincana alın. || 2. Sütü 2-3 dakika ısıtın, kaynatmayın. || 3. Sıcak sütü kahvenin üstüne döküp isteğe göre şeker ekleyin."
beef-stroganoff-klasik,Beef Stroganoff Klasik,YEMEK,et-yemekleri,tr,3,3,few-steps,Dana bonfile 600 gr | Mantar 300 gr | Ekşi krema 200 gr | Soğan 1 adet,1. Dana etini ince şerit doğrayıp 5 dakika mühürleyin. || 2. Mantar ve soğanı ekleyip 10 dakika pişirin. || 3. Ekşi kremayı ekleyip 5 dakika daha pişirin.
zahterli-yumurta-ekmegi-hatay-usulu,Hatay Zahterli Yumurta Ekmeği,KAHVALTI,kahvaltiliklar,tr,3,3,few-steps,Bayat ekmek 6 dilim | Yumurta 3 adet | Zahter 1 tatlı kaşığı | Zeytinyağı 2 yemek kaşığı | Domates 2 adet,1. Yumurtaları zahterle çırpın. || 2. Ekmeği karışıma batırıp tavaya alın. || 3. Dilimleri iki yüzünü toplam 6 dakika kızartıp domatesle servis edin.
bun-cha,Bun Cha,YEMEK,makarna-pilav,vn,3,3,few-steps,Dana kıyma 500 gr | Pirinç eriştesi 300 gr | Soya sosu 2 yemek kaşığı | Pirinç sirkesi 3 yemek kaşığı | Şeker 1 yemek kaşığı | Sarımsak 3 diş,"1. Kıymayı soya sosu ve sarımsakla yoğurup küçük köfteler yapın. || 2. Köfteleri ızgara tavada 15 dakika pişirin. || 3. Erişteyi haşlayıp köfte, yeşillik ve sirkeli sosla servis edin."
ca-phe-sua-chua,Ca Phe Sua Chua,ICECEK,kahve-sicak-icecekler,vn,3,3,no-time,Koyu filtre kahve 160 ml | Yoğurt 250 gr | Yoğunlaştırılmış süt 3 yemek kaşığı | Buz 1 su bardağı,1. Kahveyi demleyip soğutun. || 2. Yoğurt ve yoğunlaştırılmış sütü çırpın. || 3. Buz üzerinde yoğurt ve kahveyi katlayın.
izmir-kofte,İzmir Köfte,YEMEK,et-yemekleri,tr,3,3,few-steps,Dana kıyma 500 gr | Soğan 1 adet | Yumurta 1 adet | Galeta unu 3 yemek kaşığı | Patates 4 adet | Domates 3 adet | Yeşil biber 4 adet | Zeytinyağı 3 yemek kaşığı | Tuz 1 tatlı kaşığı,"1. Kıyma, rendelenmiş soğan, yumurta, galeta unu ve tuzu 5 dakika yoğurun. || 2. Köfte, patates ve biberleri fırın kabına sırayla dizin. || 3. Rendelenmiş domates ve zeytinyağını ekleyip 190°C fırında 40-45 dakika pişirin."
cilekli-kefir-smoothie,Çilekli Kefir Smoothie,ICECEK,smoothie-shake,tr,3,3,no-time,Kefir 400 ml | Çilek 250 gr | Bal 1 yemek kaşığı | Muz 1 adet,"1. Çileklerin saplarını ayıklayıp muzu iri parçalara bölün. || 2. Kefir, çilek, bal ve muzu blenderda 1 dakika çekin. || 3. Karışımı bekletmeden bardaklara paylaştırın."
esmer-tereyagli-kopytka-polonya-usulu,Esmer Tereyağlı Kopytka,YEMEK,hamur-isleri,pl,3,3,few-steps,Patates 4 adet | Un 1.5 su bardağı | Yumurta 1 adet | Tereyağı 40 gr,1. Patatesleri haşlayıp ezin. || 2. Un ve yumurtayla hamur hazırlayıp parçalar kesin. || 3. Kopytkaları haşlayıp esmer tereyağında çevirerek servis edin.
sweetcorn-fritter-stack-avustralya-usulu,Avustralya Sweetcorn Fritter Stack,KAHVALTI,kahvaltiliklar,au,3,3,few-steps,Mısır 1.5 su bardağı | Un 0.75 su bardağı | Yumurta 2 adet | Süt 0.5 su bardağı | Taze soğan 2 dal,1. Tüm malzemeyi karıştırıp koyu bir hamur hazırlayın. || 2. Hamurdan kaşıkla alıp tavaya dökün. || 3. Fritterları iki yüzü kızarana kadar 8 dakika pişirin.
katsu-sando,Katsu Sando,KAHVALTI,kahvaltiliklar,jp,3,3,few-steps,Domuzsuz tonkatsu için tavuk göğsü 300 gr | Japon süt ekmeği 4 dilim | Galeta unu 1 su bardağı | Yumurta 1 adet | Lahana 1 su bardağı,1. Tavuk dilimlerini inceltip yumurta ve galeta ununa bulayın. || 2. Tavada iki yüzünü 8 dakika kızartın. || 3. Ekmeğin arasına lahanayı ve dilimlenmiş katsu parçalarını yerleştirip kesin.
cevizli-pazi-sarmasi-artvin-usulu,Artvin Cevizli Pazı Sarması,YEMEK,sebze-yemekleri,tr,3,3,few-steps,Pazı yaprağı 14 adet | İnce bulgur 1 su bardağı | Ceviz 0.75 su bardağı | Kuru soğan 1 adet | Limon suyu 2 yemek kaşığı,"1. Pazı yapraklarını 1 dakika sıcak suda yumuşatın. || 2. Bulgur, ceviz ve ince doğranmış soğanla iç harcı hazırlayın. || 3. Yaprakları sarıp tencerede limonlu suyla 20 dakika pişirin."
arpa-sehriyeli-nohut-pilavi,Arpa Şehriyeli Nohut Pilavı,YEMEK,makarna-pilav,tr,5,3,no-time,Pirinç 1.5 su bardağı | Arpa şehriye 0.5 su bardağı | Haşlanmış nohut 200 gr | Tereyağı 1 yemek kaşığı,1. Arpa şehriyeyi tereyağında hafif renk alana kadar kavurun. || 2. Pirinci ve haşlanmış nohudu ekleyip birkaç tur çevirin. || 3. Sıcak suyunu verip kapağı kapatın. || 4. Pilavı kısık ateşte 15 dakika pişirin. || 5. 10 dakika dinlendirip servis edin.
domatesli-lor-ezmesi-ayvalik-usulu,Ayvalık Domatesli Lor Ezmesi,SOS,soslar-dippler,tr,3,3,few-steps,Lor peyniri 200 gr | Domates 1 adet | Zeytinyağı 2 yemek kaşığı | Ekmek 4 dilim,1. Domatesi küçük küp doğrayın. || 2. Loru zeytinyağıyla ezip domatesi ekleyin. || 3. Ezmenin yanına kızarmış ekmek koyarak servis edin.
hiyayakko,Hiyayakko,APERATIF,aperatifler,jp,3,3,few-steps,İpek tofu 300 gr | Soya sosu 1 yemek kaşığı | Taze soğan 1 dal | Zencefil 1 çay kaşığı,1. Tofuyu süzüp servis tabağına alın. || 2. Üzerine soya sosunu gezdirin. || 3. İnce doğranmış taze soğan ve rendelenmiş zencefille servis edin.
avokadolu-ton-balikli-salata-kasesi,Avokadolu Ton Balıklı Salata Kasesi,SALATA,salatalar,us,3,3,few-steps,Ton balığı 2 konserve | Avokado 1 adet | Marul 1 küçük | Limon suyu 1 yemek kaşığı,1. Marulu doğrayıp kaseye alın. || 2. Ton balığı ve avokadoyu ekleyin. || 3. Limon suyunu gezdirip salatayı servis edin.
aloo-gobi,Aloo Gobi,YEMEK,sebze-yemekleri,in,3,3,few-steps,Patates 500 gr | Karnabahar 600 gr | Domates 2 adet | Zerdeçal 1 tatlı kaşığı,1. Patates ve karnabaharı eş boyda doğrayın. || 2. Baharatları yağda 1 dakika kavurun. || 3. Sebzeleri ekleyip 25-30 dakika pişirin.
beef-chow-fun,Beef Chow Fun,YEMEK,makarna-pilav,cn,3,3,few-steps,Geniş pirinç eriştesi 500 gr | Dana eti 400 gr | Soya sosu 4 yemek kaşığı | Maş fasulyesi filizi 150 gr,"1. Dana etini ince dilimleyin. || 2. Eti wokta 4 dakika pişirin. || 3. Erişte, filiz ve soya sosunu ekleyip 5 dakika çevirin."
dereotlu-kuru-domates-gozleme-nevsehir-usulu,Nevşehir Dereotlu Kuru Domates Gözleme,KAHVALTI,hamur-isleri,tr,3,3,few-steps,Un 2 su bardağı | Kuru domates 8 adet | Beyaz peynir 120 gr | Dereotu 0.25 demet | Su 0.75 su bardağı,1. Hamuru yoğurup 10 dakika dinlendirin. || 2. İç harcı karıştırıp hamura yerleştirin. || 3. Gözlemeleri tavada 8 dakika pişirin.
knafeh-cups,Knafeh Cups,TATLI,tatlilar,me,3,3,few-steps,Tel kadayıf 300 gr | Tereyağı 100 gr | Krema peyniri 250 gr | Antep fıstığı 60 gr,1. Kadayıfı tereyağıyla harmanlayıp kup kalıplarına bastırın. || 2. 180°C fırında 15 dakika pişirin. || 3. Peynirli krema ve fıstıkla doldurun.
borulceli-domates-yahnisi,Börülceli Domates Yahnisi,YEMEK,baklagil-yemekleri,tr,3,3,few-steps,Taze börülce 600 gr | Domates 3 adet | Soğan 1 adet | Zeytinyağı 3 yemek kaşığı,1. Soğanı ve domatesi 6 dakika pişirin. || 2. Börülceyi ve sıcak suyu tencereye ekleyin. || 3. Yemeği kısık ateşte 25 dakika pişirin.
tandir-biberli-bulgur-kapama-batman-usulu,Batman Tandır Biberli Bulgur Kapama,YEMEK,et-yemekleri,tr,3,3,few-steps,Kuşbaşı dana eti 350 gr | Pilavlık bulgur 1.5 su bardağı | Yeşil biber 4 adet | Domates rendesi 1 su bardağı | Tuz 1 çay kaşığı,1. Eti tencerede 6 dakika mühürleyin. || 2. Biber ve domatesi ekleyip 6 dakika pişirin. || 3. Bulgur ve 2.5 su bardağı sıcak su ekleyip yemeği 18 dakika pişirin.
eksi-maya-zeytinli-bazlama-soke-usulu,Söke Ekşi Maya Zeytinli Bazlama,KAHVALTI,hamur-isleri,tr,3,3,few-steps,Un 4 su bardağı | Ekşi maya 4 yemek kaşığı | Su 1.5 su bardağı | Siyah zeytin 1 su bardağı | Beyaz peynir 120 gr | Domates 1 adet,1. Hamuru yoğurup 20 dakika dinlendirin. || 2. Zeytinleri ekleyip bezeleri elle açın. || 3. Bazlamaları tavada iki yüzünü toplam 10 dakika pişirip peynir ve domatesle servis edin.
