slug,title_tr,description_tr,type,cuisine,difficulty,prep_minutes,cook_minutes,total_minutes,serving_count,average_calories,ingredients_tr,ingredient_count,steps_tr,step_count,allergens,tags,tipNote_tr,servingSuggestion_tr,en_title_current,en_description_current,en_tipNote_current,en_servingSuggestion_current,en_ingredients_present,en_steps_present,de_title_current,de_description_current,de_tipNote_current,de_servingSuggestion_current,de_ingredients_present,de_steps_present
sebzeli-kuskus,Sebzeli Kuskus,"Kuskus makarnasının kabak, havuç ve biberle piştiği pratik pilav alternatifi.",YEMEK,tr,EASY,15,20,35,4,310,Kuskus 2 su bardağı | Kabak 1 adet | Havuç 1 adet | Kırmızı biber 1 adet | Zeytinyağı 3 yemek kaşığı | Sıcak su 3 su bardağı | Tuz 1 tatlı kaşığı | Karabiber 0.5 çay kaşığı,8,"1. Kabak, havuç ve biberi küçük küpler halinde doğrayın. || 2. Sebzeleri zeytinyağında 7 dakika soteleyin. || 3. Kuskusu ekleyip 2 dakika kavurun. || 4. Sıcak su, tuz ve karabiberi ekleyin. || 5. Kapağı kapalı şekilde suyunu çekene kadar 15 dakika pişirin.",5,GLUTEN,"vejetaryen,butce-dostu,vegan",Kuskusu eklemeden önce sebzelerin suyunu çektirin; pilav lapa olmaz.,Yoğurt veya ızgara tavuk yanında servis edin.,Vegetable Couscous,"A quick couscous-style side with zucchini, carrot, pepper, and olive oil, cooked fluffy and bright enough for weeknight tables.",,,0,0,Gemüse-Couscous,"Eine schnelle Couscous-Beilage mit Zucchini, Karotte, Paprika und Olivenöl, locker gekocht und gut für den Alltagstisch.",,,0,0
mantarli-risotto,Mantarlı Risotto,"Arborio pirinci, mantar ve parmesanla yapılan kremamsı İtalyan pilavı.",YEMEK,it,MEDIUM,15,30,45,4,460,Arborio pirinci 1.5 su bardağı | Mantar 300 gr | Soğan 1 adet | Sarımsak 2 diş | Sebze suyu 5 su bardağı | Tereyağı 2 yemek kaşığı | Zeytinyağı 2 yemek kaşığı | Parmesan peyniri 60 gr | Tuz 1 çay kaşığı,9,1. Sebze suyunu ayrı tencerede sıcak tutun. || 2. Mantarları zeytinyağında 6 dakika soteleyip kenara alın. || 3. Soğan ve sarımsağı tereyağında 4 dakika kavurun. || 4. Pirinci ekleyip 2 dakika karıştırın. || 5. Sıcak sebze suyunu kepçe kepçe ekleyerek 20 dakika pişirin. || 6. Mantar ve parmesanı ekleyip karıştırın.,6,SUT,"vejetaryen,misafir-sofrasi",Sıcak sebze suyunu kepçe kepçe ekleyin; pirinç sıvıyı emdikçe risottonun kremamsı dokusu oluşur.,Taze çekilmiş karabiberle sıcak servis edin.,Mushroom Risotto,"An Italian risotto of Arborio rice, mushrooms, butter, and Parmesan, stirred until creamy yet still loose on the spoon.",,,0,0,Pilzrisotto,"Ein italienisches Risotto aus Arborio-Reis, Pilzen, Butter und Parmesan, gerührt bis es cremig bleibt und doch locker fällt.",,,0,0
pesto-sos,Pesto Sos,"Fesleğen, çam fıstığı, parmesan ve zeytinyağıyla hazırlanan klasik yeşil sos.",SOS,it,EASY,10,0,10,6,180,Taze fesleğen 2 demet | Çam fıstığı 3 yemek kaşığı | Parmesan peyniri 50 gr | Sarımsak 2 diş | Zeytinyağı 0.5 su bardağı | Limon suyu 1 tatlı kaşığı | Tuz 0.5 çay kaşığı,7,"1. Fesleğen yapraklarını ayırıp iyice kurulayın. || 2. Çam fıstığını kuru tavada 2-3 dakika kokusu çıkana kadar çevirin. || 3. Fesleğen, çam fıstığı, parmesan, sarımsak, limon suyu ve tuzu robota alın. || 4. Zeytinyağını ince akışla ekleyip sos pürüzsüz olana kadar çekin.",4,"SUT,KUSUYEMIS","vejetaryen,30-dakika-alti,pratik",Fesleğeni yıkadıktan sonra tamamen kurutun; ıslak yaprak sosun rengini açar ve kıvamını inceltir.,"Makarna, sandviç veya ızgara sebzeyle kullanın.",Pesto Sauce,"A classic Italian green sauce of basil, pine nuts, Parmesan, garlic, and olive oil, blended fresh and intensely aromatic.",,,0,0,Pesto,"Eine klassische italienische grüne Sauce aus Basilikum, Pinienkernen, Parmesan, Knoblauch und Olivenöl, frisch gemixt und intensiv aromatisch.",,,0,0
guacamole,Guacamole,"Avokado, lime, domates ve kişnişle hazırlanan Meksika usulü dip sos.",SOS,mx,EASY,10,0,10,4,190,Avokado 2 adet | Lime suyu 2 yemek kaşığı | Domates 1 adet | Kırmızı soğan 0.5 adet | Taze kişniş 0.25 demet | Tuz 0.5 çay kaşığı | Jalapeno biber 1 adet,7,"1. Avokadolari ikiye bolup çekirdeklerini çıkarın, iclerini geniş kâseye alın ve lime suyunu üzerine sikin. || 2. Avokadoyu tuzla çatalla ezin, tamamen püre yapmadan hafif pütürlü bir doku bırakın. || 3. Domatesi, kırmızı soğanı, taze kisnisi ve jalapeno biberi çok ince doğrayıp kasenin içine ekleyin. || 4. Guacamoleyi nazikçe karıştırın ve rengini kaybetmemesi için bekletmeden servis edin.",4,,"vegan,30-dakika-alti,yaz-tarifi,vejetaryen",Avokadoyu çatalla ezin; tamamen püre yapmak yerine hafif taneli bırakmak daha iyi doku verir.,Tortilla cipsi veya taco yanında servis edin.,Guacamole,"A Mexican avocado dip that keeps lime, tomato, onion, cilantro, and jalapeno bright, chunky, and ready for tortilla chips.",,,0,0,Guacamole,"Ein mexikanischer Avocado-Dip, bei dem man Limette, Tomate, Zwiebel, Koriander und Jalapeno stueckig und frisch haelt.",,,0,0
cilekli-smoothie,Çilekli Smoothie,"Çilek, yoğurt ve muzla hazırlanan kremamsı, serin ve pratik smoothie.",ICECEK,tr,EASY,5,0,5,2,190,Çilek 250 gr | Muz 1 adet | Yoğurt 1 su bardağı | Süt 0.5 su bardağı | Bal 1 tatlı kaşığı | Buz 4 adet,6,"1. Çileklerin saplarını ayıklayın, muzu dilimleyin. || 2. Tüm malzemeleri blendera alın. || 3. Pürüzsüz kıvam alana kadar 30-40 saniye çekin.",3,SUT,"vejetaryen,30-dakika-alti,yaz-tarifi",Dondurulmuş çilek kullanırsanız buz eklemeden daha yoğun kıvam elde edilir.,"Uzun bardakta, üstüne çilek dilimi koyarak soğuk servis edin.",Strawberry Smoothie,"A simple smoothie of strawberries, yogurt, milk, and banana, creamy, cold, and sweet enough to feel like a lighter treat.",,,0,0,Erdbeer-Smoothie,"Ein einfacher Smoothie aus Erdbeeren, Joghurt, Milch und Banane, cremig, kalt und süß genug, um wie ein leichter Genuss zu wirken.",,,0,0
yulafli-granola-bar,Yulaflı Granola Bar,"Yulaf, bal, fındık ve kuru meyveyle hazırlanan fırınlanmış atıştırmalık bar.",ATISTIRMALIK,tr,EASY,15,25,40,8,240,Yulaf ezmesi 2 su bardağı | Fındık 0.5 su bardağı | Kuru üzüm 0.5 su bardağı | Bal 0.5 su bardağı | Fıstık ezmesi 3 yemek kaşığı | Susam 2 yemek kaşığı | Tarçın 1 çay kaşığı | Tuz 1 çimdik,8,"1. Yulaf, fındık, kuru üzüm, susam, tarçın ve tuzu kapta karıştırın. || 2. Bal ve fıstık ezmesini küçük tencerede 3 dakika ısıtıp akışkan hale getirin. || 3. Sıcak karışımı kuru malzemelere ekleyip karıştırın. || 4. Karışımı yağlı kağıt serili kalıba bastırarak yayın. || 5. 170°C fırında 20-25 dakika pişirin. || 6. Tamamen soğuduktan sonra 8 bara kesin.",6,"GLUTEN,KUSUYEMIS,YER_FISTIGI,SUSAM","vejetaryen,firinda,cocuk-dostu",Karışımı kalıba bastırarak yerleştirin; gevşek kalırsa dilimler kırılır.,Ara öğünde kahve veya sütle tüketin.,Oat Granola Bars,"Baked snack bars of oats, hazelnuts, raisins, peanut butter, and sesame, firm enough for lunchboxes and afternoon hunger.",,,0,0,Hafer-Granolariegel,"Gebackene Riegel aus Hafer, Haselnüssen, Rosinen, Erdnussbutter und Sesam, fest genug für Brotdose und Nachmittagsloch.",,,0,0
izmir-kofte,İzmir Köfte,"Köfte, patates ve domates sosunun fırında birlikte piştiği klasik Ege yemeği.",YEMEK,tr,MEDIUM,30,45,75,4,520,Dana kıyma 500 gr | Soğan 1 adet | Yumurta 1 adet | Galeta unu 3 yemek kaşığı | Patates 4 adet | Domates 3 adet | Yeşil biber 4 adet | Zeytinyağı 3 yemek kaşığı | Tuz 1 tatlı kaşığı,9,"1. Kıyma, rendelenmiş soğan, yumurta, galeta unu ve tuzu yoğurup köfte harcı hazırlayın. || 2. Patatesleri elma dilim, domates ve yeşil biberleri iri parçalar halinde kesin. || 3. Köfteleri şekillendirip zeytinyağında kısa süre mühürleyin, patatesleri de hafif kızartın. || 4. Tepsiye köfte, patates, domates ve biberleri dizip 200°C fırında pişirin. || 5. Sebzeler yumuşayıp köfteler tamamen pişince sıcak servis edin.",5,"GLUTEN,YUMURTA","firinda,cocuk-dostu,misafir-sofrasi",Köfteleri fırına vermeden önce 10 dakika dinlendirin; şekilleri pişerken daha iyi korunur.,Pirinç pilavı ve cacıkla servis edin.,İzmir Köfte,"An İzmir oven dish of meatballs, potatoes, and tomato sauce, baked together until the edges brown and the tray turns deeply savory.",,,0,0,İzmir Köfte,"Ein Ofengericht aus İzmir mit Köfte, Kartoffeln und Tomatensauce, zusammen gebacken, bis die Ränder bräunen und die Sauce kräftig wird.",,,0,0
orman-kebabi,Orman Kebabı,"Kuşbaşı etin bezelye, havuç ve patatesle tencerede ağır ağır piştiği doyurucu yemek.",YEMEK,tr,MEDIUM,20,70,90,5,430,Dana kuşbaşı 600 gr | Soğan 1 adet | Patates 2 adet | Havuç 2 adet | Bezelye 1 su bardağı | Domates salçası 1 yemek kaşığı | Zeytinyağı 3 yemek kaşığı | Sıcak su 2.5 su bardağı | Tuz 1 tatlı kaşığı,9,"1. Dana kuşbaşını zeytinyağında 8 dakika renk alana kadar kavurun. || 2. Soğanı ekleyin, ardından domates salçasını katıp kokusu çıkana kadar çevirin. || 3. Patates ve havucu iri küp doğrayın, bezelyeyle birlikte tencereye alın. || 4. Sıcak suyu ve tuzu ekleyip yemeği 35-40 dakika sebzeler yumuşayana kadar pişirin. || 5. Orman kebabını suyunu çektirmeden ocaktan alın, dinlendirip servis edin.",5,,"tek-tencere,misafir-sofrasi",Eti sebzelerden önce mühürleyin; et suyu yemeğin içinde kalır ve sos daha yoğun olur.,Yanında sade pilavla servis edin.,Orman Kebabı,"A slow-cooked Turkish stew of beef, peas, carrot, and potato, simmered until the meat softens and the sauce turns savory.",,,0,0,Orman Kebabı,"Ein langsam gegarter türkischer Eintopf aus Rind, Erbsen, Karotte und Kartoffel, gekocht bis das Fleisch weich und die Sauce kräftig wird.",,,0,0
etli-guvec,Etli Güveç,"Et, patlıcan, biber ve domatesin güveçte uzun süre pişmesiyle hazırlanan bereketli yemek.",YEMEK,tr,MEDIUM,25,90,115,6,410,Kuzu kuşbaşı 700 gr | Patlıcan 3 adet | Domates 4 adet | Yeşil biber 4 adet | Soğan 2 adet | Sarımsak 5 diş | Zeytinyağı 4 yemek kaşığı | Tuz 1.5 tatlı kaşığı,8,"1. Patlıcanları iri küp doğrayın, domatesleri soyup parçalayın, soğanı piyazlık kesin ve biberleri bölün. || 2. Kuzu kuşbaşını güveç kabının tabanına yayın, üzerine soğan, sarımsak ve biberleri yerleştirin. || 3. Patlıcan ve domatesleri en üste alın, zeytinyağı ile tuzu bütün yüzeye gezdirin. || 4. Kabın kapağını kapatın, önceden ısıtılmış 190°C fırında 90 dakika yavaşça pişirin. || 5. Kapağı açıp sebzeler yumuşayınca 10 dakika daha üstü açık fırınlayın. || 6. Etli güveci fırından çıkarın, suyunun oturması için 5 dakika bekletin.",6,,"firinda,misafir-sofrasi",Güvecin kapağını sıkı kapatın; içeride oluşan buhar eti kurutmadan pişirir.,Tandır ekmeği veya bulgur pilavıyla servis edin.,Etli Güveç,"A clay-pot style Turkish stew that bakes lamb with eggplant, peppers, tomato, onion, and garlic until the pan turns juicy and rich.",,,0,0,Etli Güveç,"Ein türkischer Schmortopf im Guvec-Stil, bei dem man Lamm mit Aubergine, Paprika, Tomate, Zwiebel und Knoblauch saftig und reich baeckt.",,,0,0
rosto-kofte,Rosto Köfte,Rulo şekilli kıymalı harcın fırında pişip dilimlenerek servis edildiği aile yemeği.,YEMEK,tr,MEDIUM,25,45,70,6,370,Dana kıyma 700 gr | Yumurta 1 adet | Galeta unu 4 yemek kaşığı | Soğan 1 adet | Havuç 1 adet | Bezelye 0.5 su bardağı | Domates salçası 1 yemek kaşığı | Tuz 1 tatlı kaşığı,8,"1. Soğanı rendeleyip kıyma, yumurta, galeta unu ve tuzla 6 dakika yoğurun. || 2. Havucu haşlayıp bezelyeyle birlikte iç dolgu olarak hazırlayın. || 3. Kıymalı harcı yağlı kağıt üstünde açıp ortasına havuç ve bezelyeyi yerleştirin. || 4. Harçla dolguyu sararak rulo şekli verin, salçalı suyu tepsiye dökün. || 5. Önceden ısıtılmış 190°C fırında 40-45 dakika pişirip dilimleyin.",5,"GLUTEN,YUMURTA","firinda,cocuk-dostu",Köfte harcını streç film üzerinde sıkı rulo yapın; fırında dağılmadan dilimlenir.,Patates püresi ve domates sosuyla servis edin.,Rosto Köfte,"A family-style rolled meatloaf with vegetables baked inside, sliced warm and served with tomato-rich pan juices.",,,0,0,Rosto Köfte,"Ein Familiengericht aus gerolltem Hackbraten mit Gemüse im Inneren, warm in Scheiben geschnitten und mit Bratensaft serviert.",,,0,0
kuzu-tandir,Kuzu Tandır,Kuzu kolun düşük ısıda uzun süre pişerek lokum gibi yumuşadığı geleneksel yemek.,YEMEK,tr,HARD,20,180,200,6,560,Kuzu kol 1.5 kg | Zeytinyağı 4 yemek kaşığı | Sarımsak 6 diş | Biberiye 2 dal | Tuz 1.5 tatlı kaşığı | Karabiber 1 çay kaşığı | Su 1 su bardağı,7,"1. Kuzu kolu zeytinyağı, ezilmiş sarımsak, tuz ve karabiberle her yanını kaplayacak şekilde ovun. || 2. Eti oda ısısında 30 dakika bekletin, fırını 160°C'ye ısıtın. || 3. Eti fırın kabına alıp biberiye ve suyu ekleyin, üzerini sıkıca kapatın. || 4. Kapalı olarak et lif lif olacak yumuşaklığa gelene kadar 3 saat pişirin. || 5. Kapağı açıp üzeri hafif kızarsın diye 15 dakika daha pişirip servis edin.",5,,"misafir-sofrasi,yuksek-protein,firinda",Eti yağlı kağıt ve folyo ile sıkı kapatın; düşük ısıda kendi suyuyla pişer.,İç pilav ve közlenmiş biberle servis edin.,Kuzu Tandır,A classic Turkish roast where lamb shoulder cooks low and slow with garlic and rosemary until it turns tender enough to fall apart.,,,0,0,Kuzu Tandır,"Ein klassischer türkischer Braten, bei dem Lammschulter mit Knoblauch und Rosmarin langsam gart, bis das Fleisch fast von selbst zerfällt.",,,0,0
tavuk-doner,Tavuk Döner,Baharatlı yoğurt marineli tavuk dilimlerinin tavada kızartılmasıyla yapılan ev usulü döner.,YEMEK,tr,MEDIUM,25,20,45,4,380,Tavuk but 700 gr | Yoğurt 3 yemek kaşığı | Zeytinyağı 3 yemek kaşığı | Domates salçası 1 yemek kaşığı | Sarımsak 2 diş | Kimyon 1 çay kaşığı | Tuz 1 tatlı kaşığı,7,"1. Yoğurt, zeytinyağı, domates salçası, sarımsak, kimyon ve tuzu karıştırın. || 2. Tavuk butlarını marinasyonla kaplayıp 20 dakika bekletin. || 3. Parçaları sıkıca üst üste sarıp dondurucuda 2 saat sertleştirin. || 4. Doneri ince dilimler halinde kesip tavaya yayın. || 5. Yüksek ateşte kenarları kızarana kadar 12-15 dakika pişirin.",5,SUT,"yuksek-protein,cocuk-dostu",Marine edilmiş tavuğu rulo yapıp dondurucuda 2 saat bekletin; ince dilimlemek kolaylaşır.,"Lavaş, soğan salatası ve ayranla servis edin.",Tavuk Döner,"A home-style döner of yogurt-marinated chicken, chilled in a tight roll, sliced thin, and seared until the edges catch.",,,0,0,Tavuk Döner,"Ein hausgemachter Döner aus in Joghurt mariniertem Hähnchen, als Rolle gut gekühlt, dünn geschnitten und an den Rändern kräftig gebraten.",,,0,0
tavuklu-keskek,Tavuklu Keşkek,Buğday ve tavuğun uzun süre pişip ezilmesiyle hazırlanan geleneksel tören yemeği.,YEMEK,tr,HARD,30,120,150,6,480,Aşurelik buğday 2 su bardağı | Tavuk but 3 adet | Tereyağı 2 yemek kaşığı | Su 8 su bardağı | Tuz 1.5 tatlı kaşığı | Toz kırmızı biber 1 çay kaşığı,6,"1. Aşurelik buğdayı bir gece suda bekletin, ertesi gün süzün. || 2. Buğday ve tavuk butları suyla tencereye alın, 2 saat yumuşayana kadar pişirin. || 3. Tavukları kemikten ayırın, buğdayla birlikte ezerek keşkeği dövün. || 4. Tereyağını kızdırın, tuz ve toz kırmızı biberi yağa ekleyin. || 5. Tavuklu keşkeğin üstüne biberli yağı gezdirip sıcak servis edin.",5,"GLUTEN,SUT","misafir-sofrasi,yuksek-protein",Buğdayı bir gece ıslatın; pişerken daha kısa sürede açılır ve kremamsı olur.,"Üstüne tereyağlı biber gezdirip yanında turşuyla, sıcak servis tabağında sunun.",Tavuklu Keşkek,"A ceremonial Anatolian dish where wheat and chicken cook for hours, then are beaten together into a thick, buttery comfort bowl.",,,0,0,Tavuklu Keşkek,"Ein zeremonielles anatolisches Gericht, bei dem Weizen und Hähnchen stundenlang garen und zu einer dicken, tröstlichen Masse geschlagen werden.",,,0,0
besamelli-tavuk,Beşamelli Tavuk,Tavuk ve sebzelerin beşamel sosla kaplanıp fırında kızardığı kremamsı ana yemek.,YEMEK,tr,MEDIUM,25,35,60,4,510,Tavuk göğsü 600 gr | Mantar 250 gr | Bezelye 1 su bardağı | Tereyağı 2 yemek kaşığı | Un 2 yemek kaşığı | Süt 2 su bardağı | Kaşar peyniri 1 su bardağı | Tuz 1 tatlı kaşığı,8,"1. Tavuk göğsünü kuşbaşı doğrayın, mantarı dilimleyin ve bezelyeyi hazırlayın. || 2. Tavuğu tavada çevirip suyunu çektirin, mantar ve bezelyeyi ekleyin. || 3. Tereyağı ve unu ayrı tencerede kavurup sütle açarak beşamel sos hazırlayın. || 4. Tavuklu harcı fırın kabına alın, beşameli ve kaşar peynirini üstüne yayın. || 5. Yemeği 190°C fırında üzeri kızarana kadar 20-25 dakika pişirin.",5,"GLUTEN,SUT","firinda,cocuk-dostu",Beşamel sosu sürekli çırparak pişirin; un topaklanmadan pürüzsüz kıvam alır.,Yanında yeşil salata ile servis edin.,Chicken with Béchamel,"A baked comfort dish that covers sauteed chicken, mushrooms, and peas with béchamel and cheese, creamy, browned on top, and made for a family table.",,,0,0,Hähnchen mit Béchamelsauce,"Ein überbackenes Wohlfühlgericht, bei dem man Hähnchen, Pilze und Erbsen mit Béchamelsauce und Käse bedeckt, cremig, oben gebräunt und familientauglich.",,,0,0
tavuklu-bezelye,Tavuklu Bezelye,"Tavuk parçaları, bezelye, havuç ve patatesle hazırlanan pratik tencere yemeği.",YEMEK,tr,EASY,15,35,50,4,350,Tavuk göğsü 500 gr | Bezelye 2 su bardağı | Patates 2 adet | Havuç 1 adet | Soğan 1 adet | Domates salçası 1 yemek kaşığı | Zeytinyağı 3 yemek kaşığı | Sıcak su 2 su bardağı,8,"1. Tavuk göğsünü, patatesi, havucu ve soğanı eşit küpler halinde doğrayın. || 2. Zeytinyağını tencerede ısıtın, tavukları renk alana kadar 6 dakika mühürleyin. || 3. Soğanı ve domates salçasını ekleyip kokusu açılıncaya kadar 2 dakika kavurun. || 4. Bezelye, patates, havuç ve sıcak suyu ilave edin, kapağı kapalı 25 dakika pişirin. || 5. Sebzeler yumuşayınca tencereyi dinlendirin, tavuklu bezelyeyi tane pilav yanına verin.",5,,"tek-tencere,pratik,cocuk-dostu",Tavukları önce mühürleyin; sebzeler eklenince parçalanmadan pişer.,Bulgur pilavı ve turşuyla servis edin.,Chicken and Peas,"A practical Turkish pot dish of chicken, peas, potato, and carrot, simmered together until the sauce turns soft and homey.",,,0,0,Hähnchen mit Erbsen,"Ein praktisches türkisches Topfgericht aus Hähnchen, Erbsen, Kartoffeln und Karotten, weich geschmort und angenehm hausgemacht.",,,0,0
balli-hardalli-tavuk,Ballı Hardallı Tavuk,"Bal, hardal ve limonla marine edilen tavuk filetoların tavada piştiği tatlı-ekşi yemek.",YEMEK,tr,EASY,15,18,33,4,400,Tavuk fileto 600 gr | Bal 2 yemek kaşığı | Hardal 2 yemek kaşığı | Limon suyu 2 yemek kaşığı | Zeytinyağı 2 yemek kaşığı | Sarımsak 2 diş | Tuz 1 çay kaşığı,7,"1. Bal, hardal, limon suyu, zeytinyağı, sarımsak ve tuzu kapta çırpın. || 2. Tavuk filetoları sosa bulayıp 20 dakika dinlendirin. || 3. Tavayı orta ateşte ısıtıp tavukların ilk yüzünü 5-6 dakika pişirin. || 4. Tavukları çevirip kalan sostan sürerek 6-8 dakika daha pişirin. || 5. Ballı hardallı tavukları dilimlemeden önce 3 dakika dinlendirin.",5,HARDAL,yuksek-protein,Balı yüksek ateşte yakmayın; tavuk mühürlendikten sonra sosu eklemek parlak kaplama verir.,Fırın sebze veya kuskusla servis edin.,Honey Mustard Chicken,"A quick skillet chicken that marinates in honey, mustard, lemon, and garlic, glossy, tangy-sweet, and easy to pair with couscous or roasted vegetables.",,,0,0,Honig-Senf-Hähnchen,"Ein schnelles Pfannengericht, bei dem man Hähnchen in Honig, Senf, Zitrone und Knoblauch mariniert, glänzend, süß-säuerlich und gut zu Gemüse oder Couscous.",,,0,0
tavuklu-noodle,Tavuklu Noodle,"Tavuk, sebze, noodle ve soya sosuyla hazırlanan hızlı Asya usulü tava yemeği.",YEMEK,tr,EASY,15,15,30,3,520,Noodle 250 gr | Tavuk göğsü 350 gr | Havuç 1 adet | Kırmızı biber 1 adet | Kabak 1 adet | Soya sosu 3 yemek kaşığı | Susam yağı 1 yemek kaşığı | Sarımsak 2 diş,8,"1. Noodle ve Tavuk göğsü için ön hazırlığı tamamlayıp kalan ürünleri tezgaha alın. || 2. Noodle'ı paket süresine göre haşlayıp süzün. || 3. Tavukları ince doğrayıp sıcak tavada 6-7 dakika pişirin. || 4. Sebzeler, soya sosu, susam yağı ve noodle'ı ekleyip 4 dakika çevirin. || 5. Tavuklu Noodle tarifini kısa bir dinlenmeden sonra servis edin.",5,"GLUTEN,SOYA,SUSAM","30-dakika-alti,yuksek-protein",Sebzeleri yüksek ateşte kısa süre pişirin; renkleri canlı ve dokuları diri kalır.,Üstüne taze soğan ve susam serpip woktan çıkar çıkmaz sıcak sunun.,Chicken Noodles,"A fast wok-style noodle dish with chicken, vegetables, soy sauce, and sesame oil, glossy in the pan and easy for weeknights.",,,0,0,Hähnchen-Nudeln,"Ein schnelles Wok-Nudelgericht mit Hähnchen, Gemüse, Sojasauce und Sesamöl, glänzend in der Pfanne und alltagstauglich.",,,0,0
turlu,Türlü,"Patlıcan, kabak, patates ve fasulyenin domatesli sosla piştiği yaz sebze yemeği.",YEMEK,tr,EASY,25,40,65,5,210,Patlıcan 2 adet | Kabak 2 adet | Patates 2 adet | Taze fasulye 250 gr | Domates 3 adet | Soğan 1 adet | Zeytinyağı 0.5 çay bardağı | Tuz 1 tatlı kaşığı,8,1. Soğanı zeytinyağında 4 dakika kavurun. || 2. Doğranmış sebzeleri ve domatesi tencereye ekleyin. || 3. Tuz ve 1 su bardağı sıcak su ekleyip kısık ateşte 35-40 dakika pişirin. || 4. Türlü için patlıcan ile kabak bölümünü son pişirme öncesi birlikte toparlayın. || 5. Türlü porsiyonlarını ocaktan alır almaz sıcak olarak servis edin.,5,,"vegan,tek-tencere,yaz-tarifi,vejetaryen",Sebzeleri benzer boyutta doğrayın; tencerede aynı sürede yumuşarlar.,Yoğurt ve bulgur pilavıyla servis edin.,Türlü,"A summer vegetable stew from Turkish home kitchens, where eggplant, zucchini, beans, and potato soften into tomato sauce.",,,0,0,Türlü,"Ein Sommergemüse-Eintopf aus türkischen Küchen, in dem Aubergine, Zucchini, Bohnen und Kartoffel in Tomate weich garen.",,,0,0
pirasa-yemegi,Pırasa Yemeği,"Pırasa, havuç ve pirinçle hazırlanan hafif zeytinyağlı tencere yemeği.",YEMEK,tr,EASY,15,30,45,4,230,Pırasa 1 kg | Havuç 2 adet | Pirinç 3 yemek kaşığı | Zeytinyağı 0.5 çay bardağı | Limon suyu 2 yemek kaşığı | Şeker 1 çay kaşığı | Tuz 1 tatlı kaşığı,7,"1. Pırasaları verev kesin, havuçları dilimleyin ve pirinci yıkayın. || 2. Zeytinyağında havuç ve pırasayı 5 dakika hafifçe soteleyin. || 3. Pirinci, limon suyunu, şekeri ve tuzu tencereye ekleyin. || 4. Az suyla yemeği 25-30 dakika kısık ateşte pirinç yumuşayana kadar pişirin. || 5. Pırasa yemeğini ılık ya da soğuk olarak zeytinyağlı şeklinde sunun.",5,,"vegan,dusuk-kalorili,tek-tencere,vejetaryen",Pırasayı çapraz dilimleyin; hem daha hızlı pişer hem de tabakta dağılmaz.,Limon suyu ile ılık veya soğuk servis edin.,Pırasa Yemeği,"A light olive-oil dish of leeks, carrot, and rice, gently cooked until soft and often served warm or at room temperature.",,,0,0,Pırasa Yemeği,"Ein leichtes Olivenölgericht aus Lauch, Karotte und Reis, sanft gegart und warm oder lauwarm serviert.",,,0,0
zeytinyagli-kereviz,Zeytinyağlı Kereviz,"Kereviz, portakal suyu ve havuçla pişen aromatik kış zeytinyağlısı.",YEMEK,tr,EASY,20,30,50,4,210,Kereviz 3 adet | Havuç 2 adet | Patates 1 adet | Portakal suyu 1 su bardağı | Zeytinyağı 0.5 çay bardağı | Limon suyu 2 yemek kaşığı | Tuz 1 çay kaşığı,7,"1. Kerevizleri kararmaması için limonlu suda bekletin, havuç ve patatesi doğrayın. || 2. Sebzeleri tencereye alın, zeytinyağı ve portakal suyunu üstlerine dökün. || 3. Kalan limon suyu ve tuzu ekleyip kapağı kapalı biçimde pişirmeye başlayın. || 4. Kereviz yemeğini 25-30 dakika sebzeler yumuşayana kadar kısık ateşte pişirin. || 5. Zeytinyağlı kerevizi ılınınca servis tabağına aktarın.",5,KEREVIZ,"vegan,kis-tarifi,dusuk-kalorili,vejetaryen",Soyduğunuz kerevizi limonlu suda bekletin; kararmadan açık rengini korur.,"Oda sıcaklığında, üstüne dereotu serperek limon dilimiyle meze tabağında sunun.",Zeytinyağlı Kereviz,"A winter olive oil dish of celery root, carrot, and orange juice, aromatic and light enough to serve at room temperature.",,,0,0,Zeytinyağlı Kereviz,"Ein winterliches Olivenölgericht aus Knollensellerie, Karotte und Orangensaft, aromatisch und leicht genug für lauwarmen Service.",,,0,0
