slug,title_tr,description_tr,type,cuisine,difficulty,prep_minutes,cook_minutes,total_minutes,serving_count,average_calories,ingredients_tr,ingredient_count,steps_tr,step_count,allergens,tags,tipNote_tr,servingSuggestion_tr,en_title_current,en_description_current,en_tipNote_current,en_servingSuggestion_current,en_ingredients_present,en_steps_present,de_title_current,de_description_current,de_tipNote_current,de_servingSuggestion_current,de_ingredients_present,de_steps_present
eksili-kabak-siyirmasi-mugla-bag-evi-usulu,Muğla Ekşili Kabak Sıyırması,"Muğla ekşili kabak sıyırması, ince doğranmış kabağı sarımsak ve limonla pişirerek sulu, ferah ve sade bir yaz yemeği çıkarır.",YEMEK,tr,EASY,10,16,26,4,122,Kabak 4 adet | Sarımsak 2 diş | Limon suyu 1.5 yemek kaşığı | Zeytinyağı 1.5 yemek kaşığı | Dereotu 0.25 demet,5,1. Kabakları ince şeritler halinde doğrayın. || 2. Yağ ve sarımsakla 10 dakika pişirin. || 3. Limon suyu ve dereotunu ekleyip servis edin.,3,,"30-dakika-alti,vegan,yaz-tarifi",Kabağı ince sıyırmak kısa sürede yumuşamasını sağlar.,"Geniş servis tabağında, üstüne sızma zeytinyağı ve limon kabuğu rendesi gezdirerek ılık servis edin.",Mugla Tangy Shaved Zucchini,"This Mugla dish cooks shaved zucchini with garlic and lemon into a light, brothy, and refreshing summer plate.",Shaving the zucchini thinly helps it soften in a short time.,Serve warm.,1,1,Mugla-Säurezucchini,"Dieses Gericht aus Muğla gart fein gehobelte Zucchini mit Knoblauch und Zitrone zu einem leichten, saftigen und erfrischenden Sommerteller.","Wer die Zucchini fein abhobelt, bekommt sie in kurzer Zeit weich.",Warm servieren.,1,1
eksili-pancarli-keskek-kastamonu-ova-usulu,Kastamonu Ekşili Pancarlı Keşkek,"Kastamonu ekşili pancarlı keşkek, dövme buğdayı pancar ve limonla pişirerek kıpkırmızı, tok ve kırsal bir sofra yemeği sunar.",YEMEK,tr,MEDIUM,14,36,50,4,224,Dövme buğday 1 su bardağı | Pancar 2 adet | Limon suyu 1 yemek kaşığı | Zeytinyağı 1 yemek kaşığı | Su 4 su bardağı,5,1. Buğdayı suyla tencereye alın. || 2. Pancarı ekleyip yemeği 30 dakika pişirin. || 3. Limon suyuyla tamamlayıp servis edin.,3,GLUTEN,"tek-tencere,vejetaryen",Pancarı küçük doğramak keşkeğe daha dengeli renk verir.,Taze dilimlenmiş ekmek ve yanında mevsim yeşillikleriyle derin tabakta verin.,Kastamonu Sour Beet Keskek,"This Kastamonu dish cooks cracked wheat with beet and lemon into a rustic, filling pot meal.",Cutting the beets small gives the keshkek a more even color.,Serve warm.,1,1,Kastamonu-Keşkek mit saurer Roter Bete,"Dieses Gericht aus Kastamonu kocht Weizen mit Roter Bete und Zitrone zu einer rustikalen, sättigenden Topfmahlzeit.","Wird die Rote Bete klein geschnitten, färbt sie den Keşkek gleichmäßiger.",Warm servieren.,1,1
enginarli-borulce-guveci-izmir-bag-usulu,İzmir Enginarlı Börülce Güveci,"İzmir enginarlı börülce güveci, taze börülce ve enginarı zeytinyağında pişirerek hafif, sulu ve Ege kokulu bir sebze yemeği hazırlar.",YEMEK,tr,EASY,15,25,40,4,176,Taze börülce 300 gr | Enginar 2 adet | Domates 2 adet | Zeytinyağı 2 yemek kaşığı | Limon suyu 1 yemek kaşığı,5,1. Sebzeleri doğrayıp tencereye alın. || 2. Zeytinyağı ve domatesle 20 dakika pişirin. || 3. Limon suyunu ekleyip dinlendirerek servis edin.,3,,"vegan,yaz-tarifi,tek-tencere",Enginarı limonlu suda bekletmek rengini korur.,Üzerine yoğurt kaşığı ve bol maydanozla birlikte ılıklığında sunun.,Izmir Green Bean and Artichoke Stew,"This Izmir olive-oil stew cooks green beans with artichokes into a light, brothy vegetable dish full of Aegean aroma.",Keep the artichokes in lemon water before cooking so they hold their color.,Serve warm.,1,1,Gemüsegüveç aus Izmir mit Bohnen und Artischocke,"Dieser Olivenöleintopf aus Izmir gart grüne Bohnen mit Artischocken zu einem leichten, saftigen Gemüsegericht voller Ägäis-Aroma.","Die Artischocken vor dem Garen in Zitronenwasser legen, damit sie ihre Farbe behalten.",Warm servieren.,1,1
fasulyeli-misir-ekmegi-durumu-trabzon-yayla-usulu,Trabzon Fasulyeli Mısır Ekmeği Dürümü,"Trabzon fasulyeli mısır ekmeği dürümü, haşlanmış fasulyeyi mısır ekmeğine sararak tok, pratik ve kırsal bir öğün kurar.",KAHVALTI,tr,EASY,10,10,20,4,228,Mısır ekmeği 4 dilim | Haşlanmış kuru fasulye 2 su bardağı | Tereyağı 20 gr | Karabiber 0.5 çay kaşığı,4,1. Fasulyeyi tereyağı ve karabiberle 5 dakika ısıtın. || 2. Mısır ekmeklerini tavada hafifçe ısıtın. || 3. Fasulyeyi ekmeklere paylaştırıp dürüm yaparak servis edin.,3,SUT,"30-dakika-alti,butce-dostu,vejetaryen",Mısır ekmeğini tavada kısa ısıtmak sarımı kolaylaştırır.,Tahta tepsiye yerleştirip bir sürahi portakal suyu ve karmaşık tane ekmek dilimleri ekleyin.,Trabzon Cornbread Wrap with Beans,"This Trabzon wrap fills corn bread with cooked beans for a rustic, practical, and satisfying meal.",A short warm-up in the pan makes the cornbread easier to roll without cracking.,Serve warm.,1,1,Trabzon-Wrap aus Maisbrot mit Bohnen,"Dieser Wrap aus Trabzon füllt Maisbrot mit gekochten Bohnen zu einer rustikalen, praktischen und sättigenden Mahlzeit.","Durch kurzes Erwärmen in der Pfanne lässt sich das Maisbrot leichter rollen, ohne zu brechen.",Warm servieren.,1,1
hamsili-karalahana-sote-giresun-ev-usulu,Giresun Hamsili Karalahana Sote,"Giresun hamsili karalahana sote, ince kıyılmış karalahanayı hamsiyle tavada birleştirerek tuzlu, yeşil ve kıyı karakterli bir yemek hazırlar.",YEMEK,tr,EASY,14,16,30,4,198,Hamsi fileto 250 gr | Karalahana 1 demet | Kuru soğan 1 adet | Zeytinyağı 1 yemek kaşığı | Mısır unu 1 yemek kaşığı,5,1. Soğanı yağda 4 dakika çevirin. || 2. Karalahanayı ve mısır ununu ekleyip 5 dakika soteleyin. || 3. Hamsiyi katıp 6 dakika daha pişirin.,3,DENIZ_URUNLERI,"30-dakika-alti,yuksek-protein,kis-tarifi",Karalahanayı fazla uzun pişirmemek parlak rengini korur.,Üzerine ince dilimlenmiş soğan ve nar taneleriyle İstanbul meyhanesi sunumu hazırlayın.,Giresun Anchovy Kale Sauté,"This Giresun pan dish joins kale with anchovies for a salty, green, coastal plate full of Black Sea character.","Do not cook the collard greens too long, so they keep their bright color.",Serve hot.,1,1,Giresun-Sauté aus Anchovis und Schwarzkohl,"Dieses Pfannengericht aus Giresun verbindet Schwarzkohl mit Anchovis zu einem salzigen, grünen und küstigen Teller voller Schwarzmeer-Charakter.","Den Schwarzkohl nicht zu lange garen, damit seine kräftige Farbe erhalten bleibt.",Heiß servieren.,1,1
hashasli-mercimek-krep-kutahya-koy-usulu,Kütahya Haşhaşlı Mercimek Krep,"Kütahya haşhaşlı mercimek krep, mercimekli içi haşhaş aromalı ince kreplerle buluşturarak tok bir kahvaltı tabağı kurar.",KAHVALTI,tr,MEDIUM,18,16,34,4,244,Un 1 su bardağı | Yumurta 1 adet | Süt 1 su bardağı | Haşhaş ezmesi 2 yemek kaşığı | Haşlanmış yeşil mercimek 1 su bardağı,5,1. Krep hamurunu hazırlayın. || 2. Krepleri toplam 8 dakika pişirin. || 3. Mercimekli içle doldurup servis edin.,3,"GLUTEN,SUT,YUMURTA","misafir-sofrasi,vejetaryen",Krep hamurunu 10 dakika bekletmek tavada daha dengeli yayılmasını sağlar.,"Yanına közlenmiş biber, salatalık turşusu ve sıcak çörek dilimleriyle serpintisiz sunum kurun.",Kutahya Poppy Lentil Crepes,These Kutahya crepes pair a lentil filling with thin pancakes scented with poppy paste.,Letting the batter stand for 10 minutes helps it spread more evenly in the pan.,Serve warm.,1,1,Kütahya-Crêpes mit Mohn und Linsen,"Diese Crêpes aus Kütahya verbinden eine Linsenfüllung mit dünnen Pfannkuchen, die nach Mohn duften.",Ruhen 10 Minuten macht den Teig in der Pfanne deutlich gleichmäßiger.,Warm servieren.,1,1
humus,Humus,"Nohut ezmesi ile yapılan, tahini, limon ve zeytinyağı ile servis edilen Ortadoğu lezzeti.",APERATIF,me,EASY,10,0,10,4,170,Haşlanmış nohut 400 gr | Tahin 3 yemek kaşığı | Limon suyu 2 yemek kaşığı | Sarımsak 1 diş | Zeytinyağı | Tuz | Kimyon | Pul biber 0.5 çay kaşığı,8,"1. Tüm malzemeleri blender'a koyun. || 2. Pürüzsüz olana kadar çekin. Gerekirse su ekleyin. || 3. Tabağa alın, zeytinyağı ve pul biber ile süsleyin.",3,SUSAM,"pratik,vegan,30-dakika-alti,vejetaryen","Kuru baklagili gece boyunca ılık suda bekletmek pişme süresini yarıya indirir, gaz yapma etkisini de azaltır.",Yanına bulgur pilavı ve turşu koyarak derin kasede verin; üzerine pul biber gezdirin.,Hummus,"A Levantine chickpea purée blended with tahini, lemon, and garlic until silky, then finished with olive oil for scooping with warm flatbread.","Blend a little longer than you think you need, that extra minute is what gives hummus a silky texture.","Serve with warm pita, raw vegetables, or grilled meat.",1,1,Hummus,"Ein levantinisches Kichererbsenpüree mit Tahini, Zitrone und Knoblauch, fein gemixt bis seidig und mit Olivenöl vollendet, damit man es mit warmem Brot auftunkt.","Ein paar Sekunden langer mixen macht hier den Unterschied, so wird die Creme besonders samtig.","Mit warmem Fladenbrot, rohem Gemuse oder Gegrilltem servieren.",1,1
imam-bayildi,İmam Bayıldı,"Zeytinyağlı Türk mutfağının en sevilen yemeklerinden, soğuk servis edilir.",YEMEK,tr,MEDIUM,20,40,60,4,200,Patlıcan 4 adet | Soğan 3 adet | Domates 3 adet | Sarımsak 4 diş | Zeytinyağı 1/2 su bardağı | Tuz | Şeker | Maydanoz,8,"1. Patlıcanları alacalı soyun, yarın ve tuzlu suda bekletin. || 2. Soğanları halka kesin, zeytinyağında kavurun. || 3. Domatesleri rendeleyin, sarımsakla ekleyin. || 4. Patlıcanları tepsiye dizin, harcı doldurun. || 5. Üzerine sıcak su ekleyin, 180°C fırında 40 dk pişirin.",5,,"vegan,misafir-sofrasi,vejetaryen",Otları kıymadan önce çok kuru olmasına dikkat edin; ıslak yaprak aroma yerine acılık bırakır.,"Sıcak pide veya lavaşla birlikte tabakta sunun, üstüne bir kaşık tahin tarator düşünülebilir.",İmam Bayıldı,"A classic olive-oil dish of eggplant stuffed with onion and tomato, braised until silky and served at room temperature on Aegean-style tables.","This dish tastes better after it has cooled, the olive oil settles into the vegetables and the filling turns silkier.",Serve at room temperature with bread and a few lemon wedges.,1,1,İmam Bayıldı,"Ein klassisches Olivenölgericht mit Auberginen, Zwiebel und Tomate, weich geschmort und bei Zimmertemperatur serviert, wie man es an Ägäis-Tischen kennt.","Abgekuhlt schmeckt das Gericht noch runder, weil das Olivenol in das Gemuse einzieht und die Fullung samtiger wird.",Bei Zimmertemperatur mit Brot und Zitronenspalten servieren.,1,1
karniyarik,Karnıyarık,Türk mutfağının vazgeçilmez et yemeklerinden biri. Kızartılmış patlıcanların arasına kıymalı harç doldurularak fırında pişirilir.,YEMEK,tr,MEDIUM,20,40,60,4,320,Patlıcan 4 adet | Kıyma 300 gr | Soğan 2 adet | Domates 2 adet | Biber salçası 1 yemek kaşığı | Sivri biber 2 adet | Sarımsak 3 diş | Tuz 1 çay kaşığı | Karabiber 0.5 çay kaşığı | Sıvı yağ 3 yemek kaşığı,10,"1. Patlıcanları yıkayın ve alacalı soyun. Ortadan yarıp tuzlu suda 15 dakika bekletin. || 2. Patlıcanları sudan çıkarıp kurulayın. Kızgın yağda her iki tarafını kızartın. || 3. Soğanları ince doğrayın. Ayrı bir tavada yağda pembeleşene kadar kavurun. || 4. Kıymayı ekleyin, suyunu çekene kadar karıştırarak pişirin. || 5. Doğranmış domatesleri, salçayı, sarımsağı ve baharatları ekleyin. 5 dakika pişirin. || 6. Kızartılmış patlıcanları tepsiye dizin, ortalarını açıp kıymalı harcı doldurun. || 7. Önceden ısıtılmış 180°C fırında 25 dakika pişirin.",7,,"firinda,misafir-sofrasi",Patlıcanları tuzlu suda bekletmek hem acılığını alır hem de yağ çekmesini azaltır.,Pilav ve cacık ile servis edin.,Karnıyarık,"A Turkish classic of fried eggplant split and filled with minced meat, tomato, and garlic, then baked until silky and deeply savory.",Soaking the eggplants in salted water draws out bitterness and helps them absorb less oil while frying.,Serve with rice pilaf and a bowl of cool yogurt dip.,1,1,Karnıyarık,"Ein türkischer Klassiker aus gebratener Aubergine, gefüllt mit Hackfleisch, Tomate und Knoblauch und im Ofen fertig gegart, bis alles seidig und würzig wird.","Das Salzwasser nimmt den Auberginen die Bitterstoffe und sorgt dafur, dass sie beim Braten weniger Fett aufsaugen.",Dazu passen Reis und ein kuhler Joghurt-Dip.,1,1
keskekli-istavrit-tava-sinop-liman-usulu,Sinop Keşkekli İstavrit Tava,"Sinop keşkekli istavrit tava, yumuşak keşkek tabanını tavada kızarmış istavritle buluşturarak deniz ve tahılı aynı tabakta toplar.",YEMEK,tr,MEDIUM,16,20,36,4,274,İstavrit 500 gr | Keşkeklik buğday 1 su bardağı | Un 2 yemek kaşığı | Sıvı yağ 3 yemek kaşığı | Tuz 0.75 çay kaşığı,5,1. Buğdayı yumuşayana kadar haşlayıp ezin. || 2. İstavriti unlayıp tavada 8 dakika kızartın. || 3. Keşkeği tabağa alıp balığı üstüne yerleştirerek servis edin.,3,"DENIZ_URUNLERI,GLUTEN",misafir-sofrasi,Balığı tavaya almadan önce kurulamak daha net kızarmasını sağlar.,Taze dilimlenmiş ekmek ve yanında mevsim yeşillikleriyle derin tabakta verin.,Sinop Horse Mackerel with Keskek,"This Sinop plate sets pan-fried horse mackerel over soft wheat keskek, bringing sea and grain together in one dish.","Dry the fish before it goes into the pan, so it browns more cleanly.",Serve hot.,1,1,Sinop-Stöcker mit Keşkek,Dieser Teller aus Sinop legt gebratenen Stöcker auf weichen Weizen-Keşkek und bringt Meer und Getreide in einem Gericht zusammen.,"Den Fisch vor dem Braten gut trocknen, damit er klarer bräunt.",Heiß servieren.,1,1
kuru-fasulye,Kuru Fasulye,"Türk mutfağının efsanesi, pilav ile mükemmel uyum.",YEMEK,tr,MEDIUM,15,60,75,6,280,Kuru fasulye 2 su bardağı | Soğan 1 adet | Domates salçası 2 yemek kaşığı | Biber salçası 1 yemek kaşığı | Sıvı yağ 3 yemek kaşığı | Sıcak su 4 su bardağı | Tuz | Karabiber | Pul biber,9,1. Fasulyeleri bir gece suda bekletin. Ertesi gün süzün. || 2. Soğanı yağda kavurun. Salçaları ekleyin. || 3. Fasulyeleri ve sıcak suyu ekleyin. Kısık ateşte pişirin. || 4. Yumuşayınca tuz ve baharatları ekleyin.,4,,"butce-dostu,yuksek-protein,kis-tarifi,vejetaryen,vegan",Fasulyeleri bir gece önceden ıslatın.,Yanına bulgur pilavı ve turşu koyarak derin kasede verin; üzerine pul biber gezdirin.,Kuru Fasulye,"Türkiye’s iconic bean stew cooks dried beans with onion and pepper paste until thick, comforting, and ready for rice on the side.",Soaking the beans overnight helps them cook evenly and keeps the skins from splitting too much.,"Serve with rice pilaf, pickles, and crusty bread.",1,1,Kuru Fasulye,"Ein ikonischer türkischer Bohneneintopf, bei dem getrocknete Bohnen mit Zwiebel und Paprikamark dick und tröstlich einkochen, meist mit Reis serviert.",Durch das Einweichen uber Nacht garen die Bohnen gleichmassiger und platzen beim Kochen weniger auf.,"Mit Reis, Essiggemuse und Brot servieren.",1,1
lahanali-mantar-guveci-zonguldak-maden-usulu,Zonguldak Lahanalı Mantar Güveci,"Zonguldak lahanalı mantar güveci, lahanayı mantar ve domatesle ağır ağır pişirerek sulu ve toprak tonlu bir kış yemeği yapar.",YEMEK,tr,EASY,12,28,40,4,146,Beyaz lahana 400 gr | Mantar 250 gr | Domates 2 adet | Soğan 1 adet | Zeytinyağı 1 yemek kaşığı,5,1. Soğan ve mantarı 6 dakika pişirin. || 2. Lahana ve domatesi ekleyin. || 3. Yemeği 18 dakika pişirip servis edin.,3,,"tek-tencere,vegan,kis-tarifi",Mantarı yüksek ateşte başlatmak su salmasını geciktirir.,Taze dereotu ve zeytinyağıyla porselen tabakta soğuk tüketin; lezzet ertesi gün daha derin olur.,Zonguldak Cabbage Mushroom Casserole,This Zonguldak casserole cooks cabbage with mushroom and tomato into a brothy winter vegetable dish.,Starting the mushrooms over higher heat delays the moment when they flood the pan with liquid.,Serve warm.,1,1,Zonguldak-Kohl-Mushroom-Güveç,Dieser Güveç aus Zonguldak gart Kohl mit Pilzen und Tomate zu einem saftigen Wintergemüsegericht.,"Wer die Pilze mit etwas mehr Hitze beginnt, verzögert das starke Wasserziehen.",Warm servieren.,1,1
limonata,Limonata,"Ev yapımı taze limonata, yaz sıcaklarının vazgeçilmezi.",ICECEK,tr,EASY,10,0,10,4,80,Limon 4 adet | Şeker 4 yemek kaşığı | Su 1 litre | Nane süslemek için,4,"1. Limonların kabuğunu rendeleyin, suyunu sıkın. || 2. Blender'a limon suyu, kabuk rendesi, şeker ve suyu koyun. || 3. Kısa süre çekin (kabuğu parçalamayın), süzün. Soğuk servis edin.",3,,"pratik,30-dakika-alti,yaz-tarifi,vegan",Soğuk servis edilecekse karışımı buzdolabında en az 2 saat dinlendirmek aromanın oturmasını sağlar.,"Bardağın ağzını tuz veya şekerle kaplayıp (rim) süsleyin, içine dik bir kamış koyun.",Limonata,"A homemade lemonade of fresh lemon, sugar, and water, served ice-cold as the most familiar summer pitcher on Turkish tables.","A short blend is enough here, over-processing the zest can pull bitterness into the lemonade.",Serve well chilled with mint leaves and plenty of ice.,1,1,Limonata,"Eine hausgemachte Limonade aus frischer Zitrone, Zucker und Wasser, eiskalt serviert als vertrauter Sommerkrug auf türkischen Tischen.","Nur kurz mixen, sonst wird aus der Schale zu viel Bitterkeit in die Limonade gezogen.",Gut gekuhlt mit Minzblattern und viel Eis servieren.,1,1
lorlu-firik-dolma-izmir-bostan-usulu,İzmir Lorlu Firik Dolma,"İzmir lorlu firik dolma, biberleri lor ve firikle doldurarak Ege esintili hafif isli bir dolma hazırlar.",YEMEK,tr,MEDIUM,18,28,46,4,226,Dolmalık biber 4 adet | Firik 0.75 su bardağı | Lor peyniri 150 gr | Domates 1 adet | Zeytinyağı 1 yemek kaşığı,5,1. Firiği 8 dakika haşlayın. || 2. İçi hazırlayıp biberlere doldurun. || 3. Dolmaları 20 dakika pişirin.,3,"GLUTEN,SUT","misafir-sofrasi,vejetaryen",Firiği önceden kısa haşlamak dolmada eşit pişme sağlar.,"Yanına yoğurt veya cacık ve birkaç dilim limonla, hafif ılık serin.",Izmir Stuffed Peppers with Lor and Firik,These Izmir peppers are filled with lor cheese and firik wheat for a lightly smoky Aegean-style dolma.,A short pre-boil gives the freekeh a more even finish inside the stuffed peppers.,Serve warm.,1,1,Izmir-Gefüllte Paprika mit Lor und Firik,Diese Paprika aus Izmir werden mit Lor-Käse und Firik-Weizen gefüllt und ergeben eine leicht rauchige Dolma im Ägäis-Stil.,Durch das kurze Vorkochen gart der Freekeh in der Füllung deutlich gleichmäßiger.,Warm servieren.,1,1
mahlepli-yesil-mercimek-corbasi-tokat-bag-usulu,Tokat Mahlepli Yeşil Mercimek Çorbası,"Tokat mahlepli yeşil mercimek çorbası, mercimeği mahlep kokusuyla kaynatarak sıcak, hafif aromatik ve farklı bir çorba sunar.",CORBA,tr,EASY,10,30,40,4,188,Yeşil mercimek 1 su bardağı | Soğan 1 adet | Mahlep 0.25 çay kaşığı | Su 5 su bardağı | Tereyağı 15 gr,5,1. Soğanı tereyağında 4 dakika çevirin. || 2. Mercimek ve suyu ekleyip çorbayı 25 dakika pişirin. || 3. Mahlep ekleyip servis edin.,3,SUT,"tek-tencere,kis-tarifi",Mahlebi ölçülü kullanmak baskın tat oluşmasını önler.,Yanına çıtır bruşetta ve sarımsaklı yoğurt sosu koyup kışlık tabak kurgulayın.,Tokat Green Lentil Soup with Mahlab,"This Tokat soup cooks green lentils with a touch of mahlab for a warm, lightly aromatic bowl.","Use the mahleb with restraint, so it adds fragrance without taking over the soup.",Serve hot.,1,1,Tokat-Linsensuppe mit Mahlep,"Diese Suppe aus Tokat kocht grüne Linsen mit etwas Mahlep zu einer warmen, leicht aromatischen Schale.","Mahlep sparsam einsetzen, damit das Aroma nicht die ganze Suppe überdeckt.",Heiß servieren.,1,1
menemen,Menemen,"Domates, biber ve yumurtanın buluştuğu pratik ve lezzetli Türk kahvaltısı.",KAHVALTI,tr,EASY,5,10,15,2,220,Yumurta 3 adet | Domates 2 adet | Sivri biber 2 adet | Tereyağı 1 yemek kaşığı | Tuz | Karabiber | Pul biber,7,"1. Domatesleri ve biberleri küçük küçük doğrayın. || 2. Tavada tereyağını eritin, biberleri kavurun. || 3. Domatesleri ekleyin, suyunu çekene kadar pişirin. || 4. Yumurtaları kırıp ekleyin, hafifçe karıştırın. Pişince servis edin.",4,"SUT,YUMURTA","pratik,30-dakika-alti,vejetaryen",Yumurtayı sıvı yerine bir parça tereyağda pişirmek iç dokuyu nemli tutar.,"Yanına közlenmiş biber, salatalık turşusu ve sıcak çörek dilimleriyle serpintisiz sunum kurun.",Menemen,"A Turkish breakfast pan where tomato, green pepper, and egg come together soft and juicy, meant to be scooped up with bread.","Let the tomatoes cook down until jammy before adding the eggs, otherwise the pan stays watery.",Serve straight from the pan with crusty bread and a little white cheese.,1,1,Menemen,"Eine türkische Frühstückspfanne, in der Tomate, grüne Paprika und Ei weich und saftig zusammenkommen und mit Brot gegessen werden.","Die Tomaten erst gut einkochen lassen, dann bekommen die Eier eine saftige statt wassrige Basis.",Direkt aus der Pfanne mit knusprigem Brot und etwas Weisskase servieren.,1,1
mercimek-corbasi,Mercimek Çorbası,"Türk sofrasının olmazsa olmazı, besleyici ve doyurucu kırmızı mercimek çorbası.",CORBA,tr,EASY,10,25,35,6,180,Kırmızı mercimek 1.5 su bardağı | Soğan 1 adet | Havuç 1 adet | Patates 1 adet | Domates salçası 1 yemek kaşığı | Su 6 su bardağı | Tereyağı 1 yemek kaşığı | Tuz | Karabiber | Kimyon,10,"1. Mercimekleri yıkayın. Soğanı, havucu ve patatesi küçük küçük doğrayın. || 2. Tencereye az yağ koyun, soğanı kavurun. Diğer sebzeleri ekleyin. || 3. Mercimekleri ve suyu ekleyin. Kaynamaya bırakın. || 4. Mercimekler yumuşayınca blender ile pürüzsüz hale getirin. || 5. Tuz, karabiber ve kimyon ekleyin. Tereyağı ile servis edin.",5,SUT,"butce-dostu,tek-tencere,kis-tarifi,vejetaryen","Limon sıkarak servis edin, lezzeti katlayacaktır.","Çorbayı ince uzun kaselere alıp yanına turşu tabağı koyun, küçük bir kase pul biber ayrı dursun.",Mercimek Çorbası,"A Turkish staple of red lentils, onion, carrot, and potato, blended smooth and finished with butter for a warming bowl.","Finish each bowl with a squeeze of lemon, it brightens the soup and deepens the lentil flavor.",Serve hot with lemon wedges and warm bread.,1,1,Mercimek Çorbası,"Ein türkischer Klassiker aus roten Linsen, Zwiebel, Karotte und Kartoffel, fein püriert und mit Butter zu einer wärmenden Schale vollendet.",Ein Spritzer Zitrone beim Servieren macht die Suppe frischer und hebt den Geschmack der Linsen.,Heiss mit Zitronenspalten und frischem Brot servieren.,1,1
mincili-laz-boregi-rize-ev-usulu,Rize Mincili Laz Böreği,"Rize mincili Laz böreği, ince hamur arasına minci ve tereyağı doldurarak çıtır katlı, hafif tuzlu ve çay yanına yakışan bir börek sunar.",APERATIF,tr,MEDIUM,24,25,49,6,244,Un 2 su bardağı | Yumurta 1 adet | Minci 150 gr | Tereyağı 50 gr | Su 0.75 su bardağı,5,"1. Un, yumurta ve suyla hamur hazırlayın. || 2. Hamuru açıp aralarına tereyağı ve minci yayarak katlayın. || 3. Böreği 190°C fırında 25 dakika pişirin.",3,"GLUTEN,SUT,YUMURTA",misafir-sofrasi,İç harcı sulu bırakmamak katların çıtır kalmasına yardım eder.,Ahşap tepside 3-4 meze bir arada sunmak için yanına acılı ezme ve kısırla eşleştirin.,Rize Minci Laz Pastry,"This Rize pastry layers thin dough with minci cheese and butter for a crisp, lightly salty bake made for tea time.","Keep the filling from turning watery, so the layers stay crisp.",Serve warm.,1,1,Laz-Börek mit Minci aus Rize,"Dieses Gebäck aus Rize schichtet dünnen Teig mit Minci-Käse und Butter zu einem knusprigen, leicht salzigen Ofenstück für die Teestunde.","Die Füllung nicht wässrig werden lassen, damit die Schichten knusprig bleiben.",Warm servieren.,1,1
misir-unlu-hamsi-koftesi-bartin-liman-usulu,Bartın Mısır Unlu Hamsi Köftesi,"Bartın mısır unlu hamsi köftesi, hamsiyi mısır unu ve soğanla yoğurup tavada kızartarak çıtır bir kıyı atıştırmalığı çıkarır.",APERATIF,tr,EASY,16,10,26,4,214,Hamsi fileto 300 gr | Mısır unu 0.75 su bardağı | Soğan 1 adet | Yumurta 1 adet | Sıvı yağ 3 yemek kaşığı,5,1. Malzemeleri yoğurup küçük köfteler yapın. || 2. Köfteleri tavada toplam 8 dakika kızartın. || 3. Sıcak servis edin.,3,"DENIZ_URUNLERI,YUMURTA","30-dakika-alti,yuksek-protein",Hamsiyi ince kıymak köftelerin tavada dağılmasını azaltır.,"Yanına turşu tabağı, zeytin ezmesi ve sıcak ekmekle meyhane usulü sofra tamamlayın.",Bartin Anchovy Cakes with Corn Flour,These Bartin cakes mix anchovy with corn flour and onion for a crisp Black Sea snack.,Finely mincing the anchovies helps the patties hold together in the pan.,Serve hot.,1,1,Bartın-Anchorvies-Küchlein mit Maismehl,Diese Küchlein aus Bartın mischen Anchovis mit Maismehl und Zwiebel zu einem knusprigen Schwarzmeer-Snack.,"Wer die Sardellen fein hackt, bekommt in der Pfanne stabilere Frikadellen.",Heiß servieren.,1,1
