slug,title_tr,description_tr,type,cuisine,difficulty,prep_minutes,cook_minutes,total_minutes,serving_count,average_calories,ingredients_tr,ingredient_count,steps_tr,step_count,allergens,tags,tipNote_tr,servingSuggestion_tr,en_title_current,en_description_current,en_tipNote_current,en_servingSuggestion_current,en_ingredients_present,en_steps_present,de_title_current,de_description_current,de_tipNote_current,de_servingSuggestion_current,de_ingredients_present,de_steps_present
stockholm-karidesli-raggmunk,Stockholm Karidesli Raggmunk,"İsveç karidesli raggmunk, rendelenmiş patatesli pankeki dereotlu karides ve ekşi kremayla tamamlayarak tuzlu bir kuzey tabağı yapar.",KAHVALTI,se,MEDIUM,16,18,34,4,420,Patates 600 gr | Un 0.5 su bardağı | Yumurta 2 adet | Süt 0.75 su bardağı | Karides 250 gr | Ekşi krema 0.75 su bardağı | Dereotu 0.25 demet,7,"1. Patatesleri rendeleyip suyunu sıkın. || 2. Un, yumurta ve sütle harç hazırlayın. || 3. Patatesi harca katıp tavaya ince yayın. || 4. Pankekleri iki yüzü toplam 12-14 dakika kızartın. || 5. Dereotlu karides ve ekşi kremayla servis edin.",5,"DENIZ_URUNLERI,SUT,YUMURTA,GLUTEN","yuksek-protein,misafir-sofrasi",Patatesin suyunu sıkmak pankekin dağılmadan kızarmasını sağlar.,Ekşi krema ve dereotlu karidesle sıcak servis edin.,Shrimp Raggmunk Plate,Potato pancakes meet dill shrimp and sour cream in this savory Swedish plate.,,,0,0,Raggmunk mit Garnelen,Kartoffelpfannkuchen treffen auf Dillgarnelen und Sauerrahm zu einem schwedischen Teller.,,,0,0
lima-patatesli-causa-tavuk,Lima Patatesli Causa Tavuk,"Peru tavuklu causa, lime ve ají amarillo ile ezilmiş sarı patatesi mayonezli tavuk dolgusu etrafında soğuk katlı bir tabağa dönüştürür.",SALATA,pe,MEDIUM,34,20,54,6,390,Sarı patates 900 gr | Haşlanmış tavuk 350 gr | Mayonez 3 yemek kaşığı | Lime suyu 3 yemek kaşığı | Ají amarillo ezmesi 1 yemek kaşığı | Avokado 1 adet | Yumurta 2 adet,7,1. Patatesleri 18-20 dakika yumuşayana kadar haşlayın. || 2. Sıcakken ezip lime suyu ve ají amarillo ile karıştırın. || 3. Tavuk ve mayonezi kremalı iç olacak şekilde harmanlayın. || 4. Patates püresini tavuk içiyle kat kat kalıba bastırın. || 5. Causayı 20 dakika soğutup avokado ve yumurtayla servis edin.,5,YUMURTA,"misafir-sofrasi,yaz-tarifi",Patatesi sıcakken ezmek causa tabanını daha pürüzsüz yapar.,Avokado ve haşlanmış yumurtayla soğuk servis edin.,Lima Chicken Causa,Lime and aji amarillo mashed potatoes layer around creamy chicken in this cold Peruvian plate.,,,0,0,Causa mit Huhn aus Lima,Mit Limette und Aji gewuerzte Kartoffeln schichten sich um cremiges Huhn zu diesem kalten peruanischen Teller.,,,0,0
krakow-peynirli-pierogi,Krakow Peynirli Pierogi,"Polonya peynirli pierogi, ince hamuru patates ve lor dolgusu ile kapatıp haşladıktan sonra tereyağında kısa çeviren yumuşak bir ev yemeğidir.",YEMEK,pl,MEDIUM,45,22,67,6,430,Un 3 su bardağı | Yumurta 1 adet | Patates 500 gr | Lor peyniri 250 gr | Tereyağı 2 yemek kaşığı | Soğan 1 adet | Ekşi krema 0.75 su bardağı,7,"1. Un, yumurta ve suyla yumuşak hamur yoğurun. || 2. Patatesleri haşlayıp lorla ezerek dolgu hazırlayın. || 3. Hamuru ince açıp yuvarlaklar kesin ve dolguyla kapatın. || 4. Pierogileri kaynar suda 5-6 dakika haşlayın. || 5. Tereyağında 3 dakika çevirip ekşi kremayla servis edin.",5,"GLUTEN,SUT,YUMURTA","vejetaryen,misafir-sofrasi",Dolguyu soğutmak pierogilerin kapanırken açılmasını önler.,Ekşi krema ve karamelize soğanla sıcak servis edin.,Cheese Pierogi from Krakow,Thin dough wraps potato and curd filling before a quick butter finish in this Polish comfort dish.,,,0,0,Pierogi mit Kaese aus Krakau,Duenner Teig umhuellt Kartoffel-Quark-Fuellung und bekommt ein kurzes Butterfinish.,,,0,0
melbourne-avokadolu-yumurtali-tost,Melbourne Avokadolu Yumurtalı Tost,"Melbourne avokadolu yumurtalı tost, ekşi maya dilimini ezilmiş avokado, poşe yumurta ve limonlu otlarla modern bir kahvaltıya çevirir.",KAHVALTI,au,EASY,12,8,20,2,390,Ekşi maya ekmeği 2 dilim | Avokado 1 adet | Yumurta 2 adet | Limon suyu 1 yemek kaşığı | Maydanoz 2 yemek kaşığı | Pul biber 0.25 çay kaşığı | Tuz 0.25 çay kaşığı,7,"1. Ekmek dilimlerini tavada iki yüzü kızarana kadar ısıtın. || 2. Avokadoyu limon suyu ve tuzla ezin. || 3. Yumurtaları hafif sirkeli suda 3 dakika poşeleyin. || 4. Avokadoyu tostların üzerine yayın. || 5. Poşe yumurta, maydanoz ve pul biberle servis edin.",5,"GLUTEN,YUMURTA","30-dakika-alti,vejetaryen",Yumurtayı suda girdap yapmadan bırakmak beyazının dağılmasını azaltır.,Pul biber ve limon kabuğuyla hemen servis edin.,Melbourne Avocado Egg Toast,"Sourdough, mashed avocado, poached egg, lemon, and herbs make this modern Australian breakfast.",,,0,0,Avocado-Ei-Toast aus Melbourne,"Sauerteig, Avocado, pochiertes Ei, Zitrone und Kraeuter ergeben dieses moderne australische Fruehstueck.",,,0,0
berlin-kori-soslu-tavuk-doner,Berlin Köri Soslu Tavuk Döner,"Berlin usulü köri soslu tavuk döner, baharatlı tavuk şeritlerini lavaş, lahana, yoğurt ve domatesli köri sosla hızlı bir sokak dürümüne taşır.",YEMEK,de,MEDIUM,22,14,36,4,520,Tavuk göğsü 650 gr | Lavaş 4 adet | Yoğurt 1 su bardağı | Mor lahana 2 su bardağı | Domates püresi 1 su bardağı | Köri 1 tatlı kaşığı | Sıvı yağ 2 yemek kaşığı,7,"1. Tavuğu ince şerit doğrayıp yağ ve baharatla ovun. || 2. Domates püresi ve köriyi 6 dakika sos kıvamına getirin. || 3. Tavuk şeritlerini kızgın tavada 8-10 dakika pişirin. || 4. Lavaşları ısıtıp yoğurt sürün. || 5. Tavuk, lahana ve köri sosla dürüm yapıp servis edin.",5,"GLUTEN,SUT","yuksek-protein,misafir-sofrasi",Tavuğu ince şerit kesmek tavada döner gibi hızlı kızarmasını sağlar.,"Mor lahana, turşu ve yoğurtlu sosla sıcak sarın.",Berlin Curry Chicken Doner,"Spiced chicken strips, flatbread, cabbage, yogurt, and curry tomato sauce form a Berlin-style wrap.",,,0,0,Berliner Curry-Huehnerdoener,"Gewuerzte Huehnerstreifen, Fladenbrot, Kohl, Joghurt und Curry-Tomatensauce ergeben einen Berliner Wrap.",,,0,0
