slug,title_tr,description_tr,type,cuisine,difficulty,prep_minutes,cook_minutes,total_minutes,serving_count,average_calories,ingredients_tr,ingredient_count,steps_tr,step_count,allergens,tags,tipNote_tr,servingSuggestion_tr,en_title_current,en_description_current,en_tipNote_current,en_servingSuggestion_current,en_ingredients_present,en_steps_present,de_title_current,de_description_current,de_tipNote_current,de_servingSuggestion_current,de_ingredients_present,de_steps_present
eksili-pancarli-keskek-kastamonu-ova-usulu,Kastamonu Ekşili Pancarlı Keşkek,"Kastamonu ekşili pancarlı keşkek, dövme buğdayı pancar ve limonla pişirerek kıpkırmızı, tok ve kırsal bir sofra yemeği sunar.",YEMEK,tr,MEDIUM,14,36,50,4,224,Dövme buğday 1 su bardağı | Pancar 2 adet | Limon suyu 1 yemek kaşığı | Zeytinyağı 1 yemek kaşığı | Su 4 su bardağı,5,1. Buğdayı suyla tencereye alın. || 2. Pancarı ekleyip yemeği 30 dakika pişirin. || 3. Limon suyuyla tamamlayıp servis edin.,3,GLUTEN,"tek-tencere,vejetaryen",Pancarı küçük doğramak keşkeğe daha dengeli renk verir.,Ilık servis edin.,Kastamonu Sour Beet Keskek,"This Kastamonu dish cooks cracked wheat with beet and lemon into a rustic, filling pot meal.",,,0,0,Kastamonu-Keşkek mit saurer Roter Bete,"Dieses Gericht aus Kastamonu kocht Weizen mit Roter Bete und Zitrone zu einer rustikalen, sättigenden Topfmahlzeit.",,,0,0
cevizli-bulgur-sarmasi-amasya-bag-usulu,Amasya Cevizli Bulgur Sarması,"Amasya cevizli bulgur sarması, asma yaprağını cevizli bulgur harcıyla sararak hafif ekşi ve aromatik bir içli dolma kurar.",YEMEK,tr,MEDIUM,22,24,46,4,236,Asma yaprağı 12 adet | İnce bulgur 1 su bardağı | Ceviz 0.5 su bardağı | Soğan 1 adet | Limon suyu 1 yemek kaşığı,5,1. Bulgur harcını hazırlayın. || 2. Yapraklara sarıp tencereye dizin. || 3. Sarmaları 20 dakika pişirin.,3,"GLUTEN,KUSUYEMIS","misafir-sofrasi,vejetaryen",Harca çok su eklememek sarmaların formunu korur.,Ilık servis edin.,Amasya Bulgur Rolls with Walnut,"These Amasya vine rolls fill leaves with walnut bulgur for a gently tart, aromatic plate.",,,0,0,Amasya-Bulgurröllchen mit Walnuss,"Diese Weinblattröllchen aus Amasya füllen Blätter mit Walnussbulgur zu einem sanft säuerlichen, aromatischen Teller.",,,0,0
mahlepli-yesil-mercimek-corbasi-tokat-bag-usulu,Tokat Mahlepli Yeşil Mercimek Çorbası,"Tokat mahlepli yeşil mercimek çorbası, mercimeği mahlep kokusuyla kaynatarak sıcak, hafif aromatik ve farklı bir çorba sunar.",CORBA,tr,EASY,10,30,40,4,188,Yeşil mercimek 1 su bardağı | Soğan 1 adet | Mahlep 0.25 çay kaşığı | Su 5 su bardağı | Tereyağı 15 gr,5,1. Soğanı tereyağında 4 dakika çevirin. || 2. Mercimek ve suyu ekleyip çorbayı 25 dakika pişirin. || 3. Mahlep ekleyip servis edin.,3,SUT,"tek-tencere,kis-tarifi",Mahlebi ölçülü kullanmak baskın tat oluşmasını önler.,Sıcak servis edin.,Tokat Green Lentil Soup with Mahlab,"This Tokat soup cooks green lentils with a touch of mahlab for a warm, lightly aromatic bowl.",,,0,0,Tokat-Linsensuppe mit Mahlep,"Diese Suppe aus Tokat kocht grüne Linsen mit etwas Mahlep zu einer warmen, leicht aromatischen Schale.",,,0,0
patatesli-kes-salatasi-bolu-yayla-usulu,Bolu Patatesli Keş Salatası,"Bolu patatesli keş salatası, haşlanmış patatesi keş peyniri ve otlarla buluşturarak tok ve ferah bir yayla salatası yapar.",SALATA,tr,EASY,12,14,26,4,198,Patates 4 adet | Keş peyniri 100 gr | Dereotu 0.25 demet | Zeytinyağı 1 yemek kaşığı | Karabiber 0.25 çay kaşığı,5,1. Patatesleri haşlayıp doğrayın. || 2. Keş ve diğer malzemelerle karıştırın. || 3. Salatayı servis edin.,3,SUT,"30-dakika-alti,vejetaryen",Patatesi ılık kullanmak keşin daha iyi yayılmasını sağlar.,Ilık servis edin.,Bolu Potato Salad with Keş,This Bolu salad combines boiled potato with keş cheese and herbs for a hearty mountain-style plate.,,,0,0,Bolu-Kartoffelsalat mit Keş,Dieser Salat aus Bolu verbindet gekochte Kartoffeln mit Keş-Käse und Kräutern zu einem sättigenden Teller im Yayla-Stil.,,,0,0
misir-unlu-hamsi-koftesi-bartin-liman-usulu,Bartın Mısır Unlu Hamsi Köftesi,"Bartın mısır unlu hamsi köftesi, hamsiyi mısır unu ve soğanla yoğurup tavada kızartarak çıtır bir kıyı atıştırmalığı çıkarır.",APERATIF,tr,EASY,16,10,26,4,214,Hamsi fileto 300 gr | Mısır unu 0.75 su bardağı | Soğan 1 adet | Yumurta 1 adet | Sıvı yağ 3 yemek kaşığı,5,1. Malzemeleri yoğurup küçük köfteler yapın. || 2. Köfteleri tavada toplam 8 dakika kızartın. || 3. Sıcak servis edin.,3,"GLUTEN,DENIZ_URUNLERI,YUMURTA","30-dakika-alti,yuksek-protein",Hamsiyi ince kıymak köftelerin tavada dağılmasını azaltır.,Sıcak servis edin.,Bartin Anchovy Cakes with Corn Flour,These Bartin cakes mix anchovy with corn flour and onion for a crisp Black Sea snack.,,,0,0,Bartın-Anchorvies-Küchlein mit Maismehl,Diese Küchlein aus Bartın mischen Anchovis mit Maismehl und Zwiebel zu einem knusprigen Schwarzmeer-Snack.,,,0,0
lahanali-mantar-guveci-zonguldak-maden-usulu,Zonguldak Lahanalı Mantar Güveci,"Zonguldak lahanalı mantar güveci, lahanayı mantar ve domatesle ağır ağır pişirerek sulu ve toprak tonlu bir kış yemeği yapar.",YEMEK,tr,EASY,12,28,40,4,146,Beyaz lahana 400 gr | Mantar 250 gr | Domates 2 adet | Soğan 1 adet | Zeytinyağı 1 yemek kaşığı,5,1. Soğan ve mantarı 6 dakika pişirin. || 2. Lahana ve domatesi ekleyin. || 3. Yemeği 18 dakika pişirip servis edin.,3,,"tek-tencere,vegan,kis-tarifi",Mantarı yüksek ateşte başlatmak su salmasını geciktirir.,Ilık servis edin.,Zonguldak Cabbage Mushroom Casserole,This Zonguldak casserole cooks cabbage with mushroom and tomato into a brothy winter vegetable dish.,,,0,0,Zonguldak-Kohl-Mushroom-Güveç,Dieser Güveç aus Zonguldak gart Kohl mit Pilzen und Tomate zu einem saftigen Wintergemüsegericht.,,,0,0
hashasli-mercimek-krep-kutahya-koy-usulu,Kütahya Haşhaşlı Mercimek Krep,"Kütahya haşhaşlı mercimek krep, mercimekli içi haşhaş aromalı ince kreplerle buluşturarak tok bir kahvaltı tabağı kurar.",KAHVALTI,tr,MEDIUM,18,16,34,4,244,Un 1 su bardağı | Yumurta 1 adet | Süt 1 su bardağı | Haşhaş ezmesi 2 yemek kaşığı | Haşlanmış yeşil mercimek 1 su bardağı,5,1. Krep hamurunu hazırlayın. || 2. Krepleri toplam 8 dakika pişirin. || 3. Mercimekli içle doldurup servis edin.,3,"GLUTEN,SUT,YUMURTA","misafir-sofrasi,vejetaryen",Krep hamurunu 10 dakika bekletmek tavada daha dengeli yayılmasını sağlar.,Ilık servis edin.,Kutahya Poppy Lentil Crepes,These Kutahya crepes pair a lentil filling with thin pancakes scented with poppy paste.,,,0,0,Kütahya-Crêpes mit Mohn und Linsen,"Diese Crêpes aus Kütahya verbinden eine Linsenfüllung mit dünnen Pfannkuchen, die nach Mohn duften.",,,0,0
sumakli-patates-asi-afyon-ova-usulu,Afyon Sumaklı Patates Aşı,"Afyon sumaklı patates aşı, haşlanmış patatesi sumak ve tereyağıyla buluşturarak sade ama canlı bir sıcak tabak çıkarır.",APERATIF,tr,EASY,10,12,22,4,168,Patates 4 adet | Tereyağı 20 gr | Sumak 1 tatlı kaşığı | Tuz 0.5 çay kaşığı,4,1. Patatesleri haşlayıp iri doğrayın. || 2. Tereyağı ve tuzla 4 dakika çevirin. || 3. Sumağı ekleyip servis edin.,3,SUT,"30-dakika-alti,butce-dostu,vejetaryen",Sumağı servis öncesi eklemek aromayı taze tutar.,Ilık servis edin.,Afyon Sumac Potato Aşı,This Afyon plate mixes boiled potatoes with sumac and butter for a simple but lively warm dish.,,,0,0,Afyon-Kartoffel-Aşı mit Sumach,"Dieser Teller aus Afyon verbindet gekochte Kartoffeln mit Sumach und Butter zu einem einfachen, aber lebendigen warmen Gericht.",,,0,0
uzumlu-tavuk-kapama-manisa-sultaniye-usulu,Manisa Üzümlü Tavuk Kapama,"Manisa üzümlü tavuk kapama, pirinç ve tavuğu kuru üzüm dokunuşuyla pişirerek hafif tatlı dengeli bir bağ evi yemeği sunar.",YEMEK,tr,MEDIUM,15,28,43,4,318,Tavuk but 600 gr | Pirinç 1 su bardağı | Kuru üzüm 2 yemek kaşığı | Soğan 1 adet | Su 2 su bardağı,5,1. Soğan ve tavuğu 8 dakika çevirin. || 2. Pirinci ve üzümü ekleyin. || 3. Suyu katıp yemeği 18 dakika pişirin.,3,,"tek-tencere,misafir-sofrasi,yuksek-protein",Üzümü az miktarda kullanmak tavuk tadını geriye düşürmez.,Sıcak servis edin.,Manisa Chicken Kapama with Raisins,This Manisa one-pot meal cooks chicken and rice with a touch of raisins for a gentle sweet-savory balance.,,,0,0,Manisa-Hähnchen-Kapama mit Rosinen,Dieses Eintopfgericht aus Manisa kocht Huhn und Reis mit etwas Rosine zu einer sanften süß-salzigen Balance.,,,0,0
lorlu-firik-dolma-izmir-bostan-usulu,İzmir Lorlu Firik Dolma,"İzmir lorlu firik dolma, biberleri lor ve firikle doldurarak Ege esintili hafif isli bir dolma hazırlar.",YEMEK,tr,MEDIUM,18,28,46,4,226,Dolmalık biber 4 adet | Firik 0.75 su bardağı | Lor peyniri 150 gr | Domates 1 adet | Zeytinyağı 1 yemek kaşığı,5,1. Firiği 8 dakika haşlayın. || 2. İçi hazırlayıp biberlere doldurun. || 3. Dolmaları 20 dakika pişirin.,3,"SUT,GLUTEN","misafir-sofrasi,vejetaryen",Firiği önceden kısa haşlamak dolmada eşit pişme sağlar.,Ilık servis edin.,Izmir Stuffed Peppers with Lor and Firik,These Izmir peppers are filled with lor cheese and firik wheat for a lightly smoky Aegean-style dolma.,,,0,0,Izmir-Gefüllte Paprika mit Lor und Firik,Diese Paprika aus Izmir werden mit Lor-Käse und Firik-Weizen gefüllt und ergeben eine leicht rauchige Dolma im Ägäis-Stil.,,,0,0
zeytinyagli-kereviz-silkelemesi-aydin-usulu,Aydın Zeytinyağlı Kereviz Silkelemesi,"Aydın zeytinyağlı kereviz silkelemesi, kerevizi limon ve zeytinyağıyla sarsarak hafif ve parlak bir Ege tabağına dönüştürür.",SALATA,tr,EASY,12,14,26,4,122,Kereviz 2 adet | Limon suyu 1 yemek kaşığı | Zeytinyağı 2 yemek kaşığı | Dereotu 0.25 demet,4,1. Kerevizi haşlayın. || 2. Limon ve yağla karıştırın. || 3. Dereotuyla servis edin.,3,KEREVIZ,"30-dakika-alti,vegan,yaz-tarifi",Kerevizi ince doğramak sosla daha iyi kaplanmasını sağlar.,Soğuk servis edin.,Aydin Celery Toss in Olive Oil,This Aydin plate tosses celery with lemon and olive oil into a bright Aegean salad.,,,0,0,Aydın-Sellerie in Olivenöl,Dieser Teller aus Aydın schwenkt Sellerie mit Zitrone und Olivenöl zu einem hellen Ägäis-Salat.,,,0,0
cavdarli-kabak-tatlisi-denizli-usulu,Denizli Çavdarlı Kabak Tatlısı,"Denizli çavdarlı kabak tatlısı, balkabağını çavdar kırıntısıyla tamamlayarak yumuşak ve hafif kıtır bir tatlı kurar.",TATLI,tr,EASY,10,30,40,6,184,Balkabağı 500 gr | Şeker 0.5 su bardağı | Çavdar ekmeği kırıntısı 0.5 su bardağı | Tarçın 0.25 çay kaşığı,4,1. Kabağı şekerle pişirin. || 2. Çavdar kırıntısını tavada kısa ısıtın. || 3. Tatlıyı birleştirip servis edin.,3,GLUTEN,"misafir-sofrasi,vejetaryen",Çavdar kırıntısını son aşamada eklemek kıtırlığı korur.,Ilık servis edin.,Denizli Pumpkin Dessert with Rye Crumbs,This Denizli dessert finishes soft pumpkin with rye crumbs for a gentle contrast of textures.,,,0,0,Denizli-Kürbisdessert mit Roggenkrumen,Dieses Dessert aus Denizli vollendet weichen Kürbis mit Roggenkrumen zu einem sanften Texturkontrast.,,,0,0
erikli-kuskus-salata-sakarya-usulu,Sakarya Erikli Kuskus Salata,"Sakarya erikli kuskus salata, kuskusu yeşil erik ve otlarla buluşturarak ekşi ferah bir bahar salatası yapar.",SALATA,tr,EASY,14,10,24,4,176,Kuskus 1 su bardağı | Yeşil erik 6 adet | Maydanoz 0.5 demet | Zeytinyağı 1 yemek kaşığı | Limon suyu 1 tatlı kaşığı,5,1. Kuskusu demleyin. || 2. Erikleri ince doğrayın. || 3. Tüm malzemeyi karıştırıp servis edin.,3,GLUTEN,"30-dakika-alti,yaz-tarifi,vegan",Erikleri çok erken eklememek diri kalmalarına yardım eder.,Soğuk servis edin.,Sakarya Couscous Salad with Green Plums,"This Sakarya salad pairs couscous with green plums and herbs for a tart, refreshing spring plate.",,,0,0,Sakarya-Couscous-Salat mit grünen Pflaumen,"Dieser Salat aus Sakarya verbindet Couscous mit grünen Pflaumen und Kräutern zu einem säuerlichen, erfrischenden Frühlingsteller.",,,0,0
fistikli-domates-corbasi-edirne-bag-usulu,Edirne Fıstıklı Domates Çorbası,"Edirne fıstıklı domates çorbası, domatesi kavrulmuş Antep fıstığıyla birleştirerek parlak ve hafif yoğun bir çorba çıkarır.",CORBA,tr,EASY,10,20,30,4,164,Domates 5 adet | Antep fıstığı 0.25 su bardağı | Soğan 1 adet | Zeytinyağı 1 yemek kaşığı | Su 3 su bardağı,5,1. Soğanı ve domatesi 8 dakika pişirin. || 2. Suyu ekleyip 10 dakika kaynatın. || 3. Fıstıkla çekip servis edin.,3,KUSUYEMIS,"30-dakika-alti,misafir-sofrasi",Fıstığı iri çekmek çorbada hafif doku bırakır.,Sıcak servis edin.,Edirne Tomato Soup with Pistachio,This Edirne soup blends tomato with toasted pistachio for a bright bowl with gentle richness.,,,0,0,Edirne-Tomatensuppe mit Pistazie,Diese Suppe aus Edirne verbindet Tomate mit gerösteter Pistazie zu einer hellen Schale mit sanfter Fülle.,,,0,0
peynirli-arpa-sehriye-pilavi-bursa-ev-usulu,Bursa Peynirli Arpa Şehriye Pilavı,"Bursa peynirli arpa şehriye pilavı, arpa şehriyeyi mihaliç peyniriyle buluşturarak tuzlu ve tane tane bir eşlik hazırlar.",YEMEK,tr,EASY,8,14,22,4,214,Arpa şehriye 1.5 su bardağı | Mihaliç peyniri 80 gr | Tereyağı 20 gr | Su 2.5 su bardağı,4,1. Şehriyeyi tereyağında 3 dakika kavurun. || 2. Suyu ekleyip 10 dakika pişirin. || 3. Peyniri karıştırıp servis edin.,3,"GLUTEN,SUT","30-dakika-alti,vejetaryen",Peyniri ocaktan aldıktan sonra eklemek eriyip yapışmasını azaltır.,Sıcak servis edin.,Bursa Orzo Pilaf with Cheese,"This Bursa side dish folds mihalic cheese into toasted orzo for a savory, grainy table companion.",,,0,0,Bursa-Orzo-Pilaw mit Käse,Diese Beilage aus Bursa hebt Mihaliç-Käse unter geröstete Arpa Şehriye zu einem herzhaften Begleiter.,,,0,0
hardaliyeli-nohut-durumu-tekirdag-bag-usulu,Tekirdağ Hardaliyeli Nohut Dürümü,"Tekirdağ hardaliyeli nohut dürümü, nohudu hardaliye dokunuşlu sosla sararak ekşi ve tok bir bağ evi öğünü yapar.",KAHVALTI,tr,EASY,10,10,20,4,232,Lavaş 4 adet | Haşlanmış nohut 2 su bardağı | Hardaliye 3 yemek kaşığı | Kuru soğan 1 adet | Zeytinyağı 1 yemek kaşığı,5,1. Soğan ve nohudu tavada 6 dakika çevirin. || 2. Hardaliyeyi ekleyin. || 3. Harcı lavaşa sarıp servis edin.,3,"GLUTEN,HARDAL","30-dakika-alti,butce-dostu",Hardaliyeyi az kullanmak dürümde dengeyi korur.,Ilık servis edin.,Tekirdag Chickpea Wrap with Hardaliye,"This Tekirdag wrap combines chickpeas with a touch of hardaliye for a tart, filling meal.",,,0,0,Tekirdağ-Kichererbsen-Dürüm mit Hardaliye,"Dieser Dürüm aus Tekirdağ verbindet Kichererbsen mit etwas Hardaliye zu einer säuerlichen, sättigenden Mahlzeit.",,,0,0
yogurtlu-yesil-erik-mezesi-yalova-usulu,Yalova Yoğurtlu Yeşil Erik Mezesi,"Yalova yoğurtlu yeşil erik mezesi, ekşi eriği süzme yoğurtla buluşturarak ferah ve parlak bir meze çıkarır.",APERATIF,tr,EASY,10,0,10,4,108,Yeşil erik 8 adet | Süzme yoğurt 1 su bardağı | Nane 1 tatlı kaşığı | Zeytinyağı 1 tatlı kaşığı,4,1. Erikleri ince doğrayın. || 2. Yoğurt ve nane ile karıştırın. || 3. Zeytinyağı gezdirip servis edin.,3,SUT,"30-dakika-alti,yaz-tarifi,vejetaryen",Erikleri ince doğrayıp son anda karıştırmak suyunun yoğurdu gevşetmesini azaltır.,Soğuk servis edin.,Yalova Green Plum Mezze with Yogurt,"This Yalova mezze combines tart green plums with strained yogurt for a cool, bright appetizer.",,,0,0,Yalova-Mezze aus grüner Pflaume und Joghurt,"Diese Mezze aus Yalova verbindet säuerliche grüne Pflaumen mit Joghurt zu einer kühlen, hellen Vorspeise.",,,0,0
domatesli-mercimekli-cokertme-bilecik-usulu,Bilecik Domatesli Mercimekli Çökertme,"Bilecik domatesli mercimekli çökertme, mercimeği domatesli sosta kısa pişirerek kaşıkla yenilen yumuşak bir tencere yemeği yapar.",YEMEK,tr,EASY,10,22,32,4,196,Yeşil mercimek 1 su bardağı | Domates 3 adet | Soğan 1 adet | Zeytinyağı 1 yemek kaşığı | Su 2 su bardağı,5,1. Soğanı ve domatesi 6 dakika pişirin. || 2. Mercimek ve suyu ekleyin. || 3. Yemeği 15 dakika pişirip servis edin.,3,,"tek-tencere,vegan",Mercimeği diri bırakmak yemekte daha canlı bir doku sağlar.,Ilık servis edin.,Bilecik Soft Lentil Tomato Pot,This Bilecik dish cooks lentils briefly in tomato sauce into a soft spoonable pot meal.,,,0,0,Bilecik-Linsentopf mit Tomate,"Dieses Gericht aus Bilecik kocht Linsen kurz in Tomatensauce zu einer weichen, löffelbaren Topfmahlzeit.",,,0,0
cubuklu-patates-borani-ankara-usulu,Ankara Çubuklu Patates Borani,"Ankara Çubuklu patates borani, patatesi sarımsaklı yoğurt ve dereotuyla buluşturarak pratik ve tok bir masa tabağı sunar.",APERATIF,tr,EASY,10,14,24,4,182,Patates 4 adet | Yoğurt 1 su bardağı | Sarımsak 2 diş | Dereotu 0.25 demet | Tereyağı 15 gr,5,1. Patatesleri haşlayın. || 2. Sarımsaklı yoğurt hazırlayın. || 3. Patatesi yoğurtla birleştirip tereyağıyla servis edin.,3,SUT,"30-dakika-alti,vejetaryen",Patatesi küp yerine ince dilimlemek yoğurdun daha iyi yayılmasını sağlar.,Ilık servis edin.,Ankara Potato Borani,"This Ankara plate combines potato with garlicky yogurt and dill for a practical, filling meze.",,,0,0,Ankara-Kartoffel-Borani,"Dieser Teller aus Ankara verbindet Kartoffeln mit Knoblauchjoghurt und Dill zu einer praktischen, sättigenden Mezze.",,,0,0
eristeli-un-corbasi-kirsehir-usulu,Kırşehir Erişteli Un Çorbası,"Kırşehir erişteli un çorbası, kavrulmuş unu erişteyle kaynatarak sade ama derli toplu bir bozkır çorbası çıkarır.",CORBA,tr,EASY,8,18,26,4,172,Un 2 yemek kaşığı | Erişte 0.75 su bardağı | Tereyağı 15 gr | Su 4 su bardağı | Tuz 0.5 çay kaşığı,5,1. Unu tereyağında 3 dakika kavurun. || 2. Suyu ve erişteyi ekleyin. || 3. Çorbayı 12 dakika pişirin.,3,"GLUTEN,SUT","30-dakika-alti,butce-dostu",Unu açık kahverengi olana kadar kavurmak çorbaya derin tat verir.,Sıcak servis edin.,Kirsehir Flour Soup with Noodles,This Kirsehir soup boils toasted flour with noodles into a simple but comforting steppe bowl.,,,0,0,Kırşehir-Mehlsuppe mit Nudeln,"Diese Suppe aus Kırşehir kocht geröstetes Mehl mit Nudeln zu einer einfachen, aber tröstlichen Steppenschale.",,,0,0
susamli-kabak-sote-aksaray-usulu,Aksaray Susamlı Kabak Sote,"Aksaray susamlı kabak sote, kabağı sarımsak ve susamla tavada çevirerek hafif çıtır dokulu bir sebze tabağı hazırlar.",YEMEK,tr,EASY,10,10,20,4,134,Kabak 4 adet | Sarımsak 2 diş | Susam 1 yemek kaşığı | Zeytinyağı 1 yemek kaşığı,4,1. Kabağı doğrayıp tavaya alın. || 2. Sarımsakla 8 dakika soteleyin. || 3. Susamla tamamlayıp servis edin.,3,SUSAM,"30-dakika-alti,vegan",Susamı en sonda eklemek yanmasını önler.,Ilık servis edin.,Aksaray Sesame Zucchini Sauté,This Aksaray sauté tosses zucchini with garlic and sesame for a vegetable plate with light crunch.,,,0,0,Aksaray-Zucchini-Sauté mit Sesam,Dieses Sauté aus Aksaray schwenkt Zucchini mit Knoblauch und Sesam zu einem Gemüseteller mit leichter Knusprigkeit.,,,0,0
yogurtlu-nohut-yahni-konya-ova-usulu,Konya Yoğurtlu Nohut Yahni,"Konya yoğurtlu nohut yahni, nohudu yoğurtlu bağlayarak yumuşak ve tok bir ova yahnisi çıkarır.",YEMEK,tr,EASY,12,22,34,4,214,Haşlanmış nohut 2 su bardağı | Yoğurt 1 su bardağı | Un 1 yemek kaşığı | Su 2 su bardağı | Nane 1 tatlı kaşığı,5,1. Yoğurt ve unu karıştırın. || 2. Nohut ve suyu kaynatın. || 3. Yoğurtlu karışımı ekleyip 10 dakika pişirin.,3,SUT,"tek-tencere,vejetaryen",Yoğurdu kesmemek için tencere suyuyla ılıtın.,Ilık servis edin.,Konya Chickpea Stew with Yogurt,"This Konya stew binds chickpeas with yogurt for a soft, filling Central Anatolian pot dish.",,,0,0,Konya-Kichererbsenragout mit Joghurt,"Dieser Eintopf aus Konya bindet Kichererbsen mit Joghurt zu einem weichen, sättigenden zentralanatolischen Topfgericht.",,,0,0
tahinli-soganlama-kayseri-usulu,Kayseri Tahinli Soğanlama,"Kayseri tahinli soğanlama, karamelleşen soğanı tahinle buluşturarak yoğun ve sürülebilir bir kahvaltılık tabak yapar.",KAHVALTI,tr,EASY,10,14,24,4,156,Kuru soğan 3 adet | Tahin 2 yemek kaşığı | Zeytinyağı 1 yemek kaşığı | Tuz 0.25 çay kaşığı,4,1. Soğanı ince doğrayın. || 2. Soğanı 10 dakika pişirin. || 3. Tahinle karıştırıp servis edin.,3,SUSAM,"30-dakika-alti,vegan",Soğanı sabırla pişirmek tatlı dengesini artırır.,Ilık servis edin.,Kayseri Onion Sauté with Tahini,This Kayseri breakfast dish combines sweet onion with tahini into a rich spreadable plate.,,,0,0,Kayseri-Zwiebelpfanne mit Tahini,"Dieses Frühstücksgericht aus Kayseri verbindet süße Zwiebel mit Tahini zu einem reichen, streichfähigen Teller.",,,0,0
pekmezli-bulgur-peltesi-nevsehir-usulu,Nevşehir Pekmezli Bulgur Peltesi,"Nevşehir pekmezli bulgur peltesi, ince bulguru pekmezle koyulaştırarak kaşıkla yenilen yumuşak bir taşra tatlısı yapar.",TATLI,tr,EASY,8,16,24,4,196,İnce bulgur 1 su bardağı | Üzüm pekmezi 0.75 su bardağı | Su 2 su bardağı | Ceviz 0.25 su bardağı,4,1. Bulguru suyla 10 dakika pişirin. || 2. Pekmezi ekleyip 4 dakika karıştırın. || 3. Cevizle servis edin.,3,"GLUTEN,KUSUYEMIS","30-dakika-alti,butce-dostu",Pekmezi son aşamada eklemek parlak rengini korur.,Ilık servis edin.,Nevsehir Bulgur Pudding with Molasses,This Nevsehir dessert thickens fine bulgur with molasses into a soft spoon pudding.,,,0,0,Nevşehir-Bulgur-Pudding mit Pekmez,Dieses Dessert aus Nevşehir bindet feinen Bulgur mit Pekmez zu einem weichen Löffelpudding.,,,0,0
firikli-kabak-kisiri-gaziantep-bag-usulu,Gaziantep Firikli Kabak Kısırı,"Gaziantep firikli kabak kısırı, firik ve kabakla hazırlanan hafif isli ve diri dokulu bir kısır çeşidi sunar.",SALATA,tr,EASY,14,10,24,4,188,Firik 1 su bardağı | Kabak 2 adet | Domates salçası 1 tatlı kaşığı | Maydanoz 0.5 demet | Limon suyu 1 yemek kaşığı,5,1. Firiği haşlayın. || 2. Kabağı kısa süre soteleyin. || 3. Malzemeyi karıştırıp servis edin.,3,GLUTEN,"30-dakika-alti,vegan,yaz-tarifi",Firiği diri bırakmak salataya daha iyi doku verir.,Soğuk servis edin.,Gaziantep Firik and Zucchini Kısır,"This Gaziantep salad combines firik wheat with zucchini for a lightly smoky, lively grain plate.",,,0,0,Gaziantep-Kısır mit Firik und Zucchini,"Dieser Salat aus Gaziantep verbindet Firik-Weizen mit Zucchini zu einem leicht rauchigen, lebendigen Getreideteller.",,,0,0
reyhanli-lorlu-pilav-mardin-usulu,Mardin Reyhanlı Lorlu Pilav,"Mardin reyhanlı lorlu pilav, pirinci reyhan ve lorla birleştirerek aromatik ve yumuşak bir ana yemek çıkarır.",YEMEK,tr,EASY,10,18,28,4,228,Pirinç 1.5 su bardağı | Lor peyniri 100 gr | Reyhan 0.25 demet | Tereyağı 20 gr | Su 2.25 su bardağı,5,1. Pirinci tereyağında çevirin. || 2. Suyu ekleyip 15 dakika pişirin. || 3. Lor ve reyhanla karıştırıp servis edin.,3,SUT,"30-dakika-alti,vejetaryen",Reyhanı ocaktan aldıktan sonra eklemek kokusunu korur.,Ilık servis edin.,Mardin Rice with Basil and Lor,"This Mardin rice combines basil and lor cheese into an aromatic, soft main dish.",,,0,0,Mardin-Reis mit Basilikum und Lor,"Dieser Reis aus Mardin verbindet Basilikum und Lor-Käse zu einem aromatischen, weichen Hauptgericht.",,,0,0
isotlu-sehriye-corbasi-sanliurfa-ev-usulu,Şanlıurfa İsotlu Şehriye Çorbası,"Şanlıurfa isotlu şehriye çorbası, arpa şehriyeyi isot ve tereyağıyla kaynatarak sade ama ısıran bir çorba yapar.",CORBA,tr,EASY,8,16,24,4,164,Arpa şehriye 1 su bardağı | Tereyağı 15 gr | İsot 0.5 çay kaşığı | Su 4 su bardağı | Tuz 0.5 çay kaşığı,5,1. Şehriyeyi tereyağında 3 dakika kavurun. || 2. İsot ve suyu ekleyin. || 3. Çorbayı 10 dakika pişirin.,3,"GLUTEN,SUT","30-dakika-alti,kis-tarifi",İsotu yağda çok tutmamak acılığın dengeli kalmasını sağlar.,Sıcak servis edin.,Sanliurfa Isot Orzo Soup,This Sanliurfa soup boils orzo with isot pepper and butter into a simple but warming bowl.,,,0,0,Şanlıurfa-Suppe mit Isot und Arpa Şehriye,"Diese Suppe aus Şanlıurfa kocht Arpa Şehriye mit Isot und Butter zu einer einfachen, aber wärmenden Schale.",,,0,0
sumakli-yumurta-kapama-kilis-usulu,Kilis Sumaklı Yumurta Kapama,"Kilis sumaklı yumurta kapama, soğan ve sumakla pişen yumurtayı hızlı bir kahvaltı tabağına dönüştürür.",KAHVALTI,tr,EASY,6,8,14,2,188,Yumurta 3 adet | Kuru soğan 1 adet | Sumak 1 tatlı kaşığı | Zeytinyağı 1 tatlı kaşığı,4,1. Soğanı 4 dakika çevirin. || 2. Sumak ekleyin. || 3. Yumurtaları kırıp 3 dakika pişirin.,3,YUMURTA,"30-dakika-alti,yuksek-protein",Yumurtayı tavada fazla tutmamak akışkan dokuyu korur.,Sıcak servis edin.,Kilis Eggs with Sumac,"This Kilis breakfast cooks eggs with onion and sumac for a quick, sharp-edged plate.",,,0,0,Kilis-Eier mit Sumach,Dieses Frühstück aus Kilis gart Eier mit Zwiebel und Sumach zu einem schnellen Teller mit klarer Säure.,,,0,0
cevizli-narli-kofte-siirt-usulu,Siirt Cevizli Narlı Köfte,"Siirt cevizli narlı köfte, ince bulgur köftelerini nar ekşisi ve cevizle buluşturarak ekşi tatlı dengeli bir tabak yapar.",YEMEK,tr,MEDIUM,18,12,30,4,236,İnce bulgur 1.5 su bardağı | Un 0.5 su bardağı | Ceviz 0.5 su bardağı | Nar ekşisi 1 yemek kaşığı | Su 2.5 su bardağı,5,1. Köfte harcını hazırlayın. || 2. Küçük köfteleri şekillendirin. || 3. Köfteleri 8 dakika haşlayıp soslayın.,3,"GLUTEN,KUSUYEMIS","misafir-sofrasi,vejetaryen",Nar ekşisini servis öncesi eklemek tazeliğini artırır.,Ilık servis edin.,Siirt Bulgur Köfte with Walnut and Pomegranate,This Siirt plate pairs bulgur dumplings with walnut and pomegranate molasses for a sweet-tart balance.,,,0,0,Siirt-Bulgurköfte mit Walnuss und Granatapfel,Dieser Teller aus Siirt verbindet Bulgurbällchen mit Walnuss und Granatapfelsirup zu einer süß-säuerlichen Balance.,,,0,0
