slug,title_tr,description_tr,type,cuisine,difficulty,prep_minutes,cook_minutes,total_minutes,serving_count,average_calories,ingredients_tr,ingredient_count,steps_tr,step_count,allergens,tags,tipNote_tr,servingSuggestion_tr,en_title_current,en_description_current,en_tipNote_current,en_servingSuggestion_current,en_ingredients_present,en_steps_present,de_title_current,de_description_current,de_tipNote_current,de_servingSuggestion_current,de_ingredients_present,de_steps_present
kars-kazli-bulgur-pilavi,Kars Kazlı Bulgur Pilavı,"Kars kazlı bulgur pilavı, didiklenmiş kaz etini tereyağlı bulgur ve soğanla buluşturarak kış sofralarına güçlü bir ana yemek çıkarır.",YEMEK,tr,HARD,25,95,120,6,540,Kaz eti 700 gr | Pilavlık bulgur 2 su bardağı | Soğan 1 adet | Tereyağı 2 yemek kaşığı | Kaz suyu 3 su bardağı | Karabiber 1 çay kaşığı | Tuz 1 tatlı kaşığı,7,1. Kaz etini tuzlu suda 70-80 dakika yumuşayana kadar haşlayın. || 2. Eti ılıtıp iri parçalar halinde didikleyin. || 3. Soğanı tereyağında 5 dakika saydamlaşana kadar kavurun. || 4. Bulgur ve kaz suyunu ekleyip kapağı kapatın. || 5. Pilavı 18-20 dakika pişirip kaz etiyle 10 dakika dinlendirin.,5,"GLUTEN,SUT","yuksek-protein,misafir-sofrasi,kis-tarifi",Kaz etini haşlama suyunda ılıtmak pilavı daha kokulu yapar.,Turşu ve ayranla sıcak servis edin.,Kars Goose Bulgur Pilaf,"Shredded goose and buttered bulgur make this Kars pilaf deep, hearty, and winter-ready.",,,0,0,Bulgur-Pilaw mit Gans aus Kars,Gezupfte Gans und gebutterter Bulgur machen diesen Pilaw aus Kars herzhaft und winterlich.,,,0,0
erzincan-kesli-eriste-corbasi,Erzincan Kesli Erişte Çorbası,"Erzincan kesli erişte çorbası, ev eriştesini kurutulmuş çökelek, nohut ve naneli tereyağıyla koyu, ekşi aromalı bir çorbaya çevirir.",CORBA,tr,MEDIUM,14,28,42,5,285,Erişte 1.5 su bardağı | Kes 0.75 su bardağı | Haşlanmış nohut 1 su bardağı | Tereyağı 1.5 yemek kaşığı | Kuru nane 1 tatlı kaşığı | Su 6 su bardağı,6,1. Kesi 1 bardak sıcak suyla ezip pürüzsüz hale getirin. || 2. Suyu kaynatıp erişteyi tencereye ekleyin. || 3. Erişteyi 10-12 dakika yumuşayana kadar pişirin. || 4. Nohut ve açılmış kesi katıp 5 dakika karıştırarak kaynatın. || 5. Naneli tereyağını üzerine gezdirip çorbayı servis edin.,5,"GLUTEN,SUT","vejetaryen,tek-tencere,kis-tarifi",Kesi sıcak suyla açmak çorbada topaklanmayı azaltır.,Naneli tereyağı gezdirip sıcak servis edin.,Kes Cheese Noodle Soup,"Dried curd, noodles, chickpeas, and mint butter thicken this Erzincan winter soup.",,,0,0,Erişte-Suppe mit Kes,"Getrockneter Quark, Nudeln, Kichererbsen und Minzbutter machen diese Suppe aus Erzincan saemig.",,,0,0
gaziantep-nar-eksili-kuru-patlican-dolmasi,Gaziantep Nar Ekşili Kuru Patlıcan Dolması,"Gaziantep nar ekşili kuru patlıcan dolması, haşlanmış kuru patlıcanı pirinçli baharatlı harçla doldurup ekşi ve parlak bir tencere yapar.",YEMEK,tr,HARD,50,45,95,6,330,Kuru patlıcan 24 adet | Pirinç 1.5 su bardağı | Soğan 2 adet | Domates salçası 1 yemek kaşığı | Nar ekşisi 3 yemek kaşığı | Zeytinyağı 0.5 su bardağı | Kuru nane 1 tatlı kaşığı,7,"1. Kuru patlıcanları kaynar suda 8 dakika yumuşatıp süzün. || 2. Pirinç, soğan, salça, nane ve zeytinyağını karıştırın. || 3. Patlıcanları yarısına kadar harçla doldurun. || 4. Dolmaları tencereye sıkı dizip nar ekşili sıcak su ekleyin. || 5. Kısık ateşte 40-45 dakika pirinç yumuşayana kadar pişirin.",5,,"vegan,misafir-sofrasi",Patlıcanları fazla doldurmamak pirincin patlamadan pişmesini sağlar.,Sarımsaklı yoğurt veya limonla ılık servis edin.,Pomegranate Dried Eggplant Dolma,Dried eggplants hold spiced rice and pomegranate molasses in this glossy Antep dolma.,,,0,0,Getrocknete Auberginen-Dolma mit Granatapfel,Getrocknete Auberginen tragen gewuerzten Reis und Granatapfelsirup in dieser Dolma aus Antep.,,,0,0
manisa-kuzu-etli-sehriye-pilavi,Manisa Kuzu Etli Şehriye Pilavı,"Manisa kuzu etli şehriye pilavı, arpa şehriyeyi küçük kuzu parçaları ve domatesle kavurarak kaşıklık, doyurucu bir pilav yapar.",YEMEK,tr,MEDIUM,18,38,56,5,470,Arpa şehriye 2 su bardağı | Kuzu kuşbaşı 450 gr | Domates rendesi 1 su bardağı | Soğan 1 adet | Sıvı yağ 3 yemek kaşığı | Et suyu 3 su bardağı,6,1. Kuzu etini tencerede 10 dakika suyunu çekene kadar kavurun. || 2. Soğanı ekleyip 5 dakika yumuşatın. || 3. Şehriyeyi katıp 4 dakika renk aldırın. || 4. Domates rendesi ve et suyunu tencereye alın. || 5. Kapağı kapalı 18-20 dakika şehriye yumuşayana kadar pişirin.,5,GLUTEN,"yuksek-protein,tek-tencere",Şehriyeyi koyu altın renge gelmeden bırakmak yanık tadı önler.,Cacık ve yeşil salatayla sıcak servis edin.,Lamb Orzo Pilaf from Manisa,"Small lamb pieces, tomato, and toasted orzo cook into a spoonable Manisa pilaf.",,,0,0,Lamm-Orzo-Pilaw aus Manisa,"Kleine Lammstuecke, Tomate und geroestete Orzo garen zu einem saftigen Pilaw aus Manisa.",,,0,0
izmir-kabak-cicekli-menemen,İzmir Kabak Çiçekli Menemen,"İzmir kabak çiçekli menemen, domatesli biberli yumurta tabanına nazik kabak çiçekleri ekleyerek yazlık bir kahvaltı tavası kurar.",KAHVALTI,tr,EASY,12,14,26,3,225,Yumurta 4 adet | Kabak çiçeği 10 adet | Domates 3 adet | Sivri biber 3 adet | Zeytinyağı 2 yemek kaşığı | Tuz 0.5 çay kaşığı,6,1. Kabak çiçeklerinin iç sert kısmını çıkarıp iri doğrayın. || 2. Biberleri zeytinyağında 4 dakika yumuşatın. || 3. Domatesleri ekleyip 7-8 dakika suyunu çektirin. || 4. Yumurtaları tavaya kırıp kenarlardan ortaya doğru karıştırın. || 5. Kabak çiçeklerini ekleyip 1 dakika sonra ocaktan alın.,5,YUMURTA,"30-dakika-alti,vejetaryen,yaz-tarifi",Çiçekleri son dakikada eklemek narin dokularını korur.,Kızarmış ekmek ve tulum peyniriyle sıcak servis edin.,Zucchini Blossom Menemen,Tender zucchini blossoms fold into a tomato pepper egg skillet for an Izmir summer breakfast.,,,0,0,Menemen mit Zucchiniblueten,Zarte Zucchiniblueten kommen in eine Tomaten-Paprika-Eierpfanne fuer ein Fruehstueck aus Izmir.,,,0,0
trabzon-hamsili-misir-ekmegi,Trabzon Hamsili Mısır Ekmeği,"Trabzon hamsili mısır ekmeği, mısır unlu harcı ayıklanmış hamsi ve taze soğanla fırınlayarak tuzlu, tok bir Karadeniz dilimi sunar.",YEMEK,tr,MEDIUM,22,32,54,6,340,Mısır unu 2 su bardağı | Ayıklanmış hamsi 500 gr | Yoğurt 1 su bardağı | Taze soğan 4 dal | Sıvı yağ 0.25 su bardağı | Kabartma tozu 1 paket,6,"1. Hamsileri yıkayıp kağıt havluyla kurulayın. || 2. Mısır unu, yoğurt, yağ ve kabartma tozunu karıştırın. || 3. Taze soğan ve hamsiyi harca nazikçe katın. || 4. Yağlı tepsiye yayın ve üstünü düzeltin. || 5. 190°C fırında 30-32 dakika üstü kızarana kadar pişirin.",5,"DENIZ_URUNLERI,SUT","firinda,yuksek-protein",Hamsileri kurulamak ekmeğin içini hamur bırakmaz.,"Roka, limon ve turşuyla sıcak dilimleyin.",Anchovy Cornbread from Trabzon,Cornmeal batter bakes with anchovies and scallions into a salty Black Sea slice.,,,0,0,Maisbrot mit Sardellen aus Trabzon,Maismehlteig backt mit Sardellen und Fruehlingszwiebeln zu einem herzhaften Schwarzmeer-Stueck.,,,0,0
bolu-mengen-mantarli-et-sote,Bolu Mengen Mantarlı Et Sote,"Bolu Mengen mantarlı et sote, dana etini mantar, domates ve biberle kısa ateşte pişirip lokanta usulü parlak bir tava yapar.",YEMEK,tr,MEDIUM,18,32,50,4,390,Dana kuşbaşı 600 gr | Kültür mantarı 300 gr | Domates 2 adet | Sivri biber 3 adet | Soğan 1 adet | Sıvı yağ 3 yemek kaşığı,6,1. Dana etini kızgın tavada 10 dakika mühürleyin. || 2. Soğan ve biberi ekleyip 5 dakika kavurun. || 3. Mantarları katıp yüksek ateşte 6 dakika çevirin. || 4. Domatesleri ekleyip tavanın kapağını kapatın. || 5. Et yumuşayana kadar 10-12 dakika daha pişirin.,5,,"yuksek-protein,30-dakika-alti",Mantarı yüksek ateşte eklemek suyunu salmadan kızarmasını sağlar.,Pirinç pilavı ve köz biberle sıcak servis edin.,Mengen Beef Mushroom Saute,"Beef, mushrooms, tomatoes, and peppers turn glossy in this Bolu skillet dish.",,,0,0,Mengen-Pfanne mit Rind und Pilzen,"Rind, Pilze, Tomaten und Paprika werden in dieser Pfanne aus Bolu glaenzend geschmort.",,,0,0
aydin-zeytinyagli-enginar-kalbi,Aydın Zeytinyağlı Enginar Kalbi,"Aydın zeytinyağlı enginar kalbi, enginarı havuç, bezelye, dereotu ve limonla hafif ateşte pişirerek soğuk servis edilen zarif bir tabak yapar.",YEMEK,tr,MEDIUM,16,28,44,4,190,Enginar kalbi 6 adet | Havuç 1 adet | Bezelye 1 su bardağı | Zeytinyağı 0.5 su bardağı | Limon suyu 2 yemek kaşığı | Dereotu 0.25 demet,6,1. Enginar kalplerini limonlu suda 10 dakika bekletin. || 2. Havuç ve bezelyeyi tencereye yayın. || 3. Enginarları üzerine dizip zeytinyağı ve limon suyu ekleyin. || 4. Kısık ateşte 25-28 dakika enginarlar yumuşayana kadar pişirin. || 5. Tencerede soğutup dereotuyla servis edin.,5,,"vegan,yaz-tarifi,tek-tencere",Enginarları limonlu suda bekletmek rengin kararmasını geciktirir.,Dereotu ve zeytinyağıyla soğuk servis edin.,Olive Oil Artichoke Hearts,"Artichoke hearts simmer with carrot, peas, dill, and lemon in this cool Aegean plate.",,,0,0,Artischockenherzen in Olivenoel,"Artischockenherzen schmoren mit Karotte, Erbsen, Dill und Zitrone zu einem kuehlen Aegaeis-Teller.",,,0,0
sanliurfa-patlicanli-kazan-kebabi,Şanlıurfa Patlıcanlı Kazan Kebabı,"Şanlıurfa patlıcanlı kazan kebabı, patlıcan halkalarını kıymalı harçla doldurup domatesli suyla ağır ağır pişen paylaşımlık bir tencere kurar.",YEMEK,tr,MEDIUM,32,45,77,6,430,Patlıcan 5 adet | Dana kıyma 600 gr | Soğan 1 adet | Domates salçası 1 yemek kaşığı | Domates 3 adet | Sivri biber 4 adet | Tuz 1 tatlı kaşığı | Karabiber 1 çay kaşığı,8,"1. Patlıcanları kalın halka kesip ortalarını hafifçe açın. || 2. Kıyma, rendelenmiş soğan, tuz ve karabiberi yoğurun. || 3. Patlıcan halkalarının arasına kıymalı harç yerleştirin. || 4. Domates, biber ve salçalı suyu tencereye ekleyin. || 5. Kapağı kapalı 40-45 dakika patlıcan yumuşayana kadar pişirin.",5,,"misafir-sofrasi,yuksek-protein",Patlıcanları aynı kalınlıkta kesmek tencerede eşit pişme sağlar.,"Lavaş, ayran ve sumaklı soğanla sıcak servis edin.",Urfa Eggplant Kazan Kebab,Eggplant rings hold minced beef and simmer in tomato broth for this shared Urfa pot.,,,0,0,Auberginen-Kazan-Kebab aus Urfa,Auberginenringe tragen Hackfleisch und schmoren in Tomatensud zu diesem Topf aus Urfa.,,,0,0
adiyaman-cevizli-semsek,Adıyaman Cevizli Semsek,"Adıyaman cevizli semsek, ince hamuru cevizli kıymalı içle kapatıp sacda pişirerek bol baharatlı, yarım ay biçimli bir hamur işi sunar.",YEMEK,tr,HARD,45,24,69,6,410,Un 4 su bardağı | Su 1.5 su bardağı | Dana kıyma 350 gr | Ceviz 0.75 su bardağı | Soğan 1 adet | Biber salçası 1 yemek kaşığı | Tuz 1 tatlı kaşığı,7,"1. Un, su ve tuzla yumuşak hamur yoğurup 25 dakika dinlendirin. || 2. Kıyma ve soğanı 8 dakika kavurup salçayı ekleyin. || 3. Cevizi harca katıp içi ılıtın. || 4. Hamuru bezelere ayırıp ince açın ve içle kapatın. || 5. Semsekleri sacda iki yüzü kızarana kadar 8-10 dakika pişirin.",5,"GLUTEN,KUSUYEMIS",misafir-sofrasi,İçi soğuk kullanmak hamurun yırtılmasını azaltır.,Ayran ve maydanozlu soğanla sıcak servis edin.,Walnut Semsek from Adiyaman,Thin dough folds around minced beef and walnuts for this spiced Adiyaman griddle pastry.,,,0,0,Semsek mit Walnuss aus Adiyaman,Duenner Teig umhuellt Hackfleisch und Walnuesse fuer dieses gewuerzte Fladenstueck aus Adiyaman.,,,0,0
malatya-kayisili-tavuk-yahni,Malatya Kayısılı Tavuk Yahni,"Malatya kayısılı tavuk yahni, tavuk butlarını kuru kayısı, soğan ve tarçınla pişirerek tatlı ekşi dengeli bir Anadolu tenceresi hazırlar.",YEMEK,tr,MEDIUM,18,42,60,4,440,Tavuk but 800 gr | Kuru kayısı 12 adet | Soğan 2 adet | Domates salçası 1 yemek kaşığı | Tarçın 0.25 çay kaşığı | Tavuk suyu 2.5 su bardağı,6,"1. Tavuk butlarını tencerede 8 dakika mühürleyin. || 2. Soğanı ekleyip 6 dakika yumuşatın. || 3. Salça, tarçın ve tavuk suyunu tencereye alın. || 4. Kapağı kapalı 25 dakika orta ateşte pişirin. || 5. Kayısıları ekleyip 12-15 dakika daha yumuşatın.",5,,"yuksek-protein,tek-tencere",Kayısıyı son 15 dakikada eklemek dağılmadan sosu tatlandırır.,Bulgur pilavı ve yoğurtla sıcak servis edin.,Apricot Chicken Yahni,"Dried apricots, onion, cinnamon, and chicken thighs simmer into a sweet-sour Malatya stew.",,,0,0,Huehneryahni mit Aprikosen,"Getrocknete Aprikosen, Zwiebel, Zimt und Huhn schmoren zu einem suess-sauren Eintopf aus Malatya.",,,0,0
canakkale-sardalyali-domates-tavasi,Çanakkale Sardalyalı Domates Tavası,"Çanakkale sardalyalı domates tavası, taze sardalyayı domates, sarımsak ve zeytinyağıyla kısa sürede pişiren hafif bir balık yemeğidir.",YEMEK,tr,MEDIUM,16,18,34,4,315,Temizlenmiş sardalya 700 gr | Domates 4 adet | Sarımsak 3 diş | Zeytinyağı 4 yemek kaşığı | Maydanoz 0.25 demet | Limon 1 adet,6,1. Sardalyaları yıkayıp kağıt havluyla kurulayın. || 2. Domatesleri rendeleyip sarımsakla tavaya alın. || 3. Sosu 8 dakika koyulaşana kadar pişirin. || 4. Sardalyaları tek sıra dizip kapağı kapatın. || 5. Balıkları 8-10 dakika opaklaşana kadar pişirip maydanozla servis edin.,5,DENIZ_URUNLERI,"yuksek-protein,yaz-tarifi",Sardalyayı tek sıra dizmek etinin parçalanmadan pişmesini sağlar.,"Roka, limon ve kızarmış ekmekle sıcak servis edin.",Sardine Tomato Skillet,"Fresh sardines cook quickly with tomato, garlic, and olive oil in this Canakkale pan.",,,0,0,Sardinen-Tomaten-Pfanne,"Frische Sardinen garen schnell mit Tomate, Knoblauch und Olivenoel in dieser Pfanne aus Canakkale.",,,0,0
nevsehir-pekmezli-aside,Nevşehir Pekmezli Aside,"Nevşehir pekmezli aside, üzüm pekmezini un ve tereyağıyla kavurup kaşıkla yenebilen parlak, yoğun bir kış tatlısına dönüştürür.",TATLI,tr,EASY,8,16,24,6,260,Üzüm pekmezi 1 su bardağı | Un 0.75 su bardağı | Tereyağı 2 yemek kaşığı | Su 1.5 su bardağı | Ceviz 0.5 su bardağı | Tarçın 0.5 çay kaşığı,6,1. Tereyağını eritip unu 6 dakika açık renk kavurun. || 2. Pekmez ve suyu ayrı kapta pürüzsüz karıştırın. || 3. Pekmezli karışımı una azar azar ekleyin. || 4. Kısık ateşte 8-10 dakika koyulaşana kadar karıştırın. || 5. Ceviz ve tarçınla ılık servis edin.,5,"GLUTEN,SUT,KUSUYEMIS","30-dakika-alti,vejetaryen,butce-dostu",Unu açık fındık kokusu gelene kadar kavurmak tadı derinleştirir.,Ceviz ve tarçınla ılık servis edin.,Grape Molasses Aside,"Grape molasses, flour, and butter turn into a glossy spoon dessert from Nevsehir.",,,0,0,Aside mit Traubenmelasse,"Traubenmelasse, Mehl und Butter werden zu einem glaenzenden Loeffeldessert aus Nevsehir.",,,0,0
mardin-sumakli-kuzu-kaburga,Mardin Sumaklı Kuzu Kaburga,"Mardin sumaklı kuzu kaburga, kaburga parçalarını soğan, sumak ve domatesle ağır fırında pişirerek ekşi aromalı bir et tabağı sunar.",YEMEK,tr,HARD,20,150,170,6,620,Kuzu kaburga 1.4 kg | Soğan 3 adet | Sumak 2 yemek kaşığı | Domates 3 adet | Sarımsak 4 diş | Zeytinyağı 3 yemek kaşığı | Tuz 1 tatlı kaşığı,7,"1. Kaburgayı tuz, sumak ve zeytinyağıyla ovun. || 2. Soğan, domates ve sarımsağı fırın kabına yayın. || 3. Kaburgayı sebzelerin üzerine yerleştirip kabı kapatın. || 4. 160°C fırında 2 saat kapalı pişirin. || 5. Üstünü açıp 20-25 dakika kızarana kadar fırınlayın.",5,,"misafir-sofrasi,yuksek-protein",Kaburgayı kapalı pişirmek etin kemikten kolay ayrılmasını sağlar.,Lavaş ve közlenmiş biberle sıcak servis edin.,Sumac Lamb Ribs from Mardin,"Lamb ribs bake slowly with onion, sumac, and tomato for a tangy Mardin meat dish.",,,0,0,Lammrippen mit Sumach aus Mardin,"Lammrippen backen langsam mit Zwiebel, Sumach und Tomate zu einem saeuerlichen Gericht aus Mardin.",,,0,0
sakarya-islama-kofte-tabagi,Sakarya Islama Köfte Tabağı,"Sakarya ıslama köfte tabağı, baharatlı köfteleri kemik suyuna batırılmış ekmek ve köz biberle bir araya getiren doyurucu bir porsiyondur.",YEMEK,tr,MEDIUM,28,24,52,4,560,Dana kıyma 600 gr | Bayat ekmek içi 0.5 su bardağı | Soğan 1 adet | Kemik suyu 2 su bardağı | Ekmek dilimi 8 adet | Kırmızı toz biber 1 tatlı kaşığı,6,"1. Kıyma, ekmek içi, soğan ve baharatı 8 dakika yoğurun. || 2. Köfteleri şekillendirip 15 dakika buzdolabında dinlendirin. || 3. Köfteleri ızgara tavada toplam 10-12 dakika pişirin. || 4. Kemik suyunu toz biberle ısıtıp ekmekleri kısa batırın. || 5. Islanmış ekmekleri köfte ve köz biberle servis edin.",5,GLUTEN,"yuksek-protein,misafir-sofrasi",Ekmekleri sosa kısa batırmak dağılmadan ıslanmasını sağlar.,"Köz biber, domates ve ayranla sıcak servis edin.",Sakarya Islama Meatball Plate,Spiced meatballs meet broth-soaked bread and roasted peppers in this Sakarya plate.,,,0,0,Islama-Koefte-Teller aus Sakarya,Gewuerzte Koefte treffen auf bruehegetraenktes Brot und geroestete Paprika in diesem Teller aus Sakarya.,,,0,0
burdur-cevizli-kabak-tatlisi,Burdur Cevizli Kabak Tatlısı,"Burdur cevizli kabak tatlısı, balkabağını şekerle bekletip kendi suyunda pişirerek parlak şerbetli ve cevizli bir kış tatlısı yapar.",TATLI,tr,MEDIUM,15,45,60,6,245,Balkabağı 1 kg | Şeker 2 su bardağı | Ceviz 0.75 su bardağı | Tahin 3 yemek kaşığı | Limon suyu 1 tatlı kaşığı,5,1. Balkabağını iri dilimleyip şekerle 2 saat bekletin. || 2. Kabağı kendi suyuyla tencereye alın. || 3. Kısık ateşte 35-40 dakika yumuşayana kadar pişirin. || 4. Limon suyunu ekleyip 5 dakika daha kaynatın. || 5. Soğutup ceviz ve tahinle servis edin.,5,"KUSUYEMIS,SUSAM","vegan,kis-tarifi,butce-dostu",Kabağı şekerle 2 saat bekletmek su eklemeden pişirmeyi kolaylaştırır.,Ceviz ve tahinle soğuk servis edin.,Walnut Pumpkin Dessert,Pumpkin cooks in its own syrup and finishes with walnuts and tahini in this Burdur dessert.,,,0,0,Kuerbisdessert mit Walnuss,Kuerbis gart im eigenen Sirup und wird mit Walnuss und Tahin als Dessert aus Burdur serviert.,,,0,0
tekirdag-peynirli-pirasa-boregi,Tekirdağ Peynirli Pırasa Böreği,"Tekirdağ peynirli pırasa böreği, ince pırasayı beyaz peynirli içle yufka arasına alıp çıtır ve tuzlu bir tepsi böreği hazırlar.",YEMEK,tr,MEDIUM,24,38,62,8,330,Yufka 4 adet | Pırasa 600 gr | Beyaz peynir 250 gr | Yumurta 2 adet | Yoğurt 1 su bardağı | Sıvı yağ 0.5 su bardağı,6,"1. Pırasayı ince doğrayıp 8 dakika yumuşayana kadar soteleyin. || 2. Pırasa soğuyunca beyaz peynirle karıştırın. || 3. Yoğurt, yumurta ve yağı çırpıp sos hazırlayın. || 4. Yufkaları soslayarak tepsiye dizin ve içi yayın. || 5. 180°C fırında 35-38 dakika üstü kızarana kadar pişirin.",5,"GLUTEN,SUT,YUMURTA","vejetaryen,firinda,misafir-sofrasi",Pırasayı soğutmadan yufkaya koymak hamuru yumuşatır.,Çay ve yoğurtla ılık dilimleyin.,Leek Cheese Borek,Leeks and white cheese bake between phyllo layers in this crisp Tekirdag tray borek.,,,0,0,Boerek mit Lauch und Kaese,Lauch und Weisskaese backen zwischen Yufka-Schichten zu diesem knusprigen Boerek aus Tekirdag.,,,0,0
diyarbakir-kuzu-etli-mumbar-dolmasi,Diyarbakır Kuzu Etli Mumbar Dolması,"Diyarbakır kuzu etli mumbar dolması, temizlenmiş mumbarı pirinçli ve baharatlı kuzu içiyle doldurup uzun haşlamayla yumuşak hale getirir.",YEMEK,tr,HARD,70,95,165,6,610,Temizlenmiş mumbar 1 kg | Pirinç 2 su bardağı | Kuzu kıyma 350 gr | Soğan 2 adet | Domates salçası 1 yemek kaşığı | Pul biber 1 tatlı kaşığı | Tuz 1 tatlı kaşığı,7,"1. Mumbarları bol tuzlu ve limonlu suda tekrar yıkayın. || 2. Pirinç, kıyma, soğan, salça ve baharatı karıştırın. || 3. Mumbarları gevşek şekilde doldurup uçlarını bağlayın. || 4. Tencereye alıp üstünü geçecek kadar sıcak su ekleyin. || 5. Kısık ateşte 90-95 dakika yumuşayana kadar haşlayın.",5,,"misafir-sofrasi,yuksek-protein",Mumbarı fazla sıkı doldurmamak pirincin taşmadan şişmesini sağlar.,Limon ve pul biberle sıcak servis edin.,Lamb Mumbar Dolma,Cleaned mumbar fills with spiced lamb and rice for this long-simmered Diyarbakir dish.,,,0,0,Mumbar-Dolma mit Lamm,Gereinigter Mumbar wird mit gewuerztem Lamm und Reis gefuellt und lange gegart.,,,0,0
eskisehir-hashasli-mercimekli-bukme,Eskişehir Haşhaşlı Mercimekli Bükme,"Eskişehir haşhaşlı mercimekli bükme, ince açılmış hamuru haşhaş ezmesi ve yeşil mercimekli içle katlayıp fırında gevrekleştirir.",YEMEK,tr,HARD,55,32,87,8,380,Un 4 su bardağı | Su 1.5 su bardağı | Haşhaş ezmesi 0.75 su bardağı | Haşlanmış yeşil mercimek 1.5 su bardağı | Soğan 1 adet | Sıvı yağ 0.5 su bardağı | Tuz 1 tatlı kaşığı,7,"1. Un, su ve tuzla hamur yoğurup 30 dakika dinlendirin. || 2. Soğanı kavurup mercimekle iç hazırlayın. || 3. Haşhaş ezmesini sıvı yağla açın. || 4. Hamuru ince açıp haşhaş sürün ve mercimekli içle katlayın. || 5. 190°C fırında 30-32 dakika kızarana kadar pişirin.",5,GLUTEN,"vejetaryen,firinda,misafir-sofrasi",Haşhaş ezmesini yağla açmak katların daha kolay ayrılmasını sağlar.,Ayran ve domates salatasıyla ılık servis edin.,Poppy Lentil Bukme,Thin dough folds around poppy paste and green lentils for this crisp Eskisehir pastry.,,,0,0,Bukme mit Mohn und Linsen,Duenner Teig wird mit Mohnpaste und gruenen Linsen zu diesem Gebaeck aus Eskisehir gefaltet.,,,0,0
sinop-nohutlu-keskek,Sinop Nohutlu Keşkek,"Sinop nohutlu keşkek, yarma buğdayı tavuk, nohut ve tereyağıyla uzun süre pişirip tok, lifli bir düğün yemeği dokusu verir.",YEMEK,tr,HARD,25,120,145,8,450,Yarma buğday 2 su bardağı | Tavuk but 700 gr | Haşlanmış nohut 1.5 su bardağı | Tereyağı 3 yemek kaşığı | Tuz 1 tatlı kaşığı | Su 8 su bardağı,6,1. Yarma buğdayı geceden ıslatıp süzün. || 2. Tavuk butları ve buğdayı tencereye alın. || 3. Bol suyla 80 dakika kısık ateşte pişirin. || 4. Tavuğu didikleyip nohutla birlikte tencereye katın. || 5. Keşkeği 30-35 dakika karıştırarak koyulaştırın ve tereyağıyla servis edin.,5,"GLUTEN,SUT","misafir-sofrasi,yuksek-protein,kis-tarifi",Buğdayı geceden ıslatmak ezilme süresini belirgin kısaltır.,Kızgın tereyağı ve kırmızı biberle sıcak servis edin.,Chickpea Keskek from Sinop,"Cracked wheat, chicken, chickpeas, and butter cook slowly into a hearty Sinop keskek.",,,0,0,Keskek mit Kichererbsen aus Sinop,"Weizenschrot, Huhn, Kichererbsen und Butter garen langsam zu einem kraeftigen Keskek aus Sinop.",,,0,0
ordu-pazili-misir-unu-kayganasi,Ordu Pazılı Mısır Unu Kayganası,"Ordu pazılı mısır unu kayganası, pazı yapraklarını mısır unlu yumurtalı harçla tavada pişirerek Karadeniz kahvaltısına tuzlu bir krep ekler.",KAHVALTI,tr,EASY,12,12,24,4,210,Pazı 1 demet | Mısır unu 1 su bardağı | Yumurta 3 adet | Su 0.5 su bardağı | Sıvı yağ 2 yemek kaşığı | Tuz 0.5 çay kaşığı,6,"1. Pazıyı ince kıyıp fazla suyunu sıkın. || 2. Mısır unu, yumurta, su ve tuzu pürüzsüz çırpın. || 3. Pazıyı harca katıp karıştırın. || 4. Tavaya harcı ince yayın ve 5 dakika pişirin. || 5. Kayganayı çevirip diğer yüzünü 4-5 dakika kızartın.",5,YUMURTA,"30-dakika-alti,vejetaryen,butce-dostu",Pazıyı ince kıymak kaygananın çevrilirken kırılmasını azaltır.,Sıcak çay ve lor peyniriyle servis edin.,Chard Cornmeal Kaygana,"Chard, cornmeal, and eggs cook into a savory Black Sea breakfast pancake.",,,0,0,Kaygana mit Mangold und Maismehl,"Mangold, Maismehl und Eier werden zu einem herzhaften Fruehstueckspfannkuchen vom Schwarzen Meer.",,,0,0
bilecik-erikli-nohut-yahnisi,Bilecik Erikli Nohut Yahnisi,"Bilecik erikli nohut yahnisi, haşlanmış nohudu kuru erik, soğan ve salçayla pişirerek hafif tatlı, ekşi ve doyurucu bir tencere kurar.",YEMEK,tr,MEDIUM,14,34,48,4,320,Haşlanmış nohut 3 su bardağı | Kuru erik 10 adet | Soğan 1 adet | Domates salçası 1 yemek kaşığı | Zeytinyağı 3 yemek kaşığı | Sıcak su 2 su bardağı,6,1. Soğanı zeytinyağında 5 dakika yumuşayana kadar kavurun. || 2. Salçayı ekleyip 2 dakika kokusu çıkana kadar çevirin. || 3. Nohut ve sıcak suyu tencereye alın. || 4. Kısık ateşte 20 dakika nohutlar sosu çekene kadar pişirin. || 5. Kuru eriği ekleyip 8 dakika daha kaynatın.,5,,"vegan,tek-tencere,butce-dostu",Kuru eriği son bölümde eklemek kabuğunun dağılmasını önler.,Bulgur pilavı ve cacıkla sıcak servis edin.,Plum Chickpea Yahni,"Chickpeas, dried plums, onion, and tomato paste simmer into a sweet-sour Bilecik stew.",,,0,0,Kichererbsen-Yahni mit Pflaumen,"Kichererbsen, Trockenpflaumen, Zwiebel und Tomatenmark schmoren zu einem suess-sauren Yahni aus Bilecik.",,,0,0
rize-fasulye-tursulu-kavurma,Rize Fasulye Turşulu Kavurma,"Rize fasulye turşulu kavurma, salamura fasulyeyi soğan ve tereyağıyla tavada çevirerek ekşi, tuzlu ve hızlı bir Karadeniz yemeği yapar.",YEMEK,tr,EASY,10,14,24,4,165,Fasulye turşusu 500 gr | Soğan 2 adet | Tereyağı 2 yemek kaşığı | Sıvı yağ 1 yemek kaşığı | Pul biber 0.5 çay kaşığı,5,1. Fasulye turşusunu 10 dakika suda bekletip süzün. || 2. Soğanları yarım ay doğrayın. || 3. Tereyağı ve sıvı yağda soğanı 6 dakika kavurun. || 4. Fasulye turşusunu ekleyip 7-8 dakika çevirin. || 5. Pul biber serperek sıcak servis edin.,5,SUT,"30-dakika-alti,vejetaryen,butce-dostu",Turşuyu 10 dakika suda bekletmek fazla tuzu dengeler.,Mısır ekmeği ve ayranla sıcak servis edin.,Pickled Bean Kavurma,Pickled green beans fry with onion and butter into a sharp Black Sea skillet.,,,0,0,Pfanne mit eingelegten Bohnen,Eingelegte gruene Bohnen braten mit Zwiebel und Butter zu einer herben Schwarzmeer-Pfanne.,,,0,0
