slug,title_tr,description_tr,type,cuisine,difficulty,prep_minutes,cook_minutes,total_minutes,serving_count,average_calories,ingredients_tr,ingredient_count,steps_tr,step_count,allergens,tags,tipNote_tr,servingSuggestion_tr,en_title_current,en_description_current,en_tipNote_current,en_servingSuggestion_current,en_ingredients_present,en_steps_present,de_title_current,de_description_current,de_tipNote_current,de_servingSuggestion_current,de_ingredients_present,de_steps_present
caglali-kurutlu-bulgur-salatasi-malatya-usulu,Çağlalı Kurutlu Bulgur Salatası,"Malatya usulü çağlalı kurutlu bulgur salatası, ince bulguru çağla ve eritilmiş kurutla buluşturarak ekşimsi, diri ve mezelik bir salata yapar.",SALATA,tr,EASY,12,0,12,4,152,İnce bulgur 1.5 su bardağı | Çağla 8 adet | Kurut 1 adet | Sıcak su 1.5 su bardağı,4,"1. İnce bulgur malzemesini yıkayıp süzün. || 2. Çağla ve Kurut malzemelerini ince dilimler halinde kesin. || 3. Çağla ve Çağla ile sosu küçük bir kasede çırpın. || 4. İnce bulgur, Çağla ve kalan malzemeleri sosla nazikçe harmanlayın. || 5. Çağla eklenmiş bulgur salatasını 10 dakika dinlendirip soğuk servis edin.",5,"GLUTEN,SUT","vejetaryen,yaz-tarifi",Çağlayı ince doğramak bulgur içinde her lokmaya dengeli dağılmasını sağlar.,"Salatayı serin halde, üstüne zeytinyağı gezdirerek meze tabağında sunun.",Bulgur Salad with Green Almond and Kurut,"This Malatya-style salad mixes fine bulgur, green almond, and kurut for a tart lively side.",,,0,0,Bulgursalat mit grüner Mandel und Kurut,"Dieser Salat nach Art aus Malatya verbindet feinen Bulgur, grüne Mandel und Kurut zu einer säuerlichen lebendigen Beilage.",,,0,0
lorlu-ispanakli-tandir-boregi-kars-usulu,Lorlu Ispanaklı Tandır Böreği,"Kars usulü lorlu ıspanaklı tandır böreği, ince yufkayı lor ve ıspanakla buluşturarak çıtır, katmanlı ve güçlü bir börek hazırlar.",YEMEK,tr,MEDIUM,20,24,44,6,274,Yufka 4 adet | Lor peyniri 180 gr | Ispanak 250 gr | Tereyağı 2 yemek kaşığı,4,"1. Ispanağı doğrayıp tavada suyunu bırakıp çekene kadar 5 dakika soteleyin. || 2. Soğuyan ıspanağı lor peyniriyle karıştırıp iç harcı hazırlayın. || 3. Yufkaları tereyağıyla hafif yağlayın, harcı kat kat yayarak rulo sarın. || 4. Böreği fırın kabına sıkı yerleştirip üstünü kalan tereyağıyla yağlayın. || 5. Önceden 190°C ısıtılmış fırında üstü kızarana kadar 28-32 dakika pişirin.",5,"GLUTEN,SUT","misafir-sofrasi,vejetaryen",Ispanağın suyunu sıkmak böreğin içinde buhar birikmesini önler.,"Dilimleyip ılık sunun, yanına çay ve domates dilimleri koyun.",Tandir Borek with Lor and Spinach,"This Kars-style borek layers lor cheese and spinach into a crisp, sturdy village-style pastry.",,,0,0,Tandır-Börek mit Lor und Spinat,Dieses Gebäck nach Art aus Kars schichtet Lor-Käse und Spinat zu einem knusprigen kräftigen Landbörek.,,,0,0
visneli-gelincik-serbeti-elazig-usulu,Vişneli Gelincik Şerbeti,"Elazığ usulü vişneli gelincik şerbeti, vişne suyunu gelincik özü ve buzla buluşturarak parlak, çiçeksi ve yazlık bir içecek kurar.",ICECEK,tr,EASY,8,0,8,4,36,Vişne suyu 1.5 su bardağı | Su 2 su bardağı | Gelincik özü 2 yemek kaşığı | Buz 1 su bardağı,4,"1. Vişneli Gelincik Şerbeti için vişne suyu, şeker ve aromatik tabanı karıştırın. || 2. Vişneli Gelincik Şerbeti içeceğine su ekleyip 10 dakika dinlendirerek tadını dengeleyin. || 3. Vişneli Gelincik Şerbeti içeceğini süzüp buzla birlikte servis edin.",3,,"alkolsuz,30-dakika-alti,yaz-tarifi",Gelincik özünü az kullanmak vişne tadının canlı kalmasını sağlar.,Soğuk servis edin.,Cherry Poppy Sherbet,This Elazig-style sherbet combines cherry juice and poppy blossom essence for a floral cold drink.,,,0,0,Kirsch-Gelincik-Sherbet,Dieses Sherbet nach Art aus Elazig verbindet Kirschsaft und Mohnblütenessenz zu einem blumigen Kaltgetränk.,,,0,0
cevizli-patates-bastisi-igdir-usulu,Cevizli Patates Bastısı,"Iğdır usulü cevizli patates bastısı, haşlanmış patatesi ceviz ve hafif tereyağıyla buluşturarak tok, sade ve paylaşmalık bir aperatif hazırlar.",APERATIF,tr,EASY,10,12,22,4,172,Patates 4 adet | Ceviz 0.5 su bardağı | Tereyağı 1 yemek kaşığı | Tuz 0.5 çay kaşığı,4,"1. Patatesleri kabuklu haşlayın, 20 dakikada yumuşayınca soyup ezin. || 2. Tereyağını sıcak patatese yedirin, tuzla birlikte karıştırın. || 3. Cevizi iri kırıp patatesin içine katın, hafif pütür bırakın. || 4. Karışımı servis tabağına bastırıp 10 dakika dinlendirin.",4,"SUT,KUSUYEMIS","vejetaryen,30-dakika-alti",Patatesi iri ezmek bastıda daha rustik bir doku bırakır.,Yanına yoğurt koyup patates bastısını ılık ana tabakta servis edin.,Pressed Potato Mezze with Walnuts,This Igdir-style appetizer pairs boiled potatoes with walnut and butter for a rustic shared plate.,,,0,0,Kartoffel-Mezze mit Walnüssen,Dieser Aperitif nach Art aus Igdir verbindet gekochte Kartoffeln mit Walnuss und Butter zu einem rustikalen Teller zum Teilen.,,,0,0
tereyagli-bulgurlu-kaz-sote-ardahan-usulu,Tereyağlı Bulgurlu Kaz Sote,"Ardahan usulü tereyağlı bulgurlu kaz sote, pişmiş kaz etini bulgur ve tereyağıyla buluşturarak güçlü, tok ve kışlık bir ana yemek yapar.",YEMEK,tr,MEDIUM,14,18,32,4,346,Pişmiş kaz eti 300 gr | Pilavlık bulgur 1.5 su bardağı | Tereyağı 1.5 yemek kaşığı | Su 2.5 su bardağı,4,"1. Pilavlık bulguru 2,5 su bardağı suyla yumuşayana kadar pişirin. || 2. Pişmiş kaz etini tavada 5 dakika çevirerek dışını canlandırın. || 3. Tereyağını tavaya ekleyip kaz etiyle birlikte eritin. || 4. Pişen bulguru kaz etine katıp birkaç kez çevirerek birleştirin. || 5. Kaz soteyi tereyağlı parlaklığı üzerindeyken sıcak servis edin.",5,"GLUTEN,SUT","yuksek-protein,tek-tencere",Kaz etini ince didiklemek bulgurla daha dengeli karışmasını sağlar.,Sıcak servis edin.,Goose and Bulgur Saute with Butter,This Ardahan-style main tosses cooked goose with bulgur and butter for a robust winter skillet.,,,0,0,Gänsepfanne mit Bulgur und Butter,Dieses Hauptgericht nach Art aus Ardahan schwenkt gegarte Gans mit Bulgur und Butter zu einer kräftigen Winterpfanne.,,,0,0
kayisili-kestaneli-irmik-helvasi-malatya-usulu,Kayısılı Kestaneli İrmik Helvası,"Malatya usulü kayısılı kestaneli irmik helvası, kavrulmuş irmiği kuru kayısı ve kestaneyle buluşturarak yoğun, sıcak ve kışa uygun bir tatlı yapar.",TATLI,tr,EASY,10,14,24,4,244,İrmik 1 su bardağı | Tereyağı 2 yemek kaşığı | Kuru kayısı 6 adet | Haşlanmış kestane 1 su bardağı,4,"1. İrmik, tereyağı ve kuru kayısı için kullanacağınız kapları ve ölçüleri hazırlayın. || 2. İrmiği tereyağında 6 dakika kavurun. || 3. Kayısı ve kestaneyi ekleyin. || 4. Helvayı 6 dakika daha pişirin. || 5. Kayısılı Kestaneli İrmik Helvası porsiyonlarını kestane vurgusuyla tamamlayıp ikram edin.",5,"GLUTEN,SUT,KUSUYEMIS",vejetaryen,Kayısıyı küçük doğramak helvada daha dengeli dağılmasına yardım eder.,"Ilık servis edin, üstüne ceviz serperek tatlı tabağında sunun.",Semolina Halva with Apricot and Chestnut,"This Malatya-style halva combines toasted semolina, apricot, and chestnut into a warm rich dessert.",,,0,0,Grießhalva mit Aprikose und Kastanie,"Diese Halva nach Art aus Malatya verbindet gerösteten Grieß, Aprikose und Kastanie zu einem warmen reichen Dessert.",,,0,0
zahterli-susamli-yumurta-ekmegi-kilis-usulu,Zahterli Susamlı Yumurta Ekmeği,"Kilis usulü zahterli susamlı yumurta ekmeği, yumurtalı karışımı zahter ve susamla buluşturarak çıtır kenarlı, kokulu ve hızlı bir kahvaltı çıkarır.",KAHVALTI,tr,EASY,8,8,16,2,236,Ekmek 4 dilim | Yumurta 2 adet | Zahter 1 tatlı kaşığı | Susam 1 yemek kaşığı,4,1. Ekmek malzemesini dilimleyip hafifçe kızartın. || 2. Ekmek ve Yumurta malzemelerini tavada birlikte çevirin. || 3. Ekmek ve Yumurta karışımını tavada 4-5 dakika pişirip toparlayın. || 4. Ekmek tabanını kısa süre daha ısıtın. || 5. Ekmeklı kahvaltılığı dilimleyip sıcak servis edin.,5,"GLUTEN,YUMURTA,SUSAM","30-dakika-alti,vejetaryen",Ekmeği yumurtaya kısa batırmak dilimlerin fazla yumuşamasını önler.,Sıcak servis edin.,Egg Bread with Zahter and Sesame,This Kilis-style breakfast fries egg-soaked bread with zahter and sesame into a fragrant quick bite.,,,0,0,Eierbrot mit Zahter und Sesam,Dieses Frühstück nach Art aus Kilis brät in Ei getauchtes Brot mit Zahter und Sesam zu einem duftenden schnellen Bissen.,,,0,0
sumakli-nohut-corbasi-mardin-usulu,Sumaklı Nohut Çorbası,"Mardin usulü sumaklı nohut çorbası, nohudu sumak suyu ve soğanla buluşturarak ekşimsi, tok ve baharatlı bir çorba yapar.",CORBA,tr,EASY,10,20,30,4,168,Haşlanmış nohut 2 su bardağı | Sumak suyu 0.5 su bardağı | Soğan 1 adet | Su 4 su bardağı,4,1. Soğanı Sumak suyu öncesi tencerede 2-3 dakika şeffaflaşana kadar çevirin. || 2. Haşlanmış nohut ve Sumak suyu malzemelerini tencereye ekleyin. || 3. Sumak suyu ilave edip çorbayı kaynamaya bırakın. || 4. Haşlanmış nohut iyice yumuşayana kadar 18-22 dakika pişirin. || 5. Çorbayı kaselere paylaştırıp Sumak suyu ile sıcak servis edin.,5,,"tek-tencere,kis-tarifi",Sumak suyunu son bölümde eklemek rengin canlı kalmasına yardımcı olur.,Sıcak servis edin.,Chickpea Soup with Sumac,"This Mardin-style soup simmers chickpeas with sumac and onion into a tangy, spiced winter bowl.",,,0,0,Kichererbsensuppe mit Sumach,Diese Suppe nach Art aus Mardin kocht Kichererbsen mit Sumach und Zwiebel zu einer säuerlichen würzigen Winterschale.,,,0,0
firikli-yesil-mercimekli-kuzu-tava-gaziantep-usulu,Firikli Yeşil Mercimekli Kuzu Tava,"Gaziantep usulü firikli yeşil mercimekli kuzu tava, kuzu etini firik ve mercimekle buluşturarak isli, tok ve kuvvetli bir ana yemek kurar.",YEMEK,tr,MEDIUM,16,22,38,4,338,Kuşbaşı kuzu eti 450 gr | Firik 1 su bardağı | Haşlanmış yeşil mercimek 1 su bardağı | Su 2.5 su bardağı,4,1. Kuşbaşı kuzu eti malzemesini tavada 5-6 dakika kavurun. || 2. Firik malzemesini yıkayıp tencereye ekleyin. || 3. Kuşbaşı kuzu eti üzerine su ilave edip karışımı bir kez çevirin. || 4. Firik yumuşayıp suyunu çekene kadar 14-18 dakika pişirin. || 5. Kuşbaşı kuzu eti pişer pişmez sıcak servis edin.,5,GLUTEN,"misafir-sofrasi,yuksek-protein",Firiği önce kısa kavurmak tavada daha belirgin bir is aroması bırakır.,"Sıcak servis edin, yanında cacık ya da mevsim salatası sunun.",Lamb Skillet with Firik and Green Lentils,"This Gaziantep-style main combines lamb, firik, and green lentils in a smoky, deeply savory pan.",,,0,0,Lammpfanne mit Firik und grünen Linsen,"Dieses Hauptgericht nach Art aus Gaziantep verbindet Lamm, Firik und grüne Linsen in einer rauchigen intensiv herzhaften Pfanne.",,,0,0
pekmezli-cevizli-katmer-kup-sanliurfa-usulu,Pekmezli Cevizli Katmer Kup,"Şanlıurfa usulü pekmezli cevizli katmer kup, ufalanmış katmeri pekmez ve cevizle buluşturarak çıtır, yoğun ve kaşıkla yenilen bir tatlı kurar.",TATLI,tr,EASY,10,0,10,4,256,Katmer 2 adet | Üzüm pekmezi 3 yemek kaşığı | Ceviz 0.5 su bardağı | Kaymak 0.5 su bardağı,4,1. Katmer ve Üzüm pekmezi ile ana karışımı tencerede oluşturun. || 2. Üzüm pekmezi ve Ceviz malzemelerini üst katman için ayrı tutun. || 3. Katmer karışımını kup bardaklara eşit biçimde paylaştırın. || 4. Kaymak ekleyip kupları 20-30 dakika buzdolabında dinlendirin. || 5. Ceviz serpip tatlıyı dolaptan çıkarır çıkarmaz servis edin.,5,"GLUTEN,KUSUYEMIS,SUT",misafir-sofrasi,Katmeri servis öncesi kırmak kup içinde çıtırlığı korur.,"Kupları serin verin, üstüne ceviz serpip kaymak ekleyin.",Katmer Cups with Molasses and Walnuts,This Sanliurfa-style dessert layers crisp katmer with molasses and walnuts into a rich cup sweet.,,,0,0,Katmer-Becher mit Melasse und Walnüssen,Dieses Dessert nach Art aus Sanliurfa schichtet knuspriges Katmer mit Melasse und Walnüssen zu einer reichen Süßigkeit im Becher.,,,0,0
nar-eksili-kuru-domates-salatasi-diyarbakir-usulu,Nar Eksili Kuru Domates Salatası,"Diyarbakır usulü nar eksili kuru domates salatası, kuru domatesi nar ekşisi ve maydanozla buluşturarak yoğun, ekşi ve sofrayı açan bir salata yapar.",SALATA,tr,EASY,10,0,10,4,96,Kuru domates 8 adet | Nar ekşisi 2 yemek kaşığı | Maydanoz 0.5 demet | Zeytinyağı 1 yemek kaşığı,4,"1. Kuru domates malzemesini küp doğrayın. || 2. Nar ekşisi ve Maydanoz malzemelerini ince ince doğrayın. || 3. Nar ekşisi ve Zeytinyağı ile sosu küçük bir kasede çırpın. || 4. Kuru domates, Nar ekşisi ve kalan malzemeleri sosla nazikçe harmanlayın. || 5. Nar ekşisi ekleyip salatayı geniş tabakta soğuk servis edin.",5,,"vegan,30-dakika-alti",Kuru domatesi ılık suda kısa bekletmek daha dengeli bir doku verir.,"Salatayı serin verin, üstüne maydanoz serpip yanında ekmek sunun.",Sun-Dried Tomato Salad with Pomegranate Molasses,This Diyarbakir-style salad tosses dried tomato with pomegranate molasses for a bold tart side.,,,0,0,Salat aus getrockneter Tomate mit Granatapfelsirup,Dieser Salat nach Art aus Diyarbakir mischt getrocknete Tomate mit Granatapfelsirup zu einer kräftigen säuerlichen Beilage.,,,0,0
lorlu-biberli-sembusek-mardin-usulu,Lorlu Biberli Sembusek,"Mardin usulü lorlu biberli sembusek, ince hamuru lor ve biberli harçla buluşturarak kıtır, baharatlı ve paylaşmalık bir hamur işi kurar.",YEMEK,tr,MEDIUM,18,18,36,6,268,Un 2 su bardağı | Lor peyniri 160 gr | Kapya biber 1 adet | Zeytinyağı 2 yemek kaşığı,4,1. Un ve suyla ele yapışmayan bir hamur yoğurun. || 2. Lor ve doğranmış kapya biberi iç için karıştırın. || 3. Hamuru bezeler halinde açıp içi paylaştırın. || 4. Sembusekleri kapatıp kenarlarını iyice bastırın. || 5. Böreği 190°C fırında 18-20 dakika pişirin.,5,"GLUTEN,SUT",misafir-sofrasi,İç harcı kuru tutmak sembuseğin kenarının iyi kapanmasını sağlar.,"Sıcak servis edin, yanına limon dilimi ve maydanoz koyun.",Sembusek with Lor and Peppers,This Mardin-style sembusek fills thin pastry with lor cheese and peppers for a crisp shared bake.,,,0,0,Sembusek mit Lor und Paprika,Dieses Gebäck nach Art aus Mardin füllt dünnen Teig mit Lor-Käse und Paprika zu einem knusprigen Ofenstück zum Teilen.,,,0,0
meyan-koklu-limonata-sanliurfa-usulu,Meyan Köklü Limonata,"Şanlıurfa usulü meyan köklü limonata, limon suyunu meyan kökü özü ve buzla buluşturarak ferah, uzun içimli ve karakterli bir içecek oluşturur.",ICECEK,tr,EASY,8,0,8,4,30,Limon suyu 1 su bardağı | Su 3 su bardağı | Meyan kökü özü 2 yemek kaşığı | Buz 1 su bardağı,4,"1. Meyan Köklü Limonata için limon suyu, şeker ve aromatik tabanı karıştırın. || 2. Meyan Köklü Limonata içeceğine su ekleyip 10 dakika dinlendirerek tadını dengeleyin. || 3. Meyan Köklü Limonata içeceğini süzüp buzla birlikte servis edin.",3,,"alkolsuz,30-dakika-alti,yaz-tarifi",Meyan kökü özünü azar azar eklemek limon tadının dengede kalmasını sağlar.,"Bol buzla sunun, bardağı limon dilimi ve nane ile tamamlayın.",Lemonade with Licorice Root,This Sanliurfa-style lemonade blends lemon and licorice root essence into a cooling long drink.,,,0,0,Limonade mit Süßholzwurzel,Diese Limonade nach Art aus Sanliurfa verbindet Zitrone und Süßholzwurzel-Essenz zu einem kühlenden Longdrink.,,,0,0
isotlu-susamli-patlican-ezmesi-adiyaman-usulu,İsotlu Susamlı Patlıcan Ezmesi,"Adıyaman usulü isotlu susamlı patlıcan ezmesi, köz patlıcanı isot ve susamla buluşturarak isli, yoğun ve ekmek banmalık bir meze kurar.",APERATIF,tr,EASY,10,10,20,4,122,Köz patlıcan 3 adet | İsot 1 tatlı kaşığı | Susam 2 yemek kaşığı | Zeytinyağı 1 yemek kaşığı,4,"1. Köz patlıcanları süzüp kabuk ve çekirdek artıklarını ayıklayın. || 2. Susamı kuru tavada 2 dakika çevirip kokusunu açın. || 3. Patlıcanları isot ve zeytinyağıyla ezin, dokulu kıvamı tamamen kaybetmeyin. || 4. Kavrulmuş susamı ekleyip karıştırın, ezmeyi 10 dakika dinlendirip servis edin.",4,SUSAM,"vegan,30-dakika-alti",Susamı kuru tavada çevirmek ezmeye daha canlı bir aroma verir.,"Serin servis edin, üstüne zeytinyağı gezdirip yanında lavaş sunun.",Eggplant Mash with Isot and Sesame,"This Adiyaman-style meze blends roasted eggplant, isot pepper, and sesame into a smoky spread.",,,0,0,Auberginen-Ezme mit Isot und Sesam,"Diese Meze nach Art aus Adiyaman püriert geröstete Aubergine, Isot und Sesam zu einem rauchigen Aufstrich.",,,0,0
domatesli-tavuklu-firik-pilavi-siirt-usulu,Domatesli Tavuklu Firik Pilavı,"Siirt usulü domatesli tavuklu firik pilavı, tavuğu firik ve domatesle buluşturarak isli, sulu ve tek tencerede pişen bir ana yemek çıkarır.",YEMEK,tr,EASY,12,20,32,4,312,Tavuk göğsü 500 gr | Firik 1.5 su bardağı | Domates rendesi 1 su bardağı | Su 3 su bardağı,4,"1. Tavuk göğsünü küçük küpler halinde doğrayıp 5-6 dakika soteleyin. || 2. Firiği ekleyip 2 dakika kavurun, tane tane kalmasını sağlayın. || 3. Domates rendesini katın, tavukla birlikte 3-4 dakika çevirin. || 4. Suyu döküp kapağı kapatın, pilavı 18-20 dakika kısık ateşte pişirin. || 5. Firik yumuşayınca 10 dakika demlendirip servis edin.",5,GLUTEN,"tek-tencere,yuksek-protein",Firiği önce 2 dakika çevirmek tane yapıyı korumasına yardım eder.,"Pilavi sıcak sunun, yanında yoğurtla ana öğünde servis edin.",Firik Pilaf with Chicken and Tomato,"This Siirt-style main cooks firik, chicken, and tomato together in a smoky juicy pot.",,,0,0,Firik-Pilaw mit Hähnchen und Tomate,"Dieses Hauptgericht nach Art aus Siirt gart Firik, Hähnchen und Tomate gemeinsam in einem rauchigen saftigen Topf.",,,0,0
antep-fistikli-sutlu-irmik-kasesi-gaziantep-usulu,Antep Fıstıklı Sütlü İrmik Kasesi,"Gaziantep usulü Antep fıstıklı sütlü irmik kasesi, irmikli tabanı süt ve Antep fıstığıyla buluşturarak yumuşak, yoğun ve serin bir tatlı oluşturur.",TATLI,tr,EASY,10,10,20,4,236,İrmik 4 yemek kaşığı | Süt 2 su bardağı | Antep fıstığı 0.5 su bardağı | Şeker 3 yemek kaşığı,4,1. İrmik ve Süt ile ana karışımı tencerede oluşturun. || 2. İrmik ve Şeker malzemelerini üst katman için ayrı tutun. || 3. İrmik karışımını kup bardaklara eşit biçimde paylaştırın. || 4. Şeker ekleyip kupları 20-30 dakika buzdolabında dinlendirin. || 5. Şeker serpip tatlıyı dolaptan çıkarır çıkarmaz servis edin.,5,"GLUTEN,SUT,KUSUYEMIS","misafir-sofrasi,vejetaryen",Fıstığı son anda serpmek kasenin üstünde diri bir doku bırakır.,"Kaselerde soğuk verin, üstüne Antep fıstığı serperek çay saatine çıkarın.",Milky Semolina Bowl with Pistachio,"This Gaziantep-style dessert stirs milk, semolina, and pistachio into a cool rich bowl sweet.",,,0,0,Milch-Grieß-Schale mit Pistazie,"Dieses Dessert nach Art aus Gaziantep rührt Milch, Grieß und Pistazie zu einer kühlen reichen Süßigkeit in der Schale.",,,0,0
dereotlu-patates-yumurta-tava-isvec-usulu,Dereotlu Patates Yumurta Tava,"İsveç usulü dereotlu patates yumurta tava, haşlanmış patatesi yumurta ve dereotuyla buluşturarak sıcak, sade ve doyurucu bir kahvaltı kurar.",KAHVALTI,se,EASY,10,10,20,2,238,Haşlanmış patates 2 adet | Yumurta 2 adet | Dereotu 0.25 demet | Tereyağı 1 tatlı kaşığı,4,"1. Haşlanmış patatesleri ince dilimleyin, dereotunu ince kıyın. || 2. Tereyağında patatesleri her yüzü renk alana kadar 6 dakika pişirin. || 3. Patateslerin arasına boşluk açıp yumurtaları tavaya kırın. || 4. Yumurtaları kapağı kapalı tavada 3-4 dakika pişirin. || 5. Dereotunu serpip sıcak halde servis edin.",5,"SUT,YUMURTA","30-dakika-alti,vejetaryen",Patatesi önceden haşlamak tavada altın renk almasını kolaylaştırır.,"Tavayı ılık sunun, üstüne dereotu serperek kahvaltıda servis edin.",Potato and Egg Skillet with Dill,"This Swedish-style breakfast cooks potatoes, eggs, and dill together in a warm simple pan.",,,0,0,Kartoffel-Eier-Pfanne mit Dill,"Dieses Frühstück nach schwedischer Art gart Kartoffeln, Eier und Dill gemeinsam in einer warmen schlichten Pfanne.",,,0,0
hardalli-sari-bezelye-corbasi-isvec-usulu,Hardallı Sarı Bezelye Çorbası,"İsveç usulü hardallı sarı bezelye çorbası, sarı bezelyeyi tane hardal ve soğanla buluşturarak tok, yumuşak ve serin havaya uygun bir çorba yapar.",CORBA,se,EASY,10,24,34,4,182,Haşlanmış sarı bezelye 2 su bardağı | Tane hardal 1 yemek kaşığı | Soğan 1 adet | Su 5 su bardağı,4,1. Soğanı Tane hardal öncesi tencerede 2-3 dakika şeffaflaşana kadar çevirin. || 2. Haşlanmış sarı bezelye ve Tane hardal malzemelerini tencereye ekleyin. || 3. Haşlanmış sarı bezelye üzerine su ilave edip çorbayı kaynamaya bırakın. || 4. Haşlanmış sarı bezelye iyice yumuşayana kadar 18-22 dakika pişirin. || 5. Çorbayı kaselere paylaştırıp Tane hardal ile sıcak servis edin.,5,HARDAL,"tek-tencere,kis-tarifi",Hardalı en son karıştırmak aromanın canlı kalmasına yardım eder.,"Çorbayı sıcak sunun, üstüne tane hardal ekleyip yanında ekmek verin.",Yellow Pea Soup with Mustard,This Swedish-style soup simmers yellow peas with mustard and onion into a hearty winter bowl.,,,0,0,Gelbe-Erbsen-Suppe mit Senf,Diese Suppe nach schwedischer Art kocht gelbe Erbsen mit Senf und Zwiebel zu einer herzhaften Winterschale.,,,0,0
somonlu-arpa-sehriye-tava-isvec-usulu,Somonlu Arpa Şehriye Tava,"İsveç usulü somonlu arpa şehriye tava, somonu arpa şehriye ve dereotuyla buluşturarak kremamsı olmayan, sade ve güçlü bir ana yemek kurar.",YEMEK,se,MEDIUM,14,18,32,4,324,Somon fileto 400 gr | Arpa şehriye 1.5 su bardağı | Dereotu 0.25 demet | Su 3 su bardağı,4,1. Somon fileto malzemesini tavada 5-6 dakika kavurun. || 2. Arpa şehriye malzemesini yıkayıp tencereye ekleyin. || 3. Somon fileto üzerine su ilave edip karışımı bir kez çevirin. || 4. Arpa şehriye yumuşayıp suyunu çekene kadar 14-18 dakika pişirin. || 5. Somon fileto pişer pişmez sıcak servis edin.,5,"GLUTEN,DENIZ_URUNLERI","yuksek-protein,tek-tencere",Somonu son bölümde eklemek tavada parçalanmadan kalmasını sağlar.,Sıcak servis edin.,Salmon Orzo Skillet with Dill,"This Swedish-style main pairs salmon and orzo with dill in a clean, comforting pan dish.",,,0,0,Orzo-Pfanne mit Lachs und Dill,Dieses Hauptgericht nach schwedischer Art verbindet Lachs und Orzo mit Dill zu einem klaren tröstlichen Pfannengericht.,,,0,0
kakuleli-yabanmersinli-kup-isvec-usulu,Kakuleli Yabanmersinli Kup,"İsveç usulü kakuleli yabanmersinli kup, yaban mersinini kakule ve yoğurtlu tabanla buluşturarak serin, hafif ve meyvemsi bir tatlı yapar.",TATLI,se,EASY,8,0,8,4,198,Yoğurt 2 su bardağı | Yaban mersini 1 su bardağı | Bal 2 yemek kaşığı | Kakule 1 çimdik,4,1. Yoğurt ve Yaban mersini ile ana karışımı tencerede oluşturun. || 2. Yaban mersini ve Bal malzemelerini üst katman için ayrı tutun. || 3. Yoğurt karışımını kup bardaklara eşit biçimde paylaştırın. || 4. Kakule ekleyip kupları 20-30 dakika buzdolabında dinlendirin. || 5. Bal serpip tatlıyı dolaptan çıkarır çıkarmaz servis edin.,5,SUT,"vejetaryen,30-dakika-alti",Kakuleyi çok az kullanmak meyvenin önüne geçmeden sıcak bir koku verir.,Soğuk servis edin.,Blueberry Cups with Cardamom,This Swedish-style dessert layers blueberries and cardamom with yogurt for a cool light sweet.,,,0,0,Heidelbeerbecher mit Kardamom,Dieses Dessert nach schwedischer Art schichtet Heidelbeeren und Kardamom mit Joghurt zu einer kühlen leichten Süßigkeit.,,,0,0
lingonberry-tonic-isvec-usulu,Lingonberry Tonic,"İsveç usulü lingonberry tonic, yaban mersini benzeri ekşi meyve özünü tonik ve buzla buluşturarak hafif acı, ferah bir içecek kurar.",ICECEK,se,EASY,6,0,6,2,44,Lingonberry şurubu 0.25 su bardağı | Tonik su 1.5 su bardağı | Limon suyu 1 yemek kaşığı | Buz 1 su bardağı,4,"1. Lingonberry Tonic için bardakları buzla hazırlayın, limon bazını önce ekleyin. || 2. Lingonberry Tonic içine gazlı kısmı sonradan döküp köpüğü söndürmeden hafifçe karıştırın. || 3. Lingonberry Tonic içeceğini bekletmeden serin servis edin.",3,,"alkolsuz,30-dakika-alti",Tonik suyu en son eklemek gazlı yapının korunmasına yardım eder.,"Bol buzla uzun bardakta sunun, içine birkaç lingonberry tanesi bırakın.",Lingonberry Tonic,This Swedish-style drink blends lingonberry syrup and tonic into a crisp gently bitter glass.,,,0,0,Lingonberry-Tonic,Dieses Getränk nach schwedischer Art verbindet Preiselbeer­sirup und Tonic zu einem klaren leicht bitteren Glas.,,,0,0
tvoroglu-biberli-tost-macar-usulu,Tvoroglu Biberli Tost,"Macar usulü tvoroglu biberli tost, kızarmış ekmeği taze peynir ve tatlı biberle buluşturarak hafif, sıcak ve sabah sofrasına uygun bir tabak yapar.",KAHVALTI,hu,EASY,8,6,14,2,228,Ekmek 4 dilim | Tvorog peyniri 150 gr | Tatlı kırmızı biber 1 adet | Tereyağı 1 tatlı kaşığı,4,1. Ekmek malzemesini dilimleyip hafifçe kızartın. || 2. Ekmek ve Tvorog peyniri malzemelerini iç harca karıştırın. || 3. İç harcı Ekmek üzerine yayıp tavada pişirin. || 4. Ekmek kısmını son kez 1-2 dakika ısıtın. || 5. Ekmeklı kahvaltılığı dilimleyip sıcak servis edin.,5,"GLUTEN,SUT","vejetaryen,30-dakika-alti",Biberi ince doğramak tosta daha dengeli dağılmasını sağlar.,Ilık servis edin.,Toast with Tvorog and Sweet Pepper,This Hungarian-style breakfast tops toast with tvorog and sweet pepper for a warm simple plate.,,,0,0,Toast mit Tvorog und Paprika,Dieses Frühstück nach ungarischer Art belegt Toast mit Tvorog und süßer Paprika zu einem warmen schlichten Teller.,,,0,0
